Unclean,Clean,Noise_Pre_Processing,Training_Data,Noise_Post_Processing,Query
"in  archaeologists from italy the united states and egypt excavating a dried up lagoon known as mersa gawasis have unearthed traces of an ancient harbor that once launched early voyages like hatshepsuts punt expedition onto the open ocean some of the sites most evocative evidence for the ancient egyptians seafaring prowess include large ship timbers and hundreds of feet of ropes made from papyrus coiled in huge bundles in  a team of franco egyptian archaeologists discovered what is believed to be the worlds oldest port dating back about  years from the time of king cheops on the red sea coast near wadi el jarf 
",archaeologists italy united states egypt excavating dried lagoon known mersa gawasis unearthed traces ancient harbor launched early voyages like hatshepsuts punt expedition open ocean sites evocative evidence ancient egyptians seafaring prowess include large ship timbers hundreds feet ropes papyrus coiled huge bundles team franco egyptian archaeologists discovered believed worlds oldest port dating years time king cheops red sea coast near wadi el jarf,6.62,"archaeologists,italy,united,states,egypt,excavating,dried,lagoon,known,mersa,gawasis,unearthed,traces,ancient,harbor,launched,early,voyages,like,hatshepsuts,punt,expedition,open,ocean,sites,evocative,evidence,ancient,egyptians,seafaring,prowess,include,large,ship,timbers,hundreds,feet,ropes,papyrus,coiled,huge,bundles,team,franco,egyptian,archaeologists,discovered,believed,worlds,oldest,port,dating,years,time,king,cheops,red,sea,coast,near,wadi,el,jarf",0.00,egypt
"in  the dna of the th dynasty mummies of ramesses iii and another mummy believed to be ramesses iiis son pentawer were analyzed by albert zink yehia z gad and a team of researchers under zahi hawass then secretary general of the supreme council of antiquities egypt genetic kinship analyses revealed identical haplotypes in both mummies using the whit atheys haplogroup predictor they identified the y chromosomal haplogroup eba 
",dna th dynasty mummies ramesses iii mummy believed ramesses iiis son pentawer analyzed albert zink yehia z gad team researchers zahi hawass secretary general supreme council antiquities egypt genetic kinship analyses revealed identical haplotypes mummies whit atheys haplogroup predictor identified chromosomal haplogroup eba,6.05,"dna,th,dynasty,mummies,ramesses,iii,mummy,believed,ramesses,iiis,son,pentawer,analyzed,albert,zink,yehia,z,gad,team,researchers,zahi,hawass,secretary,general,supreme,council,antiquities,egypt,genetic,kinship,analyses,revealed,identical,haplotypes,mummies,whit,atheys,haplogroup,predictor,identified,chromosomal,haplogroup,eba",0.00,egypt
"in  a team led by researchers from the university of tuebingen and the max planck institute for the science of human history in jena tested the maternal dna  of  mummies from abusir el meleq in northern egypt  which was the first reliable data using high throughput dna sequencing methods additionally three of the mummies were also analyzed for y dna two were assigned to west asian j and one to haplogroup ebb both common in north africa the researchers cautioned that the affinities of the examined ancient egyptian specimens may not be representative of those of all ancient egyptians since they were from a single archaeological site whilst not conclusive since the few relatively older mummies only go back to the thth dynasty the rest being from then up to late roman period the authors of this study said the abusir el meleq mummies closely resembled ancient and modern near eastern populations especially those in the levant the genetics of the mummies remained remarkably consistent within this range even as different powersincluding nubians greeks and romansconquered the empire a wide range of mtdna haplogroups were found including clades of j you h hv m r r k t l i n x w the authors of the study noted that the mummies at abusir el meleq have  maternal sub saharan dna while modern egyptians have a little more sub saharan ancestry  to  suggesting some degree of influx after the end of the empire other genetic studies show greater levels of sub saharan african ancestry in modern southern egyptian populations and anticipate that mummies from southern egypt would show greater levels of sub saharan african ancestry
",team led researchers university tuebingen max planck institute science human history jena tested maternal dna mummies abusir el meleq northern egypt reliable data high throughput dna sequencing methods additionally mummies analyzed dna assigned west asian j haplogroup ebb common north africa researchers cautioned affinities examined ancient egyptian specimens representative ancient egyptians single archaeological site whilst conclusive relatively older mummies thth dynasty rest late roman period authors study said abusir el meleq mummies closely resembled ancient modern near eastern populations especially levant genetics mummies remained remarkably consistent range different powersincluding nubians greeks romansconquered empire wide range mtdna haplogroups found including clades j h hv r r k l n x w authors study noted mummies abusir el meleq maternal sub saharan dna modern egyptians little sub saharan ancestry suggesting degree influx end empire genetic studies greater levels sub saharan african ancestry modern southern egyptian populations anticipate mummies southern egypt greater levels sub saharan african ancestry,7.41,"team,led,researchers,university,tuebingen,max,planck,institute,science,human,history,jena,tested,maternal,dna,mummies,abusir,el,meleq,northern,egypt,reliable,data,high,throughput,dna,sequencing,methods,additionally,mummies,analyzed,dna,assigned,west,asian,j,haplogroup,ebb,common,north,africa,researchers,cautioned,affinities,examined,ancient,egyptian,specimens,representative,ancient,egyptians,single,archaeological,site,whilst,conclusive,relatively,older,mummies,thth,dynasty,rest,late,roman,period,authors,study,said,abusir,el,meleq,mummies,closely,resembled,ancient,modern,near,eastern,populations,especially,levant,genetics,mummies,remained,remarkably,consistent,range,different,powersincluding,nubians,greeks,romansconquered,empire,wide,range,mtdna,haplogroups,found,including,clades,j,h,hv,r,r,k,l,n,x,w,authors,study,noted,mummies,abusir,el,meleq,maternal,sub,saharan,dna,modern,egyptians,little,sub,saharan,ancestry,suggesting,degree,influx,end,empire,genetic,studies,greater,levels,sub,saharan,african,ancestry,modern,southern,egyptian,populations,anticipate,mummies,southern,egypt,greater,levels,sub,saharan,african,ancestry",0.00,egypt
"gourdine anselin and keita criticised the methodology of the scheunemann et al study and argued that the sub saharan genetic affinities may be attributed to early settlers and the relevant sub saharan genetic markers do not correspond with the geography of known trade routes in  danielle candelora noted several limitations with the  scheunemann et al study such as its untested sampling methods small sample size and problematic comparative data which she argued had been misused to legitimise racist conceptions of ancient egypt with scientific evidence
",gourdine anselin keita criticised methodology scheunemann et al study argued sub saharan genetic affinities attributed early settlers relevant sub saharan genetic markers correspond geography known trade routes danielle candelora noted limitations scheunemann et al study untested sampling methods small sample size problematic comparative data argued misused legitimise racist conceptions ancient egypt scientific evidence,5.75,"gourdine,anselin,keita,criticised,methodology,scheunemann,et,al,study,argued,sub,saharan,genetic,affinities,attributed,early,settlers,relevant,sub,saharan,genetic,markers,correspond,geography,known,trade,routes,danielle,candelora,noted,limitations,scheunemann,et,al,study,untested,sampling,methods,small,sample,size,problematic,comparative,data,argued,misused,legitimise,racist,conceptions,ancient,egypt,scientific,evidence",0.00,egypt
"in  the  year old mummified head of djehutynakht a governor in the middle kingdom of the th or th dynasty was analyzed for mitochondrial dna the sequence of the mummy most closely resembles a ua lineage from sample jk a much more recent  year old skeleton from the abusir el meleq site in egypt although no direct matches to the djehutynakht sequence have been reported
 haplogroup you is also found in modern day berbers from the siwa oasis in egypt a  article by c coudray the complex and diversified mitochondrial gene pool of berber populations recorded haplogroup you at  for the siwa whereas haplogroup you is more common in other berber populations to the west of egypt
",year old mummified head djehutynakht governor middle kingdom th th dynasty analyzed mitochondrial dna sequence mummy closely resembles ua lineage sample jk recent year old skeleton abusir el meleq site egypt direct matches djehutynakht sequence reported haplogroup found modern day berbers siwa oasis egypt article c coudray complex diversified mitochondrial gene pool berber populations recorded haplogroup siwa haplogroup common berber populations west egypt,7.98,"year,old,mummified,head,djehutynakht,governor,middle,kingdom,th,th,dynasty,analyzed,mitochondrial,dna,sequence,mummy,closely,resembles,ua,lineage,sample,jk,recent,year,old,skeleton,abusir,el,meleq,site,egypt,direct,matches,djehutynakht,sequence,reported,haplogroup,found,modern,day,berbers,siwa,oasis,egypt,article,c,coudray,complex,diversified,mitochondrial,gene,pool,berber,populations,recorded,haplogroup,siwa,haplogroup,common,berber,populations,west,egypt",0.00,egypt
"the culture and monuments of ancient egypt have left a lasting legacy on the world egyptian civilization significantly influenced the kingdom of kush and mero with both adopting egyptian religious and architectural norms  were built in egyptsudan as well as using egyptian writing as the basis of the meroitic script meroitic is the oldest written language in africa other than egyptian and was used from the nd century because until the early th century ad the cult of the goddess isis for example became popular in the roman empire as obelisks and other relics were transported back to rome the romans also imported building materials from egypt to erect egyptian style structures early historians such as herodotus strabo and diodorus siculus studied and wrote about the land which romans came to view as a place of mystery
",culture monuments ancient egypt left lasting legacy world egyptian civilization significantly influenced kingdom kush mero adopting egyptian religious architectural norms built egyptsudan egyptian writing basis meroitic script meroitic oldest written language africa egyptian nd century early th century ad cult goddess isis example popular roman empire obelisks relics transported rome romans imported building materials egypt erect egyptian style structures early historians herodotus strabo diodorus siculus studied wrote land romans came view place mystery,7.74,"culture,monuments,ancient,egypt,left,lasting,legacy,world,egyptian,civilization,significantly,influenced,kingdom,kush,mero,adopting,egyptian,religious,architectural,norms,built,egyptsudan,egyptian,writing,basis,meroitic,script,meroitic,oldest,written,language,africa,egyptian,nd,century,early,th,century,ad,cult,goddess,isis,example,popular,roman,empire,obelisks,relics,transported,rome,romans,imported,building,materials,egypt,erect,egyptian,style,structures,early,historians,herodotus,strabo,diodorus,siculus,studied,wrote,land,romans,came,view,place,mystery",0.00,egypt
"during the middle ages and the renaissance egyptian pagan culture was in decline after the rise of christianity and later islam but interest in egyptian antiquity continued in the writings of medieval scholars such as dhul nun al misri and al maqrizi in the seventeenth and eighteenth centuries european travelers and tourists brought back antiquities and wrote stories of their journeys leading to a wave of egyptomania across europe as evident in symbolism like the eye of providence and the great seal of the united states this renewed interest sent collectors to egypt who took purchased or were given many important antiquities napoleon arranged the first studies in egyptology when he brought some  scientists and artists to study and document egypts natural history which was published in the description de lgypte
",middle ages renaissance egyptian pagan culture decline rise christianity later islam interest egyptian antiquity continued writings medieval scholars dhul nun al misri al maqrizi seventeenth eighteenth centuries european travelers tourists brought antiquities wrote stories journeys leading wave egyptomania europe evident symbolism like eye providence great seal united states renewed interest sent collectors egypt took purchased given important antiquities napoleon arranged studies egyptology brought scientists artists study document egypts natural history published description de lgypte,6.93,"middle,ages,renaissance,egyptian,pagan,culture,decline,rise,christianity,later,islam,interest,egyptian,antiquity,continued,writings,medieval,scholars,dhul,nun,al,misri,al,maqrizi,seventeenth,eighteenth,centuries,european,travelers,tourists,brought,antiquities,wrote,stories,journeys,leading,wave,egyptomania,europe,evident,symbolism,like,eye,providence,great,seal,united,states,renewed,interest,sent,collectors,egypt,took,purchased,given,important,antiquities,napoleon,arranged,studies,egyptology,brought,scientists,artists,study,document,egypts,natural,history,published,description,de,lgypte",0.00,egypt
