Unclean,Clean,Noise_Pre_Processing,Training_Data,Noise_Post_Processing,Query
"following the death of ramesses xi in  because smendes assumed authority over the northern part of egypt ruling from the city of tanis the south was effectively controlled by the high priests of amun at thebes who recognized smendes in name only during this time libyans had been settling in the western delta and chieftains of these settlers began increasing their autonomy libyan princes took control of the delta under shoshenq i in  because founding the so called libyan or bubastite dynasty that would rule for some  years shoshenq also gained control of southern egypt by placing his family members in important priestly positions libyan control began to erode as a rival dynasty in the delta arose in leontopolis and kushites threatened from the south
",following death ramesses xi smendes assumed authority northern egypt ruling city tanis south effectively controlled high priests amun thebes recognized smendes time libyans settling western delta chieftains settlers began increasing autonomy libyan princes took control delta shoshenq founding called libyan bubastite dynasty rule years shoshenq gained control southern egypt placing family members important priestly positions libyan control began erode rival dynasty delta arose leontopolis kushites threatened south,7.64,"following,death,ramesses,xi,smendes,assumed,authority,northern,egypt,ruling,city,tanis,south,effectively,controlled,high,priests,amun,thebes,recognized,smendes,time,libyans,settling,western,delta,chieftains,settlers,began,increasing,autonomy,libyan,princes,took,control,delta,shoshenq,founding,called,libyan,bubastite,dynasty,rule,years,shoshenq,gained,control,southern,egypt,placing,family,members,important,priestly,positions,libyan,control,began,erode,rival,dynasty,delta,arose,leontopolis,kushites,threatened,south",0.00,egypt
"egypts far reaching prestige declined considerably toward the end of the third intermediate period its foreign allies had fallen under the assyrian sphere of influence and by  because war between the two states became inevitable between  and  because the assyrians began the assyrian conquest of egypt the reigns of both taharqa and his successor tanutamun were filled with constant conflict with the assyrians against whom egypt enjoyed several victories ultimately the assyrians pushed the kushites back into nubia occupied memphis and sacked the temples of thebes
",egypts far reaching prestige declined considerably end intermediate period foreign allies fallen assyrian sphere influence war states inevitable assyrians began assyrian conquest egypt reigns taharqa successor tanutamun filled constant conflict assyrians egypt enjoyed victories ultimately assyrians pushed kushites nubia occupied memphis sacked temples thebes,7.41,"egypts,far,reaching,prestige,declined,considerably,end,intermediate,period,foreign,allies,fallen,assyrian,sphere,influence,war,states,inevitable,assyrians,began,assyrian,conquest,egypt,reigns,taharqa,successor,tanutamun,filled,constant,conflict,assyrians,egypt,enjoyed,victories,ultimately,assyrians,pushed,kushites,nubia,occupied,memphis,sacked,temples,thebes",0.00,egypt
"the assyrians left control of egypt to a series of vassals who became known as the saite kings of the twenty sixth dynasty by  because the saite king psamtik i was able to oust the assyrians with the help of greek mercenaries who were recruited to form egypts first navy greek influence expanded greatly as the city state of naucratis became the home of greeks in the nile delta the saite kings based in the new capital of sais witnessed a brief but spirited resurgence in the economy and culture but in  because the powerful persians led by cambyses ii began their conquest of egypt eventually capturing the pharaoh psamtik iii at the battle of pelusium cambyses ii then assumed the formal title of pharaoh but ruled egypt from iran leaving egypt under the control of a satrap a few successful revolts against the persians marked the th century because but egypt was never able to permanently overthrow the persians
",assyrians left control egypt series vassals known saite kings sixth dynasty saite king psamtik able oust assyrians help greek mercenaries recruited form egypts navy greek influence expanded greatly city state naucratis home greeks nile delta saite kings based new capital sais witnessed brief spirited resurgence economy culture powerful persians led cambyses ii began conquest egypt eventually capturing pharaoh psamtik iii battle pelusium cambyses ii assumed formal title pharaoh ruled egypt iran leaving egypt control satrap successful revolts persians marked th centurybecause egypt able permanently overthrow persians,8.07,"assyrians,left,control,egypt,series,vassals,known,saite,kings,sixth,dynasty,saite,king,psamtik,able,oust,assyrians,help,greek,mercenaries,recruited,form,egypts,navy,greek,influence,expanded,greatly,city,state,naucratis,home,greeks,nile,delta,saite,kings,based,new,capital,sais,witnessed,brief,spirited,resurgence,economy,culture,powerful,persians,led,cambyses,ii,began,conquest,egypt,eventually,capturing,pharaoh,psamtik,iii,battle,pelusium,cambyses,ii,assumed,formal,title,pharaoh,ruled,egypt,iran,leaving,egypt,control,satrap,successful,revolts,persians,marked,th,centurybecause,egypt,able,permanently,overthrow,persians",0.00,egypt
"following its annexation by persia egypt was joined with cyprus and phoenicia in the sixth satrapy of the achaemenid persian empire this first period of persian rule over egypt also known as the twenty seventh dynasty ended in  because when egypt regained independence under a series of native dynasties the last of these dynasties the thirtieth proved to be the last native royal house of ancient egypt ending with the kingship of nectanebo ii a brief restoration of persian rule sometimes known as the thirty first dynasty began in  because but shortly after in  because the persian ruler mazaces handed egypt over to alexander the great without a fight
",following annexation persia egypt joined cyprus phoenicia sixth satrapy achaemenid persian empire period persian rule egypt known seventh dynasty ended egypt regained independence series native dynasties dynasties thirtieth proved native royal house ancient egypt ending kingship nectanebo ii brief restoration persian rule known thirty dynasty began shortly persian ruler mazaces handed egypt alexander great fight,8.23,"following,annexation,persia,egypt,joined,cyprus,phoenicia,sixth,satrapy,achaemenid,persian,empire,period,persian,rule,egypt,known,seventh,dynasty,ended,egypt,regained,independence,series,native,dynasties,dynasties,thirtieth,proved,native,royal,house,ancient,egypt,ending,kingship,nectanebo,ii,brief,restoration,persian,rule,known,thirty,dynasty,began,shortly,persian,ruler,mazaces,handed,egypt,alexander,great,fight",0.00,egypt
"in  because alexander the great conquered egypt with little resistance from the persians and was welcomed by the egyptians as a deliverer the administration established by alexanders successors the macedonian ptolemaic kingdom was based on an egyptian model and based in the new capital city of alexandria the city showcased the power and prestige of hellenistic rule and became a seat of learning and culture centered at the famous library of alexandria the lighthouse of alexandria lit the way for the many ships that kept trade flowing through the cityas the ptolemies made commerce and revenue generating enterprises such as papyrus manufacturing their top priority
",alexander great conquered egypt little resistance persians welcomed egyptians deliverer administration established alexanders successors macedonian ptolemaic kingdom based egyptian model based new capital city alexandria city showcased power prestige hellenistic rule seat learning culture centered famous library alexandria lighthouse alexandria lit way ships kept trade flowing cityas ptolemies commerce revenue generating enterprises papyrus manufacturing priority,7.46,"alexander,great,conquered,egypt,little,resistance,persians,welcomed,egyptians,deliverer,administration,established,alexanders,successors,macedonian,ptolemaic,kingdom,based,egyptian,model,based,new,capital,city,alexandria,city,showcased,power,prestige,hellenistic,rule,seat,learning,culture,centered,famous,library,alexandria,lighthouse,alexandria,lit,way,ships,kept,trade,flowing,cityas,ptolemies,commerce,revenue,generating,enterprises,papyrus,manufacturing,priority",0.00,egypt
"hellenistic culture did not supplant native egyptian culture as the ptolemies supported time honored traditions in an effort to secure the loyalty of the populace they built new temples in egyptian style supported traditional cults and portrayed themselves as pharaohs some traditions merged as greek and egyptian gods were syncretized into composite deities such as serapis and classical greek forms of sculpture influenced traditional egyptian motifs despite their efforts to appease the egyptians the ptolemies were challenged by native rebellion bitter family rivalries and the powerful mob of alexandria that formed after the death of ptolemy iv in addition as rome relied more heavily on imports of grain from egypt the romans took great interest in the political situation in the country continued egyptian revolts ambitious politicians and powerful opponents from the near east made this situation unstable leading rome to send forces to secure the country as a province of its empire
",hellenistic culture supplant native egyptian culture ptolemies supported time honored traditions effort secure loyalty populace built new temples egyptian style supported traditional cults portrayed pharaohs traditions merged greek egyptian gods syncretized composite deities serapis classical greek forms sculpture influenced traditional egyptian motifs despite efforts appease egyptians ptolemies challenged native rebellion bitter family rivalries powerful mob alexandria formed death ptolemy iv addition rome relied heavily imports grain egypt romans took great interest political situation country continued egyptian revolts ambitious politicians powerful opponents near east situation unstable leading rome send forces secure country province empire,6.04,"hellenistic,culture,supplant,native,egyptian,culture,ptolemies,supported,time,honored,traditions,effort,secure,loyalty,populace,built,new,temples,egyptian,style,supported,traditional,cults,portrayed,pharaohs,traditions,merged,greek,egyptian,gods,syncretized,composite,deities,serapis,classical,greek,forms,sculpture,influenced,traditional,egyptian,motifs,despite,efforts,appease,egyptians,ptolemies,challenged,native,rebellion,bitter,family,rivalries,powerful,mob,alexandria,formed,death,ptolemy,iv,addition,rome,relied,heavily,imports,grain,egypt,romans,took,great,interest,political,situation,country,continued,egyptian,revolts,ambitious,politicians,powerful,opponents,near,east,situation,unstable,leading,rome,send,forces,secure,country,province,empire",0.00,egypt
"egypt became a province of the roman empire in  because following the defeat of mark antony and ptolemaic queen cleopatra vii by octavian  in the battle of actium the romans relied heavily on grain shipments from egypt and the roman army under the control of a prefect appointed by the emperor quelled rebellions strictly enforced the collection of heavy taxes and prevented attacks by bandits which had become a notorious problem during the period alexandria became an increasingly important center on the trade route with the orient as exotic luxuries were in high demand in rome
",egypt province roman empire following defeat mark antony ptolemaic queen cleopatra vii octavian battle actium romans relied heavily grain shipments egypt roman army control prefect appointed emperor quelled rebellions strictly enforced collection heavy taxes prevented attacks bandits notorious problem period alexandria increasingly important center trade route orient exotic luxuries high demand rome,7.56,"egypt,province,roman,empire,following,defeat,mark,antony,ptolemaic,queen,cleopatra,vii,octavian,battle,actium,romans,relied,heavily,grain,shipments,egypt,roman,army,control,prefect,appointed,emperor,quelled,rebellions,strictly,enforced,collection,heavy,taxes,prevented,attacks,bandits,notorious,problem,period,alexandria,increasingly,important,center,trade,route,orient,exotic,luxuries,high,demand,rome",0.00,egypt
"although the romans had a more hostile attitude than the greeks towards the egyptians some traditions such as mummification and worship of the traditional gods continued the art of mummy portraiture flourished and some roman emperors had themselves depicted as pharaohs though not to the extent that the ptolemies had the former lived outside egypt and did not perform the ceremonial functions of egyptian kingship local administration became roman in style and closed to native egyptians
",romans hostile attitude greeks egyptians traditions mummification worship traditional gods continued art mummy portraiture flourished roman emperors depicted pharaohs extent ptolemies lived outside egypt perform ceremonial functions egyptian kingship local administration roman style closed native egyptians,8.18,"romans,hostile,attitude,greeks,egyptians,traditions,mummification,worship,traditional,gods,continued,art,mummy,portraiture,flourished,roman,emperors,depicted,pharaohs,extent,ptolemies,lived,outside,egypt,perform,ceremonial,functions,egyptian,kingship,local,administration,roman,style,closed,native,egyptians",0.00,egypt
"from the mid first century ad christianity took root in egypt and it was originally seen as another cult that could be accepted however it was an uncompromising religion that sought to win converts from the pagan egyptian and greco roman religions and threatened popular religious traditions this led to the persecution of converts to christianity culminating in the great purges of diocletian starting in  but eventually christianity won out in  the christian emperor theodosius introduced legislation that banned pagan rites and closed temples alexandria became the scene of great anti pagan riots with public and private religious imagery destroyed as a consequence egypts native religious culture was continually in decline while the native population continued to speak their language the ability to read hieroglyphic writing slowly disappeared as the role of the egyptian temple priests and priestesses diminished the temples themselves were sometimes converted to churches or abandoned to the desert
",mid century ad christianity took root egypt originally seen cult accepted uncompromising religion sought win converts pagan egyptian greco roman religions threatened popular religious traditions led persecution converts christianity culminating great purges diocletian starting eventually christianity christian emperor theodosius introduced legislation banned pagan rites closed temples alexandria scene great anti pagan riots public private religious imagery destroyed consequence egypts native religious culture continually decline native population continued speak language ability read hieroglyphic writing slowly disappeared role egyptian temple priests priestesses diminished temples converted churches abandoned desert,6.55,"mid,century,ad,christianity,took,root,egypt,originally,seen,cult,accepted,uncompromising,religion,sought,win,converts,pagan,egyptian,greco,roman,religions,threatened,popular,religious,traditions,led,persecution,converts,christianity,culminating,great,purges,diocletian,starting,eventually,christianity,christian,emperor,theodosius,introduced,legislation,banned,pagan,rites,closed,temples,alexandria,scene,great,anti,pagan,riots,public,private,religious,imagery,destroyed,consequence,egypts,native,religious,culture,continually,decline,native,population,continued,speak,language,ability,read,hieroglyphic,writing,slowly,disappeared,role,egyptian,temple,priests,priestesses,diminished,temples,converted,churches,abandoned,desert",0.00,egypt
"in the fourth century as the roman empire divided egypt found itself in the eastern empire with its capital at constantinople in the waning years of the empire egypt fell to the sasanian persian army in the sasanian conquest of egypt  it was then recaptured by the byzantine emperor heraclius  and was finally captured by muslim rashidun army in  ending byzantine rule
",fourth century roman empire divided egypt found eastern empire capital constantinople waning years empire egypt fell sasanian persian army sasanian conquest egypt recaptured byzantine emperor heraclius finally captured muslim rashidun army ending byzantine rule,7.59,"fourth,century,roman,empire,divided,egypt,found,eastern,empire,capital,constantinople,waning,years,empire,egypt,fell,sasanian,persian,army,sasanian,conquest,egypt,recaptured,byzantine,emperor,heraclius,finally,captured,muslim,rashidun,army,ending,byzantine,rule",0.00,egypt
"much of the economy was centrally organized and strictly controlled although the ancient egyptians did not use coinage until the late period they did use a type of money barter system with standard sacks of grain and the deben a weight of roughly  grams  of copper or silver forming a common denominator workers were paid in grain a simple laborer might earn  sacks  of grain per month while a foreman might earn  sacks  prices were fixed across the country and recorded in lists to facilitate trading for example a shirt cost five copper deben while a cow cost  deben grain could be traded for other goods according to the fixed price list during the fifth century because coined money was introduced into egypt from abroad at first the coins were used as standardized pieces of precious metal rather than true money but in the following centuries international traders came to rely on coinage
",economy centrally organized strictly controlled ancient egyptians use coinage late period use type money barter system standard sacks grain deben weight roughly grams copper silver forming common denominator workers paid grain simple laborer earn sacks grain month foreman earn sacks prices fixed country recorded lists facilitate trading example shirt cost copper deben cow cost deben grain traded goods according fixed price list fifth centurybecause coined money introduced egypt abroad coins standardized pieces precious metal true money following centuries international traders came rely coinage,7.82,"economy,centrally,organized,strictly,controlled,ancient,egyptians,use,coinage,late,period,use,type,money,barter,system,standard,sacks,grain,deben,weight,roughly,grams,copper,silver,forming,common,denominator,workers,paid,grain,simple,laborer,earn,sacks,grain,month,foreman,earn,sacks,prices,fixed,country,recorded,lists,facilitate,trading,example,shirt,cost,copper,deben,cow,cost,deben,grain,traded,goods,according,fixed,price,list,fifth,centurybecause,coined,money,introduced,egypt,abroad,coins,standardized,pieces,precious,metal,true,money,following,centuries,international,traders,came,rely,coinage",0.00,egypt
"egyptian society was highly stratified and social status was expressly displayed farmers made up the bulk of the population but agricultural produce was owned directly by the state temple or noble family that owned the land farmers were also subject to a labor tax and were required to work on irrigation or construction projects in a corve system artists and craftsmen were of higher status than farmers but they were also under state control working in the shops attached to the temples and paid directly from the state treasury scribes and officials formed the upper class in ancient egypt known as the white kilt class in reference to the bleached linen garments that served as a mark of their rank the upper class prominently displayed their social status in art and literature below the nobility were the priests physicians and engineers with specialized training in their field it is unclear whether slavery as understood today existed in ancient egypt there is difference of opinions among authors
",egyptian society highly stratified social status expressly displayed farmers bulk population agricultural produce owned directly state temple noble family owned land farmers subject labor tax required work irrigation construction projects corve system artists craftsmen higher status farmers state control working shops attached temples paid directly state treasury scribes officials formed upper class ancient egypt known white kilt class reference bleached linen garments served mark rank upper class prominently displayed social status art literature nobility priests physicians engineers specialized training field unclear slavery understood today existed ancient egypt difference opinions authors,7.55,"egyptian,society,highly,stratified,social,status,expressly,displayed,farmers,bulk,population,agricultural,produce,owned,directly,state,temple,noble,family,owned,land,farmers,subject,labor,tax,required,work,irrigation,construction,projects,corve,system,artists,craftsmen,higher,status,farmers,state,control,working,shops,attached,temples,paid,directly,state,treasury,scribes,officials,formed,upper,class,ancient,egypt,known,white,kilt,class,reference,bleached,linen,garments,served,mark,rank,upper,class,prominently,displayed,social,status,art,literature,nobility,priests,physicians,engineers,specialized,training,field,unclear,slavery,understood,today,existed,ancient,egypt,difference,opinions,authors",0.00,egypt
"the head of the legal system was officially the pharaoh who was responsible for enacting laws delivering justice and maintaining law and order a concept the ancient egyptians referred to as maat although no legal codes from ancient egypt survive court documents show that egyptian law was based on a common sense view of right and wrong that emphasized reaching agreements and resolving conflicts rather than strictly adhering to a complicated set of statutes local councils of elders known as kenbet in the new kingdom were responsible for ruling in court cases involving small claims and minor disputes more serious cases involving murder major land transactions and tomb robbery were referred to the great kenbet over which the vizier or pharaoh presided plaintiffs and defendants were expected to represent themselves and were required to swear an oath that they had told the truth in some cases the state took on both the role of prosecutor and judge and it could torture the accused with beatings to obtain a confession and the names of any co conspirators whether the charges were trivial or serious court scribes documented the complaint testimony and verdict of the case for future reference
",head legal system officially pharaoh responsible enacting laws delivering justice maintaining law order concept ancient egyptians referred maat legal codes ancient egypt survive court documents egyptian law based common sense view right wrong emphasized reaching agreements resolving conflicts strictly adhering complicated set statutes local councils elders known kenbet new kingdom responsible ruling court cases involving small claims minor disputes cases involving murder major land transactions tomb robbery referred great kenbet vizier pharaoh presided plaintiffs defendants expected represent required swear oath told truth cases state took role prosecutor judge torture accused beatings obtain confession names co conspirators charges trivial court scribes documented complaint testimony verdict case future reference,7.49,"head,legal,system,officially,pharaoh,responsible,enacting,laws,delivering,justice,maintaining,law,order,concept,ancient,egyptians,referred,maat,legal,codes,ancient,egypt,survive,court,documents,egyptian,law,based,common,sense,view,right,wrong,emphasized,reaching,agreements,resolving,conflicts,strictly,adhering,complicated,set,statutes,local,councils,elders,known,kenbet,new,kingdom,responsible,ruling,court,cases,involving,small,claims,minor,disputes,cases,involving,murder,major,land,transactions,tomb,robbery,referred,great,kenbet,vizier,pharaoh,presided,plaintiffs,defendants,expected,represent,required,swear,oath,told,truth,cases,state,took,role,prosecutor,judge,torture,accused,beatings,obtain,confession,names,co,conspirators,charges,trivial,court,scribes,documented,complaint,testimony,verdict,case,future,reference",0.00,egypt
"a combination of favorable geographical features contributed to the success of ancient egyptian culture the most important of which was the rich fertile soil resulting from annual inundations of the nile river the ancient egyptians were thus able to produce an abundance of food allowing the population to devote more time and resources to cultural technological and artistic pursuits land management was crucial in ancient egypt because taxes were assessed based on the amount of land a person owned
",combination favorable geographical features contributed success ancient egyptian culture important rich fertile soil resulting annual inundations nile river ancient egyptians able produce abundance food allowing population devote time resources cultural technological artistic pursuits land management crucial ancient egypt taxes assessed based land person owned,6.99,"combination,favorable,geographical,features,contributed,success,ancient,egyptian,culture,important,rich,fertile,soil,resulting,annual,inundations,nile,river,ancient,egyptians,able,produce,abundance,food,allowing,population,devote,time,resources,cultural,technological,artistic,pursuits,land,management,crucial,ancient,egypt,taxes,assessed,based,land,person,owned",0.00,egypt
