Unclean,Clean,Noise_Pre_Processing,Training_Data,Noise_Post_Processing,Query
"development such as border fencing along the indiabangladesh border has become a major impediment to the free movement of elephants in assam more than  humans and  elephants died as a result of human elephant conflict between  and  in india alone over  people are killed by elephants every year and  to  million hectares are damaged affecting at least  families across the country moreover elephants are known to destroy crops worth up to us million annually this has major impacts on the welfare and livelihoods of local communities as well as the future conservation of this species in countries like bangladesh and sri lanka the asian elephant is one of the most feared wild animals even though they are less deadly than other local animals such as venomous snakes  as a whole asian elephants display highly sophisticated and sometimes unpredictable behaviour most untamed elephants try to avoid humans but if they are caught off guard by any perceived physical threat including humans they will likely charge this is especially true of males in musth and of females with young gunfire and other similar methods of deterring which are known to be effective against many kinds of wild animals including tigers may or may not work with elephants and can even worsen the situation elephants that have been abused by humans in the past often become rogue elephants which regularly attack people with no provocation
",development border fencing indiabangladesh border major impediment free movement elephants assam humans elephants died result human elephant conflict india people killed elephants year million hectares damaged affecting families country elephants known destroy crops worth million annually major impacts welfare livelihoods local communities future conservation species countries like bangladesh sri lanka asian elephant feared wild animals deadly local animals venomous snakes asian elephants display highly sophisticated unpredictable behaviour untamed elephants try avoid humans caught guard perceived physical threat including humans likely charge especially true males musth females young gunfire similar methods deterring known effective kinds wild animals including tigers work elephants worsen situation elephants abused humans past rogue elephants regularly attack people provocation,8.49,"development,border,fencing,indiabangladesh,border,major,impediment,free,movement,elephants,assam,humans,elephants,died,result,human,elephant,conflict,india,people,killed,elephants,year,million,hectares,damaged,affecting,families,country,elephants,known,destroy,crops,worth,million,annually,major,impacts,welfare,livelihoods,local,communities,future,conservation,species,countries,like,bangladesh,sri,lanka,asian,elephant,feared,wild,animals,deadly,local,animals,venomous,snakes,asian,elephants,display,highly,sophisticated,unpredictable,behaviour,untamed,elephants,try,avoid,humans,caught,guard,perceived,physical,threat,including,humans,likely,charge,especially,true,males,musth,females,young,gunfire,similar,methods,deterring,known,effective,kinds,wild,animals,including,tigers,work,elephants,worsen,situation,elephants,abused,humans,past,rogue,elephants,regularly,attack,people,provocation",0.00,elephant
"up to the early s vietnamese ivory craftsmen used exclusively asian elephant ivory from vietnam and neighbouring lao and cambodia before  there were few tourists and the low demand for worked ivory could be supplied by domestic elephants economic liberalisation and an increase in tourism raised both local and visitors demands for worked ivory which resulted in heavy poaching
",early vietnamese ivory craftsmen exclusively asian elephant ivory vietnam neighbouring lao cambodia tourists low demand worked ivory supplied domestic elephants economic liberalisation increase tourism raised local visitors demands worked ivory resulted heavy poaching,6.88,"early,vietnamese,ivory,craftsmen,exclusively,asian,elephant,ivory,vietnam,neighbouring,lao,cambodia,tourists,low,demand,worked,ivory,supplied,domestic,elephants,economic,liberalisation,increase,tourism,raised,local,visitors,demands,worked,ivory,resulted,heavy,poaching",0.00,elephant
"the skin of the asian elephant is used as an ingredient in chinese medicine as well as in the manufacture of ornamental beads the practice has been aided by chinas state forestry administration  which has issued licences for the manufacture and sale of pharmaceutical products containing elephant skin thereby making trading legal in  four skinned elephants were found in a forest in myanmar  elephants were killed by poachers in  and  in  according to the ngo elephant family myanmar is the main source of elephant skin where a poaching crisis has developed rapidly since 
",skin asian elephant ingredient chinese medicine manufacture ornamental beads practice aided chinas state forestry administration issued licences manufacture sale pharmaceutical products containing elephant skin making trading legal skinned elephants found forest myanmar elephants killed poachers according ngo elephant family myanmar main source elephant skin poaching crisis developed rapidly,7.84,"skin,asian,elephant,ingredient,chinese,medicine,manufacture,ornamental,beads,practice,aided,chinas,state,forestry,administration,issued,licences,manufacture,sale,pharmaceutical,products,containing,elephant,skin,making,trading,legal,skinned,elephants,found,forest,myanmar,elephants,killed,poachers,according,ngo,elephant,family,myanmar,main,source,elephant,skin,poaching,crisis,developed,rapidly",0.00,elephant
"the asian elephant is listed on cites appendix i it is a quintessential flagship species deployed to catalyze a range of conservation goals including habitat conservation at landscape scales generating public awareness on conservation issues and mobilisation as a popular cultural icon both in india and the west a key aspect of asian elephant conservation is connectivity and preserving the preferred movement routes of elephants through areas of high vegetation cover and with low human population density
",asian elephant listed cites appendix quintessential flagship species deployed catalyze range conservation goals including habitat conservation landscape scales generating public awareness conservation issues mobilisation popular cultural icon india west key aspect asian elephant conservation connectivity preserving preferred movement routes elephants areas high vegetation cover low human population density,5.71,"asian,elephant,listed,cites,appendix,quintessential,flagship,species,deployed,catalyze,range,conservation,goals,including,habitat,conservation,landscape,scales,generating,public,awareness,conservation,issues,mobilisation,popular,cultural,icon,india,west,key,aspect,asian,elephant,conservation,connectivity,preserving,preferred,movement,routes,elephants,areas,high,vegetation,cover,low,human,population,density",0.00,elephant
"the world elephant day is celebrated on  august since  events are organized to divulge information and to engage people about the problems that the asian elephant is facing august has been established as the asian elephant awareness month by zoos and conservation partners in the united states
",world elephant day celebrated august events organized divulge information engage people problems asian elephant facing august established asian elephant awareness month zoos conservation partners united states,7.14,"world,elephant,day,celebrated,august,events,organized,divulge,information,engage,people,problems,asian,elephant,facing,august,established,asian,elephant,awareness,month,zoos,conservation,partners,united,states",0.00,elephant
"in india the national board of wildlife did a recommendation allowing coal mining in the dehing patkai elephant reserve in april  the decision raised concerns between students and environmental activists who launched an online campaign to stop the project
",india national board wildlife recommendation allowing coal mining dehing patkai elephant reserve april decision raised concerns students environmental activists launched online campaign stop project,5.86,"india,national,board,wildlife,recommendation,allowing,coal,mining,dehing,patkai,elephant,reserve,april,decision,raised,concerns,students,environmental,activists,launched,online,campaign,stop,project",0.00,elephant
"about half of the global zoo elephant population is kept in european zoos where they have about half the median life span of conspecifics in protected populations in range countries this discrepancy is clearest in asian elephants infant mortality is twice that seen in burmese timber camps and adult survivorship in zoos has not improved significantly in recent years one risk factor for asian zoo elephants is being moved between institutions with early removal from the mother tending to have additional adverse effects another risk factor is being born into a zoo rather than being imported from the wild with poor adult survivorship in zoo born asians apparently being conferred prenatally or in early infancy likely causes for compromised survivorship is stress andor obesity foot problems are commonly observed in captives elephants these are related to lack of exercise long hours standing on hard substrates and contamination resulting from standing in their dung many of the problems are treatable however mistreatment may lead to serious disability or death
",half global zoo elephant population kept european zoos half median life span conspecifics protected populations range countries discrepancy clearest asian elephants infant mortality twice seen burmese timber camps adult survivorship zoos improved significantly recent years risk factor asian zoo elephants moved institutions early removal mother tending additional adverse effects risk factor born zoo imported wild poor adult survivorship zoo born asians apparently conferred prenatally early infancy likely causes compromised survivorship stress andor obesity foot problems commonly observed captives elephants related lack exercise long hours standing hard substrates contamination resulting standing dung problems treatable mistreatment lead disability death,6.65,"half,global,zoo,elephant,population,kept,european,zoos,half,median,life,span,conspecifics,protected,populations,range,countries,discrepancy,clearest,asian,elephants,infant,mortality,twice,seen,burmese,timber,camps,adult,survivorship,zoos,improved,significantly,recent,years,risk,factor,asian,zoo,elephants,moved,institutions,early,removal,mother,tending,additional,adverse,effects,risk,factor,born,zoo,imported,wild,poor,adult,survivorship,zoo,born,asians,apparently,conferred,prenatally,early,infancy,likely,causes,compromised,survivorship,stress,andor,obesity,foot,problems,commonly,observed,captives,elephants,related,lack,exercise,long,hours,standing,hard,substrates,contamination,resulting,standing,dung,problems,treatable,mistreatment,lead,disability,death",0.00,elephant
"the asian elephant became a siege engine a mount in war a status symbol a beast of burden and an elevated platform for hunting during historical times in south asia
",asian elephant siege engine mount war status symbol beast burden elevated platform hunting historical times south asia,7.88,"asian,elephant,siege,engine,mount,war,status,symbol,beast,burden,elevated,platform,hunting,historical,times,south,asia",0.00,elephant
"the asian elephant plays an important part in the culture of the subcontinent and beyond being featured prominently in the panchatantra fables and the buddhist jataka tales they play a major role in hinduism the god ganeshas head is that of an elephant and the blessings of a temple elephant are highly valued elephants are frequently used in processions where the animals are adorned with festive outfits
",asian elephant plays important culture subcontinent featured prominently panchatantra fables buddhist jataka tales play major role hinduism god ganeshas head elephant blessings temple elephant highly valued elephants frequently processions animals adorned festive outfits,8.37,"asian,elephant,plays,important,culture,subcontinent,featured,prominently,panchatantra,fables,buddhist,jataka,tales,play,major,role,hinduism,god,ganeshas,head,elephant,blessings,temple,elephant,highly,valued,elephants,frequently,processions,animals,adorned,festive,outfits",0.00,elephant
"the asian elephant is depicted in several indian manuscripts and treatises notable amongst these is the matanga lila  of nilakantha the manuscript hastividyarnava is from assam in northeast india
",asian elephant depicted indian manuscripts treatises notable matanga lila nilakantha manuscript hastividyarnava assam northeast india,7.14,"asian,elephant,depicted,indian,manuscripts,treatises,notable,matanga,lila,nilakantha,manuscript,hastividyarnava,assam,northeast,india",0.00,elephant
"in the burmese thai and sinhalese animal and planetary zodiac the asian elephant both tusked and tuskless are the fourth and fifth animal zodiacs of the burmese the fourth animal zodiac of the thai and the second animal zodiac of the sinhalese people of sri lanka similarly the elephant is the twelfth animal zodiac in the dai animal zodiac of the dai people in southern china
",burmese thai sinhalese animal planetary zodiac asian elephant tusked tuskless fourth fifth animal zodiacs burmese fourth animal zodiac thai second animal zodiac sinhalese people sri lanka similarly elephant twelfth animal zodiac dai animal zodiac dai people southern china,7.43,"burmese,thai,sinhalese,animal,planetary,zodiac,asian,elephant,tusked,tuskless,fourth,fifth,animal,zodiacs,burmese,fourth,animal,zodiac,thai,second,animal,zodiac,sinhalese,people,sri,lanka,similarly,elephant,twelfth,animal,zodiac,dai,animal,zodiac,dai,people,southern,china",0.00,elephant
