Unclean,Clean,Noise_Pre_Processing,Training_Data,Noise_Post_Processing,Query
"australian forests are mostly made up of evergreen species particularly eucalyptus trees in the less arid regions wattles replace them as the dominant species in drier regions and deserts among well known australian animals are the monotremes  a host of marsupials including the kangaroo koala and wombat and birds such as the emu and the kookaburra australia is home to many dangerous animals including some of the most venomous snakes in the world the dingo was introduced by austronesian people who traded with indigenous australians around  bce many animal and plant species became extinct soon after first human settlement including the australian megafauna others have disappeared since european settlement among them the thylacine
",australian forests evergreen species particularly eucalyptus trees arid regions wattles replace dominant species drier regions deserts known australian animals monotremes host marsupials including kangaroo koala wombat birds emu kookaburra australia home dangerous animals including venomous snakes world dingo introduced austronesian people traded indigenous australians bce animal plant species extinct soon human settlement including australian megafauna disappeared european settlement thylacine,7.32,"australian,forests,evergreen,species,particularly,eucalyptus,trees,arid,regions,wattles,replace,dominant,species,drier,regions,deserts,known,australian,animals,monotremes,host,marsupials,including,kangaroo,koala,wombat,birds,emu,kookaburra,australia,home,dangerous,animals,including,venomous,snakes,world,dingo,introduced,austronesian,people,traded,indigenous,australians,bce,animal,plant,species,extinct,soon,human,settlement,including,australian,megafauna,disappeared,european,settlement,thylacine",0.00,australia
"many of australias ecoregions and the species within those regions are threatened by human activities and introduced animal chromistan fungal and plant species all these factors have led to australias having the highest mammal extinction rate of any country in the world the federal environment protection and biodiversity conservation act  is the legal framework for the protection of threatened species numerous protected areas have been created under the national strategy for the conservation of australias biological diversity to protect and preserve unique ecosystems  wetlands are listed under the ramsar convention and  natural world heritage sites have been established australia was ranked st out of  countries in the world on the  environmental performance index there are more than  animals and plants on australias threatened species list including more than  animals
",australias ecoregions species regions threatened human activities introduced animal chromistan fungal plant species factors led australias highest mammal extinction rate country world federal environment protection biodiversity conservation act legal framework protection threatened species numerous protected areas created national strategy conservation australias biological diversity protect preserve unique ecosystems wetlands listed ramsar convention natural world heritage sites established australia ranked st countries world environmental performance index animals plants australias threatened species list including animals,6.47,"australias,ecoregions,species,regions,threatened,human,activities,introduced,animal,chromistan,fungal,plant,species,factors,led,australias,highest,mammal,extinction,rate,country,world,federal,environment,protection,biodiversity,conservation,act,legal,framework,protection,threatened,species,numerous,protected,areas,created,national,strategy,conservation,australias,biological,diversity,protect,preserve,unique,ecosystems,wetlands,listed,ramsar,convention,natural,world,heritage,sites,established,australia,ranked,st,countries,world,environmental,performance,index,animals,plants,australias,threatened,species,list,including,animals",0.00,australia
"paleontologists discovered a fossil site of a prehistoric rainforest in mcgraths flat in south australia that presents evidence that this now arid desert and dry shrublandgrassland was once home to an abundance of life
",paleontologists discovered fossil site prehistoric rainforest mcgraths flat south australia presents evidence arid desert dry shrublandgrassland home abundance life,6.85,"paleontologists,discovered,fossil,site,prehistoric,rainforest,mcgraths,flat,south,australia,presents,evidence,arid,desert,dry,shrublandgrassland,home,abundance,life",0.00,australia
"australia is a federal parliamentary constitutional monarchy the country has maintained a stable liberal democratic political system under its constitution which is one of the worlds oldest since federation in  it is also one of the worlds oldest federations in which power is divided between the federal and state and territorial governments the australian system of government combines elements derived from the political systems of the united kingdom  and the united states  along with distinctive indigenous features
",australia federal parliamentary constitutional monarchy country maintained stable liberal democratic political system constitution worlds oldest federation worlds oldest federations power divided federal state territorial governments australian system government combines elements derived political systems united kingdom united states distinctive indigenous features,7.10,"australia,federal,parliamentary,constitutional,monarchy,country,maintained,stable,liberal,democratic,political,system,constitution,worlds,oldest,federation,worlds,oldest,federations,power,divided,federal,state,territorial,governments,australian,system,government,combines,elements,derived,political,systems,united,kingdom,united,states,distinctive,indigenous,features",0.00,australia
"charles iii reigns as king of australia and is represented in australia by the governor general at the federal level and by the governors at the state level who by convention act on the advice of his ministers thus in practice the governor general acts as a legal figurehead for the actions of the prime minister and the federal executive council the governor general however does have reserve powers which in some situations may be exercised outside the prime ministers request these powers are held by convention and their scope is unclear the most notable exercise of these powers was the dismissal of the whitlam government in the constitutional crisis of 
",charles iii reigns king australia represented australia governor general federal level governors state level convention act advice ministers practice governor general acts legal figurehead actions prime minister federal executive council governor general reserve powers situations exercised outside prime ministers request powers held convention scope unclear notable exercise powers dismissal whitlam government constitutional crisis,8.77,"charles,iii,reigns,king,australia,represented,australia,governor,general,federal,level,governors,state,level,convention,act,advice,ministers,practice,governor,general,acts,legal,figurehead,actions,prime,minister,federal,executive,council,governor,general,reserve,powers,situations,exercised,outside,prime,ministers,request,powers,held,convention,scope,unclear,notable,exercise,powers,dismissal,whitlam,government,constitutional,crisis",0.00,australia
"australias electoral system uses preferential voting for all lower house elections with the exception of tasmania and the act which along with the senate and most state upper houses combine it with proportional representation in a system known as the single transferable vote voting is compulsory for all enrolled citizens  years and over in every jurisdiction as is enrolment the party with majority support in the house of representatives forms the government and its leader becomes prime minister in cases where no party has majority support the governor general has the constitutional power to appoint the prime minister and if necessary dismiss one that has lost the confidence of parliament due to the relatively unique position of australia operating as a westminster parliamentary democracy with an elected upper house the system has sometimes been referred to as having a washminster mutation or as a semi parliamentary system
",australias electoral system uses preferential voting lower house elections exception tasmania act senate state upper houses combine proportional representation system known single transferable vote voting compulsory enrolled citizens years jurisdiction enrolment party majority support house representatives forms government leader prime minister cases party majority support governor general constitutional power appoint prime minister necessary dismiss lost confidence parliament relatively unique position australia operating westminster parliamentary democracy elected upper house system referred washminster mutation semi parliamentary system,7.69,"australias,electoral,system,uses,preferential,voting,lower,house,elections,exception,tasmania,act,senate,state,upper,houses,combine,proportional,representation,system,known,single,transferable,vote,voting,compulsory,enrolled,citizens,years,jurisdiction,enrolment,party,majority,support,house,representatives,forms,government,leader,prime,minister,cases,party,majority,support,governor,general,constitutional,power,appoint,prime,minister,necessary,dismiss,lost,confidence,parliament,relatively,unique,position,australia,operating,westminster,parliamentary,democracy,elected,upper,house,system,referred,washminster,mutation,semi,parliamentary,system",0.00,australia
"australia has six states  new south wales  queensland  south australia  tasmania  victoria  and western australia   and three mainland territoriesthe australian capital territory  the northern territory  and the jervis bay territory  in most respects the act and nt function as states except that the commonwealth parliament has the power to modify or repeal any legislation passed by the territory parliaments
",australia states new south wales queensland south australia tasmania victoria western australia mainland territoriesthe australian capital territory northern territory jervis bay territory respects act nt function states commonwealth parliament power modify repeal legislation passed territory parliaments,5.60,"australia,states,new,south,wales,queensland,south,australia,tasmania,victoria,western,australia,mainland,territoriesthe,australian,capital,territory,northern,territory,jervis,bay,territory,respects,act,nt,function,states,commonwealth,parliament,power,modify,repeal,legislation,passed,territory,parliaments",0.00,australia
"over recent decades australias foreign relations have been driven by a close association with the united states through the anzus pact and by a focus on relationships within the asia pacific region a regional power australia is a member of regional and cultural groupings including the pacific islands forum the pacific community and the commonwealth of nations and is a participant in the asean mechanism and the east asia summit
",recent decades australias foreign relations driven close association united states anzus pact focus relationships asia pacific region regional power australia member regional cultural groupings including pacific islands forum pacific community commonwealth nations participant asean mechanism east asia summit,7.42,"recent,decades,australias,foreign,relations,driven,close,association,united,states,anzus,pact,focus,relationships,asia,pacific,region,regional,power,australia,member,regional,cultural,groupings,including,pacific,islands,forum,pacific,community,commonwealth,nations,participant,asean,mechanism,east,asia,summit",0.00,australia
"australia is a member of several defence intelligence and security groupings including the five eyes intelligence alliance with the united states united kingdom canada and new zealand the anzus alliance with the united states and new zealand the aukus security treaty with the united states and united kingdom the quadrilateral security dialogue with the united states india and japan the five power defence arrangements with new zealand the united kingdom malaysia and singapore and the reciprocal access defence and security agreement with japan
",australia member defence intelligence security groupings including eyes intelligence alliance united states united kingdom canada new zealand anzus alliance united states new zealand aukus security treaty united states united kingdom quadrilateral security dialogue united states india japan power defence arrangements new zealand united kingdom malaysia singapore reciprocal access defence security agreement japan,5.66,"australia,member,defence,intelligence,security,groupings,including,eyes,intelligence,alliance,united,states,united,kingdom,canada,new,zealand,anzus,alliance,united,states,new,zealand,aukus,security,treaty,united,states,united,kingdom,quadrilateral,security,dialogue,united,states,india,japan,power,defence,arrangements,new,zealand,united,kingdom,malaysia,singapore,reciprocal,access,defence,security,agreement,japan",0.00,australia
"australia has pursued the because of international trade liberalisation it led the formation of the cairns group and asia pacific economic cooperation and is a member of the organisation for economic co operation and development  and the world trade organization  in recent decades australia has entered into the comprehensive and progressive agreement for trans pacific partnership and the regional comprehensive economic partnership multilateral free trade agreements as well as bilateral free trade agreements with the united states china japan south korea indonesia the united kingdom and new zealand
",australia pursued international trade liberalisation led formation cairns group asia pacific economic cooperation member organisation economic co operation development world trade organization recent decades australia entered comprehensive progressive agreement trans pacific partnership regional comprehensive economic partnership multilateral free trade agreements bilateral free trade agreements united states china japan south korea indonesia united kingdom new zealand,5.45,"australia,pursued,international,trade,liberalisation,led,formation,cairns,group,asia,pacific,economic,cooperation,member,organisation,economic,co,operation,development,world,trade,organization,recent,decades,australia,entered,comprehensive,progressive,agreement,trans,pacific,partnership,regional,comprehensive,economic,partnership,multilateral,free,trade,agreements,bilateral,free,trade,agreements,united,states,china,japan,south,korea,indonesia,united,kingdom,new,zealand",0.00,australia
"australia maintains a deeply integrated relationship with neighbouring new zealand with free mobility of citizens between the two countries under the trans tasman travel arrangement and free trade under the closer economic relations agreement the most favourably viewed countries by the australian people in  include new zealand the united kingdom japan germany taiwan thailand the united states and south korea a founding member country of the united nations australia is strongly committed to multilateralism and maintains an international aid program under which some  countries receive assistance australia ranked fourth in the center for global developments  commitment to development index
",australia maintains deeply integrated relationship neighbouring new zealand free mobility citizens countries trans tasman travel arrangement free trade closer economic relations agreement favourably viewed countries australian people include new zealand united kingdom japan germany taiwan thailand united states south korea founding member country united nations australia strongly committed multilateralism maintains international aid program countries receive assistance australia ranked fourth center global developments commitment development index,4.89,"australia,maintains,deeply,integrated,relationship,neighbouring,new,zealand,free,mobility,citizens,countries,trans,tasman,travel,arrangement,free,trade,closer,economic,relations,agreement,favourably,viewed,countries,australian,people,include,new,zealand,united,kingdom,japan,germany,taiwan,thailand,united,states,south,korea,founding,member,country,united,nations,australia,strongly,committed,multilateralism,maintains,international,aid,program,countries,receive,assistance,australia,ranked,fourth,center,global,developments,commitment,development,index",0.00,australia
"in the  budget defence spending comprised  of gdp representing the worlds th largest defence budget australia has been involved in united nations and regional peacekeeping disaster relief as well as armed conflicts from the first world war onwards
",budget defence spending comprised gdp representing worlds th largest defence budget australia involved united nations regional peacekeeping disaster relief armed conflicts world war onwards,5.65,"budget,defence,spending,comprised,gdp,representing,worlds,th,largest,defence,budget,australia,involved,united,nations,regional,peacekeeping,disaster,relief,armed,conflicts,world,war,onwards",0.00,australia
"australias high income mixed market economy is rich in natural resources it is the worlds thirteenth largest by nominal terms and the th largest by ppp as of update it has the second highest amount of wealth per adult after luxembourg  and has the thirteenth highest financial assets per capita australia has a labour force of some  million with an unemploynment rate of  as of june  according to the australian council of social service the poverty rate of australia exceeds  of the population encompassing  million it also estimated that there were   children under the age of  living in relative poverty the australian dollar is the national currency which is also shared with three island states in the pacific kiribati nauru and tuvalu
",australias high income mixed market economy rich natural resources worlds thirteenth largest nominal terms th largest ppp update second highest wealth adult luxembourg thirteenth highest financial assets capita australia labour force million unemploynment rate june according australian council social service poverty rate australia exceeds population encompassing million estimated children age living relative poverty australian dollar national currency shared island states pacific kiribati nauru tuvalu,7.83,"australias,high,income,mixed,market,economy,rich,natural,resources,worlds,thirteenth,largest,nominal,terms,th,largest,ppp,update,second,highest,wealth,adult,luxembourg,thirteenth,highest,financial,assets,capita,australia,labour,force,million,unemploynment,rate,june,according,australian,council,social,service,poverty,rate,australia,exceeds,population,encompassing,million,estimated,children,age,living,relative,poverty,australian,dollar,national,currency,shared,island,states,pacific,kiribati,nauru,tuvalu",0.00,australia
"australian government debt about  billion exceeds  of the countrys total gdp and is the worlds eighth highest australia had the second highest level of household debt in the world in  after switzerland its house prices are among the highest in the world especially in the large urban areas  the large service sector accounts for about  of total gdp followed by the industrial sector  while the agriculture sector is by far the smallest making up only  of total gdp australia is the worlds st largest exporter and th largest importer china is australias largest trading partner by a wide margin accounting for roughly  of the countrys exports and  of its imports other major export markets include japan the united states and south korea
",australian government debt billion exceeds countrys total gdp worlds eighth highest australia second highest level household debt world switzerland house prices highest world especially large urban areas large service sector accounts total gdp followed industrial sector agriculture sector far smallest making total gdp australia worlds st largest exporter th largest importer china australias largest trading partner wide margin accounting roughly countrys exports imports major export markets include japan united states south korea,6.78,"australian,government,debt,billion,exceeds,countrys,total,gdp,worlds,eighth,highest,australia,second,highest,level,household,debt,world,switzerland,house,prices,highest,world,especially,large,urban,areas,large,service,sector,accounts,total,gdp,followed,industrial,sector,agriculture,sector,far,smallest,making,total,gdp,australia,worlds,st,largest,exporter,th,largest,importer,china,australias,largest,trading,partner,wide,margin,accounting,roughly,countrys,exports,imports,major,export,markets,include,japan,united,states,south,korea",0.00,australia
"australia has high levels of competitiveness and economic freedom and is ranked eighth in the human development index as of update it is ranked twelfth in the index of economic freedom and nineteenth in the global competitiveness report it attracted  million international tourists in  and was ranked thirteenth among the countries of asia pacific in  for inbound tourism the  travel and tourism competitiveness report ranked australia seventh highest in the world out of  countries its international tourism receipts in  amounted to  billion
",australia high levels competitiveness economic freedom ranked eighth human development index update ranked twelfth index economic freedom nineteenth global competitiveness report attracted million international tourists ranked thirteenth countries asia pacific inbound tourism travel tourism competitiveness report ranked australia seventh highest world countries international tourism receipts amounted billion,6.45,"australia,high,levels,competitiveness,economic,freedom,ranked,eighth,human,development,index,update,ranked,twelfth,index,economic,freedom,nineteenth,global,competitiveness,report,attracted,million,international,tourists,ranked,thirteenth,countries,asia,pacific,inbound,tourism,travel,tourism,competitiveness,report,ranked,australia,seventh,highest,world,countries,international,tourism,receipts,amounted,billion",0.00,australia
"in  australias energy sources were coal  hydropower  natural gas  liquidgas fossil fuel switching plants  oil  and other renewable resources like wind power solar energy and bioenergy  during the st century australia has been trending to generate more energy using renewable resources and less energy using fossil fuels in  australia used coal for  of all energy  wind power for   natural gas for   solar power for   hydropower for   bioenergy for   and other sources like oil and waste coal mine gas for 
",australias energy sources coal hydropower natural gas liquidgas fossil fuel switching plants oil renewable resources like wind power solar energy bioenergy st century australia trending generate energy renewable resources energy fossil fuels australia coal energy wind power natural gas solar power hydropower bioenergy sources like oil waste coal gas,5.93,"australias,energy,sources,coal,hydropower,natural,gas,liquidgas,fossil,fuel,switching,plants,oil,renewable,resources,like,wind,power,solar,energy,bioenergy,st,century,australia,trending,generate,energy,renewable,resources,energy,fossil,fuels,australia,coal,energy,wind,power,natural,gas,solar,power,hydropower,bioenergy,sources,like,oil,waste,coal,gas",0.00,australia
"in  australia spent a billion on research and development allocating about  of gdp a recent study by accenture for the tech council shows that the australian tech sector combined contributes  billion a year to the economy and employs  people the countrys most recognized and important sector of this type is mining where australia continues to have the highest penetration of technologies especially drones autonomous and remote controlled vehicles and mine management software in addition the australian recent startup ecosystem is growing annually at rates of  and the sydney and melbourne ecosystems are already valued at  billion australia consistently has ranked high in the global innovation index  in  australia ranked th out of the  economies featured in the gii  down from being nd in 
",australia spent billion research development allocating gdp recent study accenture tech council shows australian tech sector combined contributes billion year economy employs people countrys recognized important sector type mining australia continues highest penetration technologies especially drones autonomous remote controlled vehicles management software addition australian recent startup ecosystem growing annually rates sydney melbourne ecosystems valued billion australia consistently ranked high global innovation index australia ranked th economies featured gii nd,6.79,"australia,spent,billion,research,development,allocating,gdp,recent,study,accenture,tech,council,shows,australian,tech,sector,combined,contributes,billion,year,economy,employs,people,countrys,recognized,important,sector,type,mining,australia,continues,highest,penetration,technologies,especially,drones,autonomous,remote,controlled,vehicles,management,software,addition,australian,recent,startup,ecosystem,growing,annually,rates,sydney,melbourne,ecosystems,valued,billion,australia,consistently,ranked,high,global,innovation,index,australia,ranked,th,economies,featured,gii,nd",0.00,australia
