Unclean,Clean,Noise_Pre_Processing,Training_Data,Noise_Post_Processing,Query
"with only  of the worlds population australia contributed  of the worlds published research in  making it one of the top  research contributors in the world csiro australias national science agency contributes  of all research in the country while the rest is carried out by universities its most notable contributions include the invention of atomic absorption spectroscopy the essential components of wi fi technology and the development of the first commercially successful polymer banknote
",worlds population australia contributed worlds published research making research contributors world csiro australias national science agency contributes research country rest carried universities notable contributions include invention atomic absorption spectroscopy essential components wi fi technology development commercially successful polymer banknote,6.88,"worlds,population,australia,contributed,worlds,published,research,making,research,contributors,world,csiro,australias,national,science,agency,contributes,research,country,rest,carried,universities,notable,contributions,include,invention,atomic,absorption,spectroscopy,essential,components,wi,fi,technology,development,commercially,successful,polymer,banknote",0.00,australia
"australia is a key player in supporting space exploration facilities such as the square kilometre array and australia telescope compact array radio telescopes telescopes such as the siding spring observatory and ground stations such as the canberra deep space communication complex are of great assistance in deep space exploration missions primarily by nasa
",australia key player supporting space exploration facilities square kilometre array australia telescope compact array radio telescopes telescopes siding spring observatory ground stations canberra deep space communication complex great assistance deep space exploration missions primarily nasa,5.01,"australia,key,player,supporting,space,exploration,facilities,square,kilometre,array,australia,telescope,compact,array,radio,telescopes,telescopes,siding,spring,observatory,ground,stations,canberra,deep,space,communication,complex,great,assistance,deep,space,exploration,missions,primarily,nasa",0.00,australia
"australia has an average population density of  persons per square kilometre of total land area which makes it one of the most sparsely populated countries in the world the population is heavily concentrated on the east coast and in particular in the south eastern region between south east queensland to the north east and adelaide to the south west
",australia average population density persons square kilometre total land area makes sparsely populated countries world population heavily concentrated east coast particular south eastern region south east queensland north east adelaide south west,7.69,"australia,average,population,density,persons,square,kilometre,total,land,area,makes,sparsely,populated,countries,world,population,heavily,concentrated,east,coast,particular,south,eastern,region,south,east,queensland,north,east,adelaide,south,west",0.00,australia
"australia is highly urbanised with  of the population living in the greater capital city statistical areas  in  metropolitan areas with more than one million inhabitants are sydney melbourne brisbane perth and adelaide
",australia highly urbanised population living greater capital city statistical areas metropolitan areas million inhabitants sydney melbourne brisbane perth adelaide,5.94,"australia,highly,urbanised,population,living,greater,capital,city,statistical,areas,metropolitan,areas,million,inhabitants,sydney,melbourne,brisbane,perth,adelaide",0.00,australia
"in common with many other developed countries australia is experiencing a demographic shift towards an older population with more retirees and fewer people of working age in  the average age of the australian population was  years in   of the australian population lived overseas one of the lowest proportions worldwide
",common developed countries australia experiencing demographic shift older population retirees fewer people working age average age australian population years australian population lived overseas lowest proportions worldwide,7.19,"common,developed,countries,australia,experiencing,demographic,shift,older,population,retirees,fewer,people,working,age,average,age,australian,population,years,australian,population,lived,overseas,lowest,proportions,worldwide",0.00,australia
"between  and the second world war the vast majority of settlers and immigrants came from the british isles  although there is significant immigration from china and germany during the th century in the decades immediately following the second world war australia received a large wave of immigration from across europe with many more immigrants arriving from southern and eastern europe than in previous decades since the end of the white australia policy in  australia has pursued an official policy of multiculturalism and there has been a large and continuing wave of immigration from across the world with asia being the largest source of immigrants in the st century
",second world war vast majority settlers immigrants came british isles significant immigration china germany th century decades immediately following second world war australia received large wave immigration europe immigrants arriving southern eastern europe previous decades end white australia policy australia pursued official policy multiculturalism large continuing wave immigration world asia largest source immigrants st century,7.89,"second,world,war,vast,majority,settlers,immigrants,came,british,isles,significant,immigration,china,germany,th,century,decades,immediately,following,second,world,war,australia,received,large,wave,immigration,europe,immigrants,arriving,southern,eastern,europe,previous,decades,end,white,australia,policy,australia,pursued,official,policy,multiculturalism,large,continuing,wave,immigration,world,asia,largest,source,immigrants,st,century",0.00,australia
"today australia has the worlds eighth largest immigrant population with immigrants accounting for  of the population the highest proportion among major western nations  permanent immigrants were admitted to australia in   whilst there was a net population gain of  people from all permanent and temporary immigration in that year the majority of immigrants are skilled but the immigration program includes categories for family members and refugees in  the largest foreign born populations were those born in england  india  mainland china  new zealand  the philippines  and vietnam 
",today australia worlds eighth largest immigrant population immigrants accounting population highest proportion major western nations permanent immigrants admitted australia whilst net population gain people permanent temporary immigration year majority immigrants skilled immigration program includes categories family members refugees largest foreign born populations born england india mainland china new zealand philippines vietnam,5.82,"today,australia,worlds,eighth,largest,immigrant,population,immigrants,accounting,population,highest,proportion,major,western,nations,permanent,immigrants,admitted,australia,whilst,net,population,gain,people,permanent,temporary,immigration,year,majority,immigrants,skilled,immigration,program,includes,categories,family,members,refugees,largest,foreign,born,populations,born,england,india,mainland,china,new,zealand,philippines,vietnam",0.00,australia
"although australia has no official language english is the de facto national language australian english is a major variety of the language with a distinctive accent and lexicon and differs slightly from other varieties of english in grammar and spelling general australian serves as the standard dialect
",australia official language english de facto national language australian english major variety language distinctive accent lexicon differs slightly varieties english grammar spelling general australian serves standard dialect,6.56,"australia,official,language,english,de,facto,national,language,australian,english,major,variety,language,distinctive,accent,lexicon,differs,slightly,varieties,english,grammar,spelling,general,australian,serves,standard,dialect",0.00,australia
"at the  census english was the only language spoken in the home for  of the population the next most common languages spoken at home are mandarin  arabic  vietnamese  cantonese  and punjabi  over  australian aboriginal languages are thought to have existed at the time of first european contact of which fewer than twenty are still in daily use by all age groups about  others are spoken exclusively by older people at the time of the  census  indigenous australians representing  of the indigenous population reported that they spoke an indigenous language at home australia has a sign language known as auslan which is the main language of about  deaf people who reported that they use auslan language at home in the  census
",census english language spoken home population common languages spoken home mandarin arabic vietnamese cantonese punjabi australian aboriginal languages thought existed time european contact fewer daily use age groups spoken exclusively older people time census indigenous australians representing indigenous population reported spoke indigenous language home australia sign language known auslan main language deaf people reported use auslan language home census,8.39,"census,english,language,spoken,home,population,common,languages,spoken,home,mandarin,arabic,vietnamese,cantonese,punjabi,australian,aboriginal,languages,thought,existed,time,european,contact,fewer,daily,use,age,groups,spoken,exclusively,older,people,time,census,indigenous,australians,representing,indigenous,population,reported,spoke,indigenous,language,home,australia,sign,language,known,auslan,main,language,deaf,people,reported,use,auslan,language,home,census",0.00,australia
"australia has no state religion section  of the australian constitution prohibits the federal government from making any law to establish any religion impose any religious observance or prohibit the free exercise of any religion
",australia state religion section australian constitution prohibits federal government making law establish religion impose religious observance prohibit free exercise religion,6.11,"australia,state,religion,section,australian,constitution,prohibits,federal,government,making,law,establish,religion,impose,religious,observance,prohibit,free,exercise,religion",0.00,australia
"at the  census  of the population identified as having no religion up from  in  the largest religion is christianity  the largest christian denominations are the roman catholic church  and the anglican church of australia  multicultural immigration since the second world war has led to the growth of non christian religions the largest of which are islam  hinduism  buddhism  sikhism  and judaism 
",census population identified religion largest religion christianity largest christian denominations roman catholic church anglican church australia multicultural immigration second world war led growth non christian religions largest islam hinduism buddhism sikhism judaism,7.27,"census,population,identified,religion,largest,religion,christianity,largest,christian,denominations,roman,catholic,church,anglican,church,australia,multicultural,immigration,second,world,war,led,growth,non,christian,religions,largest,islam,hinduism,buddhism,sikhism,judaism",0.00,australia
"in  just under  people declared an affiliation with traditional aboriginal religions in australian aboriginal mythology and the animist framework developed in aboriginal australia the dreaming is a sacred era in which ancestral totemic spirit beings formed the creation the dreaming established the laws and structures of society and the ceremonies performed to ensure continuity of life and land
",people declared affiliation traditional aboriginal religions australian aboriginal mythology animist framework developed aboriginal australia dreaming sacred era ancestral totemic spirit beings formed creation dreaming established laws structures society ceremonies performed ensure continuity life land,6.05,"people,declared,affiliation,traditional,aboriginal,religions,australian,aboriginal,mythology,animist,framework,developed,aboriginal,australia,dreaming,sacred,era,ancestral,totemic,spirit,beings,formed,creation,dreaming,established,laws,structures,society,ceremonies,performed,ensure,continuity,life,land",0.00,australia
"australias life expectancy of  years  is the fifth highest in the world it has the highest rates of skin cancer in the world while cigarette smoking is the largest preventable because of death and disease responsible for  of the total mortality and disease ranked second in preventable causes is hypertension at  with obesity third at  australia ranked th in the world in  for its proportion of obese women and near the top of developed nations for its proportion of obese adults  of its adult population is either overweight or obese
",australias life expectancy years fifth highest world highest rates skin cancer world cigarette smoking largest preventable death disease responsible total mortality disease ranked second preventable causes hypertension obesity australia ranked th world proportion obese women near developed nations proportion obese adults adult population overweight obese,8.41,"australias,life,expectancy,years,fifth,highest,world,highest,rates,skin,cancer,world,cigarette,smoking,largest,preventable,death,disease,responsible,total,mortality,disease,ranked,second,preventable,causes,hypertension,obesity,australia,ranked,th,world,proportion,obese,women,near,developed,nations,proportion,obese,adults,adult,population,overweight,obese",0.00,australia
"australia spent around  of its total gdp to healthcare in  it introduced universal health care in  known as medicare it is now nominally funded by an income tax surcharge known as the medicare levy currently at  the states manage hospitals and attached outpatient services while the commonwealth funds the pharmaceutical benefits scheme  and general practice
",australia spent total gdp healthcare introduced universal health care known medicare nominally funded income tax surcharge known medicare levy currently states manage hospitals attached outpatient services commonwealth funds pharmaceutical benefits scheme general practice,6.13,"australia,spent,total,gdp,healthcare,introduced,universal,health,care,known,medicare,nominally,funded,income,tax,surcharge,known,medicare,levy,currently,states,manage,hospitals,attached,outpatient,services,commonwealth,funds,pharmaceutical,benefits,scheme,general,practice",0.00,australia
"during the covid  pandemic australia had one of the most restrictive quarantine policies resulting in one of the lowest death rates worldwide
",covid pandemic australia restrictive quarantine policies resulting lowest death rates worldwide,7.75,"covid,pandemic,australia,restrictive,quarantine,policies,resulting,lowest,death,rates,worldwide",0.00,australia
"school attendance or registration for home schooling is compulsory throughout australia education is the responsibility of the individual states and territories so the rules vary between states but in general children are required to attend school from the age of about  until about  in some states  children aged  are required to either attend school or participate in vocational training such as an apprenticeship
",school attendance registration home schooling compulsory australia education responsibility individual states territories rules vary states general children required attend school age states children aged required attend school participate vocational training apprenticeship,7.69,"school,attendance,registration,home,schooling,compulsory,australia,education,responsibility,individual,states,territories,rules,vary,states,general,children,required,attend,school,age,states,children,aged,required,attend,school,participate,vocational,training,apprenticeship",0.00,australia
"australia has an adult literacy rate that was estimated to be  in  however a  report for the australian bureau of statistics reported that tasmania has a literacy and numeracy rate of only 
",australia adult literacy rate estimated report australian bureau statistics reported tasmania literacy numeracy rate,9.47,"australia,adult,literacy,rate,estimated,report,australian,bureau,statistics,reported,tasmania,literacy,numeracy,rate",0.00,australia
"australia has  government funded universities and three private universities as well as a number of other specialist institutions that provide approved courses at the higher education level the oecd places australia among the most expensive nations to attend university there is a state based system of vocational training known as tafe and many trades conduct apprenticeships for training new tradespeople about  of australians aged from  to  have vocational or tertiary qualifications and the tertiary graduation rate of  is the highest among oecd countries  of australias population has attained a higher education qualification which is among the highest percentages in the world
",australia government funded universities private universities number specialist institutions provide approved courses higher education level oecd places australia expensive nations attend university state based system vocational training known tafe trades conduct apprenticeships training new tradespeople australians aged vocational tertiary qualifications tertiary graduation rate highest oecd countries australias population attained higher education qualification highest percentages world,6.73,"australia,government,funded,universities,private,universities,number,specialist,institutions,provide,approved,courses,higher,education,level,oecd,places,australia,expensive,nations,attend,university,state,based,system,vocational,training,known,tafe,trades,conduct,apprenticeships,training,new,tradespeople,australians,aged,vocational,tertiary,qualifications,tertiary,graduation,rate,highest,oecd,countries,australias,population,attained,higher,education,qualification,highest,percentages,world",0.00,australia
"australia has the highest ratio of international students per head of population in the world by a large margin with  international students enrolled in the nations universities and vocational institutions in  accordingly in  international students represented on average  of the student bodies of australian universities international education therefore represents one of the countrys largest exports and has a pronounced influence on the countrys demographics with a significant proportion of international students remaining in australia after graduation on various skill and employment visas education is australias third largest export after iron ore and coal and contributed over  billion to the economy in 
",australia highest ratio international students head population world large margin international students enrolled nations universities vocational institutions accordingly international students represented average student bodies australian universities international education represents countrys largest exports pronounced influence countrys demographics significant proportion international students remaining australia graduation skill employment visas education australias largest export iron ore coal contributed billion economy,6.29,"australia,highest,ratio,international,students,head,population,world,large,margin,international,students,enrolled,nations,universities,vocational,institutions,accordingly,international,students,represented,average,student,bodies,australian,universities,international,education,represents,countrys,largest,exports,pronounced,influence,countrys,demographics,significant,proportion,international,students,remaining,australia,graduation,skill,employment,visas,education,australias,largest,export,iron,ore,coal,contributed,billion,economy",0.00,australia
"australia is home to a diversity of cultures a result of its history of immigration prior to  australia was dominated by indigenous cultures since then australian culture has primarily been a western culture strongly influenced by anglo celtic settlers other influences include australian aboriginal culture the traditions brought to the country by waves of immigration from around the world and the culture of the united states the cultural divergence and evolution that has occurred over the centuries since european settlement has resulted in a distinctive australian culture
",australia home diversity cultures result history immigration prior australia dominated indigenous cultures australian culture primarily western culture strongly influenced anglo celtic settlers influences include australian aboriginal culture traditions brought country waves immigration world culture united states cultural divergence evolution occurred centuries european settlement resulted distinctive australian culture,6.91,"australia,home,diversity,cultures,result,history,immigration,prior,australia,dominated,indigenous,cultures,australian,culture,primarily,western,culture,strongly,influenced,anglo,celtic,settlers,influences,include,australian,aboriginal,culture,traditions,brought,country,waves,immigration,world,culture,united,states,cultural,divergence,evolution,occurred,centuries,european,settlement,resulted,distinctive,australian,culture",0.00,australia
"australia has over  aboriginal rock art sites and traditional designs patterns and stories infuse contemporary indigenous australian art the last great art movement of the th century according to critic robert hughes its exponents include emily kame kngwarreye early colonial artists showed a fascination with the unfamiliar land the impressionistic works of arthur streeton tom roberts and other members of the th century heidelberg schoolthe first distinctively australian movement in western artgave expression to nationalist sentiments in the lead up to federation while the school remained influential into the s modernists such as margaret preston and later sidney nolan explored new artistic trends the landscape remained central to the work of aboriginal watercolourist albert namatjira as well as fred williams brett whiteley and other post war artists whose works eclectic in style yet uniquely australian moved between the figurative and the abstract
",australia aboriginal rock art sites traditional designs patterns stories infuse contemporary indigenous australian art great art movement th century according critic robert hughes exponents include emily kame kngwarreye early colonial artists showed fascination unfamiliar land impressionistic works arthur streeton tom roberts members th century heidelberg schoolthe distinctively australian movement western artgave expression nationalist sentiments lead federation school remained influential modernists margaret preston later sidney nolan explored new artistic trends landscape remained central work aboriginal watercolourist albert namatjira fred williams brett whiteley post war artists works eclectic style uniquely australian moved figurative abstract,5.20,"australia,aboriginal,rock,art,sites,traditional,designs,patterns,stories,infuse,contemporary,indigenous,australian,art,great,art,movement,th,century,according,critic,robert,hughes,exponents,include,emily,kame,kngwarreye,early,colonial,artists,showed,fascination,unfamiliar,land,impressionistic,works,arthur,streeton,tom,roberts,members,th,century,heidelberg,schoolthe,distinctively,australian,movement,western,artgave,expression,nationalist,sentiments,lead,federation,school,remained,influential,modernists,margaret,preston,later,sidney,nolan,explored,new,artistic,trends,landscape,remained,central,work,aboriginal,watercolourist,albert,namatjira,fred,williams,brett,whiteley,post,war,artists,works,eclectic,style,uniquely,australian,moved,figurative,abstract",0.00,australia
"many of australias performing arts companies receive funding through the federal governments australia council there is a symphony orchestra in each state and a national opera company opera australia well known for its famous soprano joan sutherland at the beginning of the th century nellie melba was one of the worlds leading opera singers ballet and dance are represented by the australian ballet and various state companies each state has a publicly funded theatre company
",australias performing arts companies receive funding federal governments australia council symphony orchestra state national opera company opera australia known famous soprano joan sutherland beginning th century nellie melba worlds leading opera singers ballet dance represented australian ballet state companies state publicly funded theatre company,6.50,"australias,performing,arts,companies,receive,funding,federal,governments,australia,council,symphony,orchestra,state,national,opera,company,opera,australia,known,famous,soprano,joan,sutherland,beginning,th,century,nellie,melba,worlds,leading,opera,singers,ballet,dance,represented,australian,ballet,state,companies,state,publicly,funded,theatre,company",0.00,australia
