Unclean,Clean,Noise_Pre_Processing,Training_Data,Noise_Post_Processing,Query
"bangkoka officially known in thai as krung thep maha nakhonb and colloquially as krung thepc is the capital and most populous city of thailand the city occupies  square kilometres  in the chao phraya river delta in central thailand and has an estimated population of  million as of   percent of the countrys population over  million people  lived within the surrounding bangkok metropolitan region at the  census making bangkok an extreme primate city dwarfing thailands other urban centres in both size and importance to the national economy
",bangkoka officially known thai krung thep maha nakhonb colloquially krung thepc capital populous city thailand city occupies square kilometres chao phraya river delta central thailand estimated population million percent countrys population million people lived surrounding bangkok metropolitan region census making bangkok extreme primate city dwarfing thailands urban centres size importance national economy,6.08,"bangkoka,officially,known,thai,krung,thep,maha,nakhonb,colloquially,krung,thepc,capital,populous,city,thailand,city,occupies,square,kilometres,chao,phraya,river,delta,central,thailand,estimated,population,million,percent,countrys,population,million,people,lived,surrounding,bangkok,metropolitan,region,census,making,bangkok,extreme,primate,city,dwarfing,thailands,urban,centres,size,importance,national,economy",0.00,bangkok
"bangkok traces its roots to a small trading post during the ayutthaya kingdom in the th century which eventually grew and became the site of two capital cities thonburi in  and rattanakosin in  bangkok was at the heart of the modernization of siam later renamed thailand during the late th century as the country faced pressures from the west the city was at the centre of thailands political struggles throughout the th century as the country abolished absolute monarchy adopted constitutional rule and underwent numerous coups and several uprisings the city incorporated as a special administrative area under the bangkok metropolitan administration in  grew rapidly during the s through the s and now exerts a significant impact on thailands politics economy education media and modern society
",bangkok traces roots small trading post ayutthaya kingdom th century eventually grew site capital cities thonburi rattanakosin bangkok heart modernization siam later renamed thailand late th century country faced pressures west city centre thailands political struggles th century country abolished absolute monarchy adopted constitutional rule underwent numerous coups uprisings city incorporated special administrative area bangkok metropolitan administration grew rapidly exerts significant impact thailands politics economy education media modern society,7.15,"bangkok,traces,roots,small,trading,post,ayutthaya,kingdom,th,century,eventually,grew,site,capital,cities,thonburi,rattanakosin,bangkok,heart,modernization,siam,later,renamed,thailand,late,th,century,country,faced,pressures,west,city,centre,thailands,political,struggles,th,century,country,abolished,absolute,monarchy,adopted,constitutional,rule,underwent,numerous,coups,uprisings,city,incorporated,special,administrative,area,bangkok,metropolitan,administration,grew,rapidly,exerts,significant,impact,thailands,politics,economy,education,media,modern,society",0.00,bangkok
"the asian investment boom in the s and s led many multinational corporations to locate their regional headquarters in bangkok the city is now a regional force in finance business and pop culture it is an international hub for transport and health care and has emerged as a centre for the arts fashion and entertainment the city is known for its street life and cultural landmarks as well as its red light districts the grand palace and buddhist temples including wat arun and wat pho stand in contrast with other tourist attractions such as the nightlife scenes of khaosan road and patpong bangkok is among the worlds top tourist destinations and has been named the worlds most visited city consistently in several international rankings
",asian investment boom led multinational corporations locate regional headquarters bangkok city regional force finance business pop culture international hub transport health care emerged centre arts fashion entertainment city known street life cultural landmarks red light districts grand palace buddhist temples including wat arun wat pho stand contrast tourist attractions nightlife scenes khaosan road patpong bangkok worlds tourist destinations named worlds visited city consistently international rankings,7.99,"asian,investment,boom,led,multinational,corporations,locate,regional,headquarters,bangkok,city,regional,force,finance,business,pop,culture,international,hub,transport,health,care,emerged,centre,arts,fashion,entertainment,city,known,street,life,cultural,landmarks,red,light,districts,grand,palace,buddhist,temples,including,wat,arun,wat,pho,stand,contrast,tourist,attractions,nightlife,scenes,khaosan,road,patpong,bangkok,worlds,tourist,destinations,named,worlds,visited,city,consistently,international,rankings",0.00,bangkok
"the history of bangkok dates at least back to the early th century to when it was a village on the west bank of the chao phraya river under the rule of ayutthaya because of its strategic location near the mouth of the river the town gradually increased in importance bangkok initially served as a customs outpost with forts on both sides of the river and was the site of a siege in  in which the french were expelled from siam after the fall of ayutthaya to the burmese in  the newly crowned king taksin established his capital at the town which became the base of the thonburi kingdom in  king phutthayotfa chulalok  succeeded taksin moved the capital to the eastern banks rattanakosin island thus founding the rattanakosin kingdom the city pillar was erected on  april  which is regarded as the date of foundation of bangkok as the capital
",history bangkok dates early th century village west bank chao phraya river rule ayutthaya strategic location near mouth river town gradually increased importance bangkok initially served customs outpost forts sides river site siege french expelled siam fall ayutthaya burmese newly crowned king taksin established capital town base thonburi kingdom king phutthayotfa chulalok succeeded taksin moved capital eastern banks rattanakosin island founding rattanakosin kingdom city pillar erected april regarded date foundation bangkok capital,9.14,"history,bangkok,dates,early,th,century,village,west,bank,chao,phraya,river,rule,ayutthaya,strategic,location,near,mouth,river,town,gradually,increased,importance,bangkok,initially,served,customs,outpost,forts,sides,river,site,siege,french,expelled,siam,fall,ayutthaya,burmese,newly,crowned,king,taksin,established,capital,town,base,thonburi,kingdom,king,phutthayotfa,chulalok,succeeded,taksin,moved,capital,eastern,banks,rattanakosin,island,founding,rattanakosin,kingdom,city,pillar,erected,april,regarded,date,foundation,bangkok,capital",0.00,bangkok
"bangkoks economy gradually expanded through international trade first with china then with western merchants returning in the early to mid th century as the capital bangkok was the centre of siams modernization as it faced pressure from western powers in the late th century the reigns of kings mongkut  and chulalongkorn  saw the introduction of the steam engine printing press rail transport and utilities infrastructure in the city as well as formal education and healthcare bangkok became the centre stage for power struggles between the military and political elite as the country abolished absolute monarchy in 
",bangkoks economy gradually expanded international trade china western merchants returning early mid th century capital bangkok centre siams modernization faced pressure western powers late th century reigns kings mongkut chulalongkorn saw introduction steam engine printing press rail transport utilities infrastructure city formal education healthcare bangkok centre stage power struggles military political elite country abolished absolute monarchy,6.47,"bangkoks,economy,gradually,expanded,international,trade,china,western,merchants,returning,early,mid,th,century,capital,bangkok,centre,siams,modernization,faced,pressure,western,powers,late,th,century,reigns,kings,mongkut,chulalongkorn,saw,introduction,steam,engine,printing,press,rail,transport,utilities,infrastructure,city,formal,education,healthcare,bangkok,centre,stage,power,struggles,military,political,elite,country,abolished,absolute,monarchy",0.00,bangkok
"as thailand allied with japan in world war ii bangkok was subjected to allied bombing but rapidly grew in the post war period as a result of us aid and government sponsored investment bangkoks role as a us military rr destination boosted its tourism industry as well as firmly establishing it as a sex tourism destination disproportionate urban development led to increasing income inequalities and migration from rural areas into bangkok its population surged from  million to  million in the s
",thailand allied japan world war ii bangkok subjected allied bombing rapidly grew post war period result aid government sponsored investment bangkoks role military rr destination boosted tourism industry firmly establishing sex tourism destination disproportionate urban development led increasing income inequalities migration rural areas bangkok population surged million million,6.65,"thailand,allied,japan,world,war,ii,bangkok,subjected,allied,bombing,rapidly,grew,post,war,period,result,aid,government,sponsored,investment,bangkoks,role,military,rr,destination,boosted,tourism,industry,firmly,establishing,sex,tourism,destination,disproportionate,urban,development,led,increasing,income,inequalities,migration,rural,areas,bangkok,population,surged,million,million",0.00,bangkok
"following the us withdrawal from vietnam in  japanese businesses took over as leaders in investment and the expansion of export oriented manufacturing led to growth of the financial market in bangkok rapid growth of the city continued through the s and early s until it was stalled by the  asian financial crisis by then many public and social issues had emerged among them the strain on infrastructure reflected in the citys notorious traffic jams bangkoks role as the nations political stage continues to be seen in strings of popular protests from the student uprisings in  and  anti military demonstrations in  and frequent street protests since  including those by groups opposing and supporting former prime minister thaksin shinawatra from  to  and a renewed student led movement in 
",following withdrawal vietnam japanese businesses took leaders investment expansion export oriented manufacturing led growth financial market bangkok rapid growth city continued early stalled asian financial crisis public social issues emerged strain infrastructure reflected citys notorious traffic jams bangkoks role nations political stage continues seen strings popular protests student uprisings anti military demonstrations frequent street protests including groups opposing supporting prime minister thaksin shinawatra renewed student led movement,7.46,"following,withdrawal,vietnam,japanese,businesses,took,leaders,investment,expansion,export,oriented,manufacturing,led,growth,financial,market,bangkok,rapid,growth,city,continued,early,stalled,asian,financial,crisis,public,social,issues,emerged,strain,infrastructure,reflected,citys,notorious,traffic,jams,bangkoks,role,nations,political,stage,continues,seen,strings,popular,protests,student,uprisings,anti,military,demonstrations,frequent,street,protests,including,groups,opposing,supporting,prime,minister,thaksin,shinawatra,renewed,student,led,movement",0.00,bangkok
"administration of the city was first formalized by king chulalongkorn in  with the establishment of monthon krung thep phra maha nakhon  as a national subdivision in  the monthon was split into several provinces the administrative boundaries of which have since further changed the city in its current form was created in  with the formation of the bangkok metropolitan administration  following the merger of phra nakhon province on the eastern bank of the chao phraya and thonburi province on the west during the previous year
",administration city formalized king chulalongkorn establishment monthon krung thep phra maha nakhon national subdivision monthon split provinces administrative boundaries changed city current form created formation bangkok metropolitan administration following merger phra nakhon province eastern bank chao phraya thonburi province west previous year,7.94,"administration,city,formalized,king,chulalongkorn,establishment,monthon,krung,thep,phra,maha,nakhon,national,subdivision,monthon,split,provinces,administrative,boundaries,changed,city,current,form,created,formation,bangkok,metropolitan,administration,following,merger,phra,nakhon,province,eastern,bank,chao,phraya,thonburi,province,west,previous,year",0.00,bangkok
"the origin of the name bangkok  is unclear bang  is a thai word meaning a village on a stream and the name might have been derived from bang ko  ko  meaning island stemming from the citys watery landscape another theory suggests that it is shortened from bang makok  makok  being the name of elaeocarpus hygrophilus a plant bearing olive like fruitd this is supported by the former name of wat arun a historic temple in the area that used to be called wat makok the romanization bangkok comes from frenchcitation needed
",origin bangkok unclear bang thai word meaning village stream derived bang ko ko meaning island stemming citys watery landscape theory suggests shortened bang makok makok elaeocarpus hygrophilus plant bearing olive like fruitd supported wat arun historic temple area called wat makok romanization bangkok comes frenchcitation needed,8.65,"origin,bangkok,unclear,bang,thai,word,meaning,village,stream,derived,bang,ko,ko,meaning,island,stemming,citys,watery,landscape,theory,suggests,shortened,bang,makok,makok,elaeocarpus,hygrophilus,plant,bearing,olive,like,fruitd,supported,wat,arun,historic,temple,area,called,wat,makok,romanization,bangkok,comes,frenchcitation,needed",0.00,bangkok
"officially the town was known as thonburi si mahasamut  or thonburi according to the ayutthaya chronicles bangkok was likely a colloquial name albeit one widely adopted by foreign visitors who continued to use it to refer to the city even after the new capitals establishment
",officially town known thonburi si mahasamut thonburi according ayutthaya chronicles bangkok likely colloquial albeit widely adopted foreign visitors continued use refer city new capitals establishment,7.25,"officially,town,known,thonburi,si,mahasamut,thonburi,according,ayutthaya,chronicles,bangkok,likely,colloquial,albeit,widely,adopted,foreign,visitors,continued,use,refer,city,new,capitals,establishment",0.00,bangkok
"the city of bangkok is locally governed by the bangkok metropolitan administration  although its boundaries are at the provincial  level unlike the other  provinces bangkok is a special administrative area whose governor is directly elected to serve a four year term the governor together with four appointed deputies form the executive body who implement policies through the bma civil service headed by the permanent secretary for the bma in separate elections each district elects one or more city councillors who form the bangkok metropolitan council the council is the bmas legislative body and has power over municipal ordinances and the citys budget the latest gubernatorial election took place on  may  after an extended lapse following the  thai coup dtat and was won by chadchart sittipunt
",city bangkok locally governed bangkok metropolitan administration boundaries provincial level unlike provinces bangkok special administrative area governor directly elected serve year term governor appointed deputies form executive body implement policies bma civil service headed permanent secretary bma separate elections district elects city councillors form bangkok metropolitan council council bmas legislative body power municipal ordinances citys budget latest gubernatorial election took place extended lapse following thai coup dtat chadchart sittipunt,7.00,"city,bangkok,locally,governed,bangkok,metropolitan,administration,boundaries,provincial,level,unlike,provinces,bangkok,special,administrative,area,governor,directly,elected,serve,year,term,governor,appointed,deputies,form,executive,body,implement,policies,bma,civil,service,headed,permanent,secretary,bma,separate,elections,district,elects,city,councillors,form,bangkok,metropolitan,council,council,bmas,legislative,body,power,municipal,ordinances,citys,budget,latest,gubernatorial,election,took,place,extended,lapse,following,thai,coup,dtat,chadchart,sittipunt",0.00,bangkok
"bangkok is divided into fifty districts  which are further subdivided into  sub districts  each district is managed by a district director appointed by the governor district councils elected to four year terms serve as advisory bodies to their respective district directors
",bangkok divided districts subdivided sub districts district managed district director appointed governor district councils elected year terms serve advisory bodies respective district directors,6.57,"bangkok,divided,districts,subdivided,sub,districts,district,managed,district,director,appointed,governor,district,councils,elected,year,terms,serve,advisory,bodies,respective,district,directors",0.00,bangkok
"the seal of the city shows hindu god indra riding in the clouds on airavata a divine white elephant known in thai as erawan in his hand indra holds his weapon the vajra the seal is based on a painting done by prince naris the tree symbol of bangkok is ficus benjamina the official city slogan adopted in  reads
",seal city shows hindu god indra riding clouds airavata divine white elephant known thai erawan hand indra holds weapon vajra seal based painting prince naris tree symbol bangkok ficus benjamina official city slogan adopted reads,7.72,"seal,city,shows,hindu,god,indra,riding,clouds,airavata,divine,white,elephant,known,thai,erawan,hand,indra,holds,weapon,vajra,seal,based,painting,prince,naris,tree,symbol,bangkok,ficus,benjamina,official,city,slogan,adopted,reads",0.00,bangkok
"as the capital of thailand bangkok is the seat of all branches of the national government the government house parliament house and supreme administrative and constitutional courts are all in the city bangkok is the site of the grand palace and dusit palace respectively the official and de facto residence of the king most government ministries also have headquarters and offices in the capital
",capital thailand bangkok seat branches national government government house parliament house supreme administrative constitutional courts city bangkok site grand palace dusit palace respectively official de facto residence king government ministries headquarters offices capital,7.83,"capital,thailand,bangkok,seat,branches,national,government,government,house,parliament,house,supreme,administrative,constitutional,courts,city,bangkok,site,grand,palace,dusit,palace,respectively,official,de,facto,residence,king,government,ministries,headquarters,offices,capital",0.00,bangkok
"bangkok covers an area of  square kilometres  ranking th among the other  provinces of thailand of this about  square kilometres  form the built up urban area it is ranked rd in the world in terms of land area the citys urban sprawl reaches into parts of the six other provinces that it borders namely in clockwise order from northwest nonthaburi pathum thani chachoengsao samut prakan samut sakhon and nakhon pathom with the exception of chachoengsao these provinces together with bangkok form the greater bangkok metropolitan region
",bangkok covers area square kilometres ranking th provinces thailand square kilometres form built urban area ranked rd world terms land area citys urban sprawl reaches parts provinces borders clockwise order northwest nonthaburi pathum thani chachoengsao samut prakan samut sakhon nakhon pathom exception chachoengsao provinces bangkok form greater bangkok metropolitan region,6.73,"bangkok,covers,area,square,kilometres,ranking,th,provinces,thailand,square,kilometres,form,built,urban,area,ranked,rd,world,terms,land,area,citys,urban,sprawl,reaches,parts,provinces,borders,clockwise,order,northwest,nonthaburi,pathum,thani,chachoengsao,samut,prakan,samut,sakhon,nakhon,pathom,exception,chachoengsao,provinces,bangkok,form,greater,bangkok,metropolitan,region",0.00,bangkok
"bangkok is situated in the chao phraya river delta in thailands central plain the river meanders through the city in a southerly direction emptying into the gulf of thailand approximately  kilometres  south of city centre the area is flat and low lying with an average elevation of  metres  above sea levelh most of the area was originally swampland which was gradually drained and irrigated for agriculture by the construction of canals  which took place from the th to th centuries the course of the river as it flows through bangkok has been modified by the construction of several shortcut canals
",bangkok situated chao phraya river delta thailands central plain river meanders city southerly direction emptying gulf thailand approximately kilometres south city centre area flat low lying average elevation metres sea levelh area originally swampland gradually drained irrigated agriculture construction canals took place th th centuries course river flows bangkok modified construction shortcut canals,7.82,"bangkok,situated,chao,phraya,river,delta,thailands,central,plain,river,meanders,city,southerly,direction,emptying,gulf,thailand,approximately,kilometres,south,city,centre,area,flat,low,lying,average,elevation,metres,sea,levelh,area,originally,swampland,gradually,drained,irrigated,agriculture,construction,canals,took,place,th,th,centuries,course,river,flows,bangkok,modified,construction,shortcut,canals",0.00,bangkok
"the geology of the bangkok area is characterized by a top layer of soft marine clay known as bangkok clay averaging  metres  in thickness which overlies an aquifer system consisting of eight known units this feature has contributed to the effects of subsidence caused by extensive groundwater pumping first recognized in the s subsidence soon became a critical issue reaching a rate of  millimetres  per year in  ground water management and mitigation measures have since lessened the severity of the situation and the rate of subsidence decreased to  to  millimetres  per year in the early s though parts of the city are now  metre  below sea level
",geology bangkok area characterized layer soft marine clay known bangkok clay averaging metres thickness overlies aquifer system consisting known units feature contributed effects subsidence caused extensive groundwater pumping recognized subsidence soon critical issue reaching rate millimetres year ground water management mitigation measures lessened severity situation rate subsidence decreased millimetres year early parts city metre sea level,7.85,"geology,bangkok,area,characterized,layer,soft,marine,clay,known,bangkok,clay,averaging,metres,thickness,overlies,aquifer,system,consisting,known,units,feature,contributed,effects,subsidence,caused,extensive,groundwater,pumping,recognized,subsidence,soon,critical,issue,reaching,rate,millimetres,year,ground,water,management,mitigation,measures,lessened,severity,situation,rate,subsidence,decreased,millimetres,year,early,parts,city,metre,sea,level",0.00,bangkok
"subsidence has resulted in increased flood risk as bangkok is already prone to flooding due to its low elevation and an inadequate drainage infrastructure often compounded by blockage from rubbish pollution  the city now relies on flood barriers and augmenting drainage from canals by pumping and building drain tunnels but parts of bangkok and its suburbs are still regularly inundated heavy downpours resulting in urban runoff overwhelming drainage systems and runoff discharge from upstream areas are major triggering factors severe flooding affecting much of the city occurred in  and  in  most of bangkoks northern eastern and western districts were flooded in some places for over two months
",subsidence resulted increased flood risk bangkok prone flooding low elevation inadequate drainage infrastructure compounded blockage rubbish pollution city relies flood barriers augmenting drainage canals pumping building drain tunnels parts bangkok suburbs regularly inundated heavy downpours resulting urban runoff overwhelming drainage systems runoff discharge upstream areas major triggering factors severe flooding affecting city occurred bangkoks northern eastern western districts flooded places months,6.59,"subsidence,resulted,increased,flood,risk,bangkok,prone,flooding,low,elevation,inadequate,drainage,infrastructure,compounded,blockage,rubbish,pollution,city,relies,flood,barriers,augmenting,drainage,canals,pumping,building,drain,tunnels,parts,bangkok,suburbs,regularly,inundated,heavy,downpours,resulting,urban,runoff,overwhelming,drainage,systems,runoff,discharge,upstream,areas,major,triggering,factors,severe,flooding,affecting,city,occurred,bangkoks,northern,eastern,western,districts,flooded,places,months",0.00,bangkok
