Unclean,Clean,Noise_Pre_Processing,Training_Data,Noise_Post_Processing,Query
"five infantry battalions were reformed and positioned along the northern and eastern borders of bangladesh three more battalions were raised and artillery batteries were formed during june and july mukti bahini had regrouped across the border with indian aid through operation jackpot and began sending  guerrillas across the border the so called monsoon offensive which for various reasons  failed to achieve its objectives bengali regular forces also attacked border outposts in mymensingh comilla and sylhet but the results were mixed pakistani authorities concluded that they had successfully contained the monsoon offensive which proved a near accurate observation
",infantry battalions reformed positioned northern eastern borders bangladesh battalions raised artillery batteries formed june july mukti bahini regrouped border indian aid operation jackpot began sending guerrillas border called monsoon offensive reasons failed achieve objectives bengali regular forces attacked border outposts mymensingh comilla sylhet results mixed pakistani authorities concluded successfully contained monsoon offensive proved near accurate observation,6.12,"infantry,battalions,reformed,positioned,northern,eastern,borders,bangladesh,battalions,raised,artillery,batteries,formed,june,july,mukti,bahini,regrouped,border,indian,aid,operation,jackpot,began,sending,guerrillas,border,called,monsoon,offensive,reasons,failed,achieve,objectives,bengali,regular,forces,attacked,border,outposts,mymensingh,comilla,sylhet,results,mixed,pakistani,authorities,concluded,successfully,contained,monsoon,offensive,proved,near,accurate,observation",0.00,bangladesh
all unprejudiced persons objectively surveying the grim events in bangladesh since march  have recognised the revolt of  million people a people who were forced to the conclusion that neither their life nor their liberty to say nothing of the possibility of the pursuit of happiness was available to them,unprejudiced persons objectively surveying grim events bangladesh march recognised revolt million people people forced conclusion life liberty possibility pursuit happiness available,9.21,"unprejudiced,persons,objectively,surveying,grim,events,bangladesh,march,recognised,revolt,million,people,people,forced,conclusion,life,liberty,possibility,pursuit,happiness,available",0.00,bangladesh
"the indian air force carried out several sorties against pakistan and within a week iaf aircraft dominated the skies of east pakistan it achieved near total air supremacy by the end of the first week as the entire pakistani air contingent in the east paf no squadron was grounded because of indian and bangladesh airstrikes at tejgaon kurmitolla lalmonirhat and shamsher nagar sea hawks from the carrier ins vikrant also struck chittagong barisal and coxs bazar destroying the eastern wing of the pakistan navy and effectively blockading the east pakistan ports thereby cutting off any escape routes for the stranded pakistani soldiers the nascent bangladesh navy  aided the indians in the marine warfare carrying out attacks most notably operation jackpotbetter source needed
",indian air force carried sorties pakistan week iaf aircraft dominated skies east pakistan achieved near total air supremacy end week entire pakistani air contingent east paf squadron grounded indian bangladesh airstrikes tejgaon kurmitolla lalmonirhat shamsher nagar sea hawks carrier insvikrant struck chittagong barisal coxs bazar destroying eastern wing pakistan navy effectively blockading east pakistan ports cutting escape routes stranded pakistani soldiers nascent bangladesh navy aided indians marine warfare carrying attacks notably operation jackpotbettersourceneeded,5.92,"indian,air,force,carried,sorties,pakistan,week,iaf,aircraft,dominated,skies,east,pakistan,achieved,near,total,air,supremacy,end,week,entire,pakistani,air,contingent,east,paf,squadron,grounded,indian,bangladesh,airstrikes,tejgaon,kurmitolla,lalmonirhat,shamsher,nagar,sea,hawks,carrier,insvikrant,struck,chittagong,barisal,coxs,bazar,destroying,eastern,wing,pakistan,navy,effectively,blockading,east,pakistan,ports,cutting,escape,routes,stranded,pakistani,soldiers,nascent,bangladesh,navy,aided,indians,marine,warfare,carrying,attacks,notably,operation,jackpotbettersourceneeded",0.00,bangladesh
"on  december  lt gen amir abdullah khan niazi chief martial law administrator of east pakistan and commander of pakistan army forces located in east pakistan signed the instrument of surrender at the time of surrender only a few countries had provided diplomatic recognition to the new nation over  pakistani troops surrendered to the indian forces and bangladesh liberation forces making it the largest surrender since world war ii
",december lt gen amir abdullah khan niazi chief martial law administrator east pakistan commander pakistan army forces located east pakistan signed instrument surrender time surrender countries provided diplomatic recognition new nation pakistani troops surrendered indian forces bangladesh liberation forces making largest surrender world war ii,5.31,"december,lt,gen,amir,abdullah,khan,niazi,chief,martial,law,administrator,east,pakistan,commander,pakistan,army,forces,located,east,pakistan,signed,instrument,surrender,time,surrender,countries,provided,diplomatic,recognition,new,nation,pakistani,troops,surrendered,indian,forces,bangladesh,liberation,forces,making,largest,surrender,world,war,ii",0.00,bangladesh
"bangladesh sought admission to the un with most voting in its favour china vetoed this as pakistan was its key ally the united states also a key ally of pakistan was one of the last nations to accord bangladesh recognition to ensure a smooth transition in  the simla agreement was signed between india and pakistan the treaty ensured that pakistan recognised the independence of bangladesh in exchange for the return of the pakistani pows
",bangladesh sought admission un voting favour china vetoed pakistan key ally united states key ally pakistan nations accord bangladesh recognition ensure smooth transition simla agreement signed india pakistan treaty ensured pakistan recognised independence bangladesh exchange return pakistani pows,8.20,"bangladesh,sought,admission,un,voting,favour,china,vetoed,pakistan,key,ally,united,states,key,ally,pakistan,nations,accord,bangladesh,recognition,ensure,smooth,transition,simla,agreement,signed,india,pakistan,treaty,ensured,pakistan,recognised,independence,bangladesh,exchange,return,pakistani,pows",0.00,bangladesh
"during the war there were widespread killings and other atrocitiesincluding the displacement of civilians in bangladesh  and widespread violations of human rights began with the start of operation searchlight on  march  members of the pakistani military and supporting paramilitary forces killed an estimated  to  people and raped between  and  bangladeshi women in a systematic campaign of genocidal rape pakistans religious leaders openly supported the crime by labelling bengali freedom fighters as hindus and bengali women as the booty of war but in reality more than  percent of the bengali people were muslims at that time
",war widespread killings atrocitiesincluding displacement civilians bangladesh widespread violations human rights began start operation searchlight march members pakistani military supporting paramilitary forces killed estimated people raped bangladeshi women systematic campaign genocidal rape pakistans religious leaders openly supported crime labelling bengali freedom fighters hindus bengali women booty war reality percent bengali people muslims time,6.68,"war,widespread,killings,atrocitiesincluding,displacement,civilians,bangladesh,widespread,violations,human,rights,began,start,operation,searchlight,march,members,pakistani,military,supporting,paramilitary,forces,killed,estimated,people,raped,bangladeshi,women,systematic,campaign,genocidal,rape,pakistans,religious,leaders,openly,supported,crime,labelling,bengali,freedom,fighters,hindus,bengali,women,booty,war,reality,percent,bengali,people,muslims,time",0.00,bangladesh
"a large section of the intellectual community of bangladesh were murdered mostly by the al shams and al badr forces at the instruction of the pakistani army just two days before the surrender on  december  pakistan army and razakar militia  picked up at least  physicians professors writers and engineers in dacca and murdered them leaving the dead bodies in a mass grave
",large section intellectual community bangladesh murdered al shams al badr forces instruction pakistani army days surrender december pakistan army razakar militia picked physicians professors writers engineers dacca murdered leaving dead bodies mass grave,7.80,"large,section,intellectual,community,bangladesh,murdered,al,shams,al,badr,forces,instruction,pakistani,army,days,surrender,december,pakistan,army,razakar,militia,picked,physicians,professors,writers,engineers,dacca,murdered,leaving,dead,bodies,mass,grave",0.00,bangladesh
"many mass graves have been discovered in bangladesh the first night of war on bengalis which is documented in telegrams from the american consulate in dacca to the united states state department saw indiscriminate killings of students of dacca university and other civilians numerous women were tortured raped and killed during the war the exact numbers are not known and are a subject of debate the widespread rape of bangladeshi women led to birth of thousands of war babies
",mass graves discovered bangladesh night war bengalis documented telegrams american consulate dacca united states state department saw indiscriminate killings students dacca university civilians numerous women tortured raped killed war exact numbers known subject debate widespread rape bangladeshi women led birth thousands war babies,7.55,"mass,graves,discovered,bangladesh,night,war,bengalis,documented,telegrams,american,consulate,dacca,united,states,state,department,saw,indiscriminate,killings,students,dacca,university,civilians,numerous,women,tortured,raped,killed,war,exact,numbers,known,subject,debate,widespread,rape,bangladeshi,women,led,birth,thousands,war,babies",0.00,bangladesh
"on  december  the george washington universitys national security archive published a collection of declassified documents consisting mostly of communications between us embassy officials and united states information service centres in dacca and india and officials in washington dc these documents show that us officials working in diplomatic institutions within bangladesh used the terms selective genocide and genocide  for information on events they had knowledge of at the time genocide is the term that is still used to describe the event in almost every major publication and newspaper in bangladesh although in pakistan the accusations against pakistani forces continue to be disputed
",december george washington universitys national security archive published collection declassified documents consisting communications embassy officials united states information service centres dacca india officials washington dc documents officials working diplomatic institutions bangladesh terms selective genocide genocide information events knowledge time genocide term describe event major publication newspaper bangladesh pakistan accusations pakistani forces continue disputed,6.92,"december,george,washington,universitys,national,security,archive,published,collection,declassified,documents,consisting,communications,embassy,officials,united,states,information,service,centres,dacca,india,officials,washington,dc,documents,officials,working,diplomatic,institutions,bangladesh,terms,selective,genocide,genocide,information,events,knowledge,time,genocide,term,describe,event,major,publication,newspaper,bangladesh,pakistan,accusations,pakistani,forces,continue,disputed",0.00,bangladesh
"following sheikh mujibur rahmans declaration of independence in march  a worldwide campaign was undertaken by the provisional government of bangladesh to drum up political support for the independence of east pakistan as well as humanitarian support for the bengali people
",following sheikh mujibur rahmans declaration independence march worldwide campaign undertaken provisional government bangladesh drum political support independence east pakistan humanitarian support bengali people,6.23,"following,sheikh,mujibur,rahmans,declaration,independence,march,worldwide,campaign,undertaken,provisional,government,bangladesh,drum,political,support,independence,east,pakistan,humanitarian,support,bengali,people",0.00,bangladesh
"indian prime minister indira gandhi provided extensive diplomatic and political support to the bangladesh movement she toured many countries in a bid to create awareness of the pakistani atrocities against bengalis this effort was to prove vital later during the war in framing the worlds context of the war and to justify military action by india also following pakistans defeat it ensured prompt recognition of the newly independent state of bangladesh
",indian prime minister indira gandhi provided extensive diplomatic political support bangladesh movement toured countries bid create awareness pakistani atrocities bengalis effort prove vital later war framing worlds context war justify military action india following pakistans defeat ensured prompt recognition newly independent state bangladesh,6.15,"indian,prime,minister,indira,gandhi,provided,extensive,diplomatic,political,support,bangladesh,movement,toured,countries,bid,create,awareness,pakistani,atrocities,bengalis,effort,prove,vital,later,war,framing,worlds,context,war,justify,military,action,india,following,pakistans,defeat,ensured,prompt,recognition,newly,independent,state,bangladesh",0.00,bangladesh
"most un member nations were quick to recognise bangladesh within months of its independence
",un member nations quick recognise bangladesh months independence,6.52,"un,member,nations,quick,recognise,bangladesh,months,independence",0.00,bangladesh
"as the bangladesh liberation war approached the defeat of the pakistan army the himalayan kingdom of bhutan became the first state in the world to recognise the newly independent country on  december  sheikh mujibur rahman the first president of bangladesh visited bhutan to attend the coronation of jigme singye wangchuck the fourth king of bhutan in june 
",bangladesh liberation war approached defeat pakistan army himalayan kingdom bhutan state world recognise newly independent country december sheikh mujibur rahman president bangladesh visited bhutan attend coronation jigme singye wangchuck fourth king bhutan june,6.70,"bangladesh,liberation,war,approached,defeat,pakistan,army,himalayan,kingdom,bhutan,state,world,recognise,newly,independent,country,december,sheikh,mujibur,rahman,president,bangladesh,visited,bhutan,attend,coronation,jigme,singye,wangchuck,fourth,king,bhutan,june",0.00,bangladesh
"the soviet union supported bangladesh and indian armies as well as the mukti bahini during the war recognising that the independence of bangladesh would weaken the position of its rivalsthe united states and the peoples republic of china it gave assurances to india that if a confrontation with the united states or china developed the ussr would take countermeasures this was enshrined in the indo soviet friendship treaty signed in august  the soviets also sent a nuclear submarine to ward off the threat posed by uss enterprise in the indian ocean
",soviet union supported bangladesh indian armies mukti bahini war recognising independence bangladesh weaken position rivalsthe united states peoples republic china gave assurances india confrontation united states china developed ussr countermeasures enshrined indo soviet friendship treaty signed august soviets sent nuclear submarine ward threat posed uss enterprise indian ocean,7.80,"soviet,union,supported,bangladesh,indian,armies,mukti,bahini,war,recognising,independence,bangladesh,weaken,position,rivalsthe,united,states,peoples,republic,china,gave,assurances,india,confrontation,united,states,china,developed,ussr,countermeasures,enshrined,indo,soviet,friendship,treaty,signed,august,soviets,sent,nuclear,submarine,ward,threat,posed,uss,enterprise,indian,ocean",0.00,bangladesh
"at the end of the war the warsaw pact countries were among the first to recognise bangladesh the soviet union accorded recognition to bangladesh on  january  the united states delayed recognition for some months before according it on  april 
",end war warsaw pact countries recognise bangladesh soviet union accorded recognition bangladesh january united states delayed recognition months according april,7.82,"end,war,warsaw,pact,countries,recognise,bangladesh,soviet,union,accorded,recognition,bangladesh,january,united,states,delayed,recognition,months,according,april",0.00,bangladesh
"when bangladesh applied for membership to the united nations in  china vetoed their application because two united nations resolutions regarding the repatriation of pakistani prisoners of war and civilians had not yet been implemented china was also among the last countries to recognise independent bangladesh refusing to do so until  august 
",bangladesh applied membership united nations china vetoed application united nations resolutions repatriation pakistani prisoners war civilians implemented china countries recognise independent bangladesh refusing august,7.85,"bangladesh,applied,membership,united,nations,china,vetoed,application,united,nations,resolutions,repatriation,pakistani,prisoners,war,civilians,implemented,china,countries,recognise,independent,bangladesh,refusing,august",0.00,bangladesh
