Unclean,Clean,Noise_Pre_Processing,Training_Data,Noise_Post_Processing,Query
"apart from yaowarat bangkok also has several other distinct ethnic neighbourhoods the indian community is centred in phahurat where the gurdwara siri guru singh sabha founded in  is located ban khrua on saen saep canal is home to descendants of the cham who settled in the late th century although the portuguese who settled during the thonburi period have ceased to exist as a distinct community their past is reflected in santa cruz church on the west bank of the river likewise assumption cathedral on charoen krung road is among many european style buildings in the old farang quarter where european diplomats and merchants lived in the late th to early th centuries nearby the haroon mosque is the centre of a muslim community newer expatriate communities exist along sukhumvit road including the japanese community near soi phrom phong and soi thong lo and the arab and north african neighbourhood along soi nana sukhumvit plaza a mall on soi sukhumvit  is popularly known as korea town
",apart yaowarat bangkok distinct ethnic neighbourhoods indian community centred phahurat gurdwara siri guru singh sabha founded located ban khrua saen saep canal home descendants cham settled late th century portuguese settled thonburi period ceased exist distinct community past reflected santa cruz church west bank river likewise assumption cathedral charoen krung road european style buildings old farang quarter european diplomats merchants lived late th early th centuries nearby haroon mosque centre muslim community newer expatriate communities exist sukhumvit road including japanese community near soi phrom phong soi thong lo arab north african neighbourhood soi nana sukhumvit plaza mall soi sukhumvit popularly known korea town,6.34,"apart,yaowarat,bangkok,distinct,ethnic,neighbourhoods,indian,community,centred,phahurat,gurdwara,siri,guru,singh,sabha,founded,located,ban,khrua,saen,saep,canal,home,descendants,cham,settled,late,th,century,portuguese,settled,thonburi,period,ceased,exist,distinct,community,past,reflected,santa,cruz,church,west,bank,river,likewise,assumption,cathedral,charoen,krung,road,european,style,buildings,old,farang,quarter,european,diplomats,merchants,lived,late,th,early,th,centuries,nearby,haroon,mosque,centre,muslim,community,newer,expatriate,communities,exist,sukhumvit,road,including,japanese,community,near,soi,phrom,phong,soi,thong,lo,arab,north,african,neighbourhood,soi,nana,sukhumvit,plaza,mall,soi,sukhumvit,popularly,known,korea,town",0.00,bangkok
"bangkok is the economic centre of thailand and the heart of the countrys investment and development in  the city had an economic output of  trillion baht  contributing  percent of the gross domestic product  this amounted to a per capita gdp value of  baht  almost three times the national average of  baht  the bangkok metropolitan region had a combined output of  trillion baht  or  percent of gdp bangkoks economy ranked as the sixth among asian cities in terms of per capita gdp after singapore hong kong tokyo osakakobe and seoul as of needs update
",bangkok economic centre thailand heart countrys investment development city economic output trillion baht contributing percent gross domestic product amounted capita gdp value baht times national average baht bangkok metropolitan region combined output trillion baht percent gdp bangkoks economy ranked sixth asian cities terms capita gdp singapore hong kong tokyo osakakobe seoul needs update,7.22,"bangkok,economic,centre,thailand,heart,countrys,investment,development,city,economic,output,trillion,baht,contributing,percent,gross,domestic,product,amounted,capita,gdp,value,baht,times,national,average,baht,bangkok,metropolitan,region,combined,output,trillion,baht,percent,gdp,bangkoks,economy,ranked,sixth,asian,cities,terms,capita,gdp,singapore,hong,kong,tokyo,osakakobe,seoul,needs,update",0.00,bangkok
"wholesale and retail trade is the largest sector in the citys economy contributing  percent of bangkoks gross provincial product it is followed by manufacturing  real estate renting and business activities  transport and communications  and financial intermediation  bangkok alone accounts for  percent of thailands service sector which in turn constitutes  percent of gdp when the bangkok metropolitan region is considered manufacturing is the most significant contributor at  percent of the gross regional product reflecting the density of industry in the bangkoks neighbouring provinces the automotive industry based around greater bangkok is the largest production hub in southeast asia tourism is also a significant contributor to bangkoks economy generating  billion baht  in revenue in 
",wholesale retail trade largest sector citys economy contributing percent bangkoks gross provincial product followed manufacturing real estate renting business activities transport communications financial intermediation bangkok accounts percent thailands service sector turn constitutes percent gdp bangkok metropolitan region considered manufacturing significant contributor percent gross regional product reflecting density industry bangkoks neighbouring provinces automotive industry based greater bangkok largest production hub southeast asia tourism significant contributor bangkoks economy generating billion baht revenue,5.29,"wholesale,retail,trade,largest,sector,citys,economy,contributing,percent,bangkoks,gross,provincial,product,followed,manufacturing,real,estate,renting,business,activities,transport,communications,financial,intermediation,bangkok,accounts,percent,thailands,service,sector,turn,constitutes,percent,gdp,bangkok,metropolitan,region,considered,manufacturing,significant,contributor,percent,gross,regional,product,reflecting,density,industry,bangkoks,neighbouring,provinces,automotive,industry,based,greater,bangkok,largest,production,hub,southeast,asia,tourism,significant,contributor,bangkoks,economy,generating,billion,baht,revenue",0.00,bangkok
"the stock exchange of thailand  is on ratchadaphisek road in inner bangkok the set together with the market for alternative investment  has  listed companies as of the end of  with a combined market capitalization of  trillion baht  due to the large amount of foreign representation thailand has for several years been a mainstay of the southeast asian economy and a centre of asian business the globalization and world cities research network ranks bangkok as an alpha   world city and it is ranked th in zyens global financial centres index 
",stock exchange thailand ratchadaphisek road inner bangkok set market alternative investment listed companies end combined market capitalization trillion baht large foreign representation thailand years mainstay southeast asian economy centre asian business globalization world cities research network ranks bangkok alpha world city ranked th zyens global financial centres index,7.54,"stock,exchange,thailand,ratchadaphisek,road,inner,bangkok,set,market,alternative,investment,listed,companies,end,combined,market,capitalization,trillion,baht,large,foreign,representation,thailand,years,mainstay,southeast,asian,economy,centre,asian,business,globalization,world,cities,research,network,ranks,bangkok,alpha,world,city,ranked,th,zyens,global,financial,centres,index",0.00,bangkok
"bangkok is home to the headquarters of all of thailands major commercial banks and financial institutions as well as the countrys largest companies many multinational corporations base their regional headquarters in bangkok due to the lower cost of labour and operations relative to other major asian business centres seventeen thai companies are listed on the forbes  all of which are based in the capital including ptt the only fortune global  company in thailand
",bangkok home headquarters thailands major commercial banks financial institutions countrys largest companies multinational corporations base regional headquarters bangkok lower cost labour operations relative major asian business centres seventeen thai companies listed forbes based capital including ptt fortune global company thailand,7.08,"bangkok,home,headquarters,thailands,major,commercial,banks,financial,institutions,countrys,largest,companies,multinational,corporations,base,regional,headquarters,bangkok,lower,cost,labour,operations,relative,major,asian,business,centres,seventeen,thai,companies,listed,forbes,based,capital,including,ptt,fortune,global,company,thailand",0.00,bangkok
"income inequality is a major issue in bangkok especially between relatively unskilled lower income immigrants from rural provinces and neighbouring countries and middle class professionals and business elites although absolute poverty rates are lowonly  percent of bangkoks registered residents were living under the poverty line in  compared to a national average of  percenteconomic disparity is still substantial the city has a gini coefficient of  indicating a high level of inequality
",income inequality major issue bangkok especially relatively unskilled lower income immigrants rural provinces neighbouring countries middle class professionals business elites absolute poverty rates lowonly percent bangkoks registered residents living poverty line compared national average percenteconomic disparity substantial city gini coefficient indicating high level inequality,5.31,"income,inequality,major,issue,bangkok,especially,relatively,unskilled,lower,income,immigrants,rural,provinces,neighbouring,countries,middle,class,professionals,business,elites,absolute,poverty,rates,lowonly,percent,bangkoks,registered,residents,living,poverty,line,compared,national,average,percenteconomic,disparity,substantial,city,gini,coefficient,indicating,high,level,inequality",0.00,bangkok
"bangkok is one of the worlds top tourist destinations of  cities worldwide mastercard ranked bangkok as the top destination city by international visitor arrivals in its global destination cities index  ahead of london with just over  million overnight visitors in  this was a repeat of its  ranking  euromonitor international ranked bangkok fourth in its top city destinations ranking for  bangkok was also named worlds best city by travel  leisure magazines survey of its readers for four consecutive years from  to 
as the main gateway through which visitors arrive in thailand bangkok is visited by the majority of international tourists to the country domestic tourism is also prominent the department of tourism recorded  thai and  foreign visitors to bangkok in  lodgings were made by  guests who occupied  percent of the citys  hotel rooms bangkok also topped the list as the worlds most popular tourist destinations in  rankings
",bangkok worlds tourist destinations cities worldwide mastercard ranked bangkok destination city international visitor arrivals global destination cities index ahead london million overnight visitors repeat ranking euromonitor international ranked bangkok fourth city destinations ranking bangkok named worlds best city travel leisure magazines survey readers consecutive years main gateway visitors arrive thailand bangkok visited majority international tourists country domestic tourism prominent department tourism recorded thai foreign visitors bangkok lodgings guests occupied percent citys hotel rooms bangkok topped list worlds popular tourist destinations rankings,6.93,"bangkok,worlds,tourist,destinations,cities,worldwide,mastercard,ranked,bangkok,destination,city,international,visitor,arrivals,global,destination,cities,index,ahead,london,million,overnight,visitors,repeat,ranking,euromonitor,international,ranked,bangkok,fourth,city,destinations,ranking,bangkok,named,worlds,best,city,travel,leisure,magazines,survey,readers,consecutive,years,main,gateway,visitors,arrive,thailand,bangkok,visited,majority,international,tourists,country,domestic,tourism,prominent,department,tourism,recorded,thai,foreign,visitors,bangkok,lodgings,guests,occupied,percent,citys,hotel,rooms,bangkok,topped,list,worlds,popular,tourist,destinations,rankings",0.00,bangkok
"among bangkoks well known sights are the grand palace and major buddhist temples including wat phra kaew wat pho and wat arun the giant swing and erawan shrine demonstrate hinduisms deep rooted influence in thai culture vimanmek mansion in dusit palace is famous as the worlds largest teak building while the jim thompson house provides an example of traditional thai architecture other major museums include the bangkok national museum and the royal barge national museum cruises and boat trips on the chao phraya and the canals of thonburi offer views of some of the citys traditional architecture and ways of life on the waterfront
",bangkoks known sights grand palace major buddhist temples including wat phra kaew wat pho wat arun giant swing erawan shrine demonstrate hinduisms deep rooted influence thai culture vimanmek mansion dusit palace famous worlds largest teak building jim thompson house provides example traditional thai architecture major museums include bangkok national museum royal barge national museum cruises boat trips chao phraya canals thonburi offer views citys traditional architecture ways life waterfront,5.51,"bangkoks,known,sights,grand,palace,major,buddhist,temples,including,wat,phra,kaew,wat,pho,wat,arun,giant,swing,erawan,shrine,demonstrate,hinduisms,deep,rooted,influence,thai,culture,vimanmek,mansion,dusit,palace,famous,worlds,largest,teak,building,jim,thompson,house,provides,example,traditional,thai,architecture,major,museums,include,bangkok,national,museum,royal,barge,national,museum,cruises,boat,trips,chao,phraya,canals,thonburi,offer,views,citys,traditional,architecture,ways,life,waterfront",0.00,bangkok
"shopping venues many of which are popular with both tourists and locals range from the shopping centres and department stores concentrated in siam and ratchaprasong to the sprawling chatuchak weekend market taling chan floating market is among the few such markets in bangkok yaowarat is known for its shops as well as street side food stalls and restaurants which are also found throughout the city khao san road has long been famous as a destination for backpacker tourism with its budget accommodation shops and bars attracting visitors from all over the world
",shopping venues popular tourists locals range shopping centres department stores concentrated siam ratchaprasong sprawling chatuchak weekend market taling chan floating market markets bangkok yaowarat known shops street food stalls restaurants found city khao san road long famous destination backpacker tourism budget accommodation shops bars attracting visitors world,7.98,"shopping,venues,popular,tourists,locals,range,shopping,centres,department,stores,concentrated,siam,ratchaprasong,sprawling,chatuchak,weekend,market,taling,chan,floating,market,markets,bangkok,yaowarat,known,shops,street,food,stalls,restaurants,found,city,khao,san,road,long,famous,destination,backpacker,tourism,budget,accommodation,shops,bars,attracting,visitors,world",0.00,bangkok
"bangkok has a reputation overseas as a major destination in the sex industry although prostitution is technically illegal and is rarely openly discussed in thailand it commonly takes place among massage parlours saunas and hourly hotels serving foreign tourists as well as locals bangkok has acquired the nickname sin city of asia for its level of sex tourism
",bangkok reputation overseas major destination sex industry prostitution technically illegal rarely openly discussed thailand commonly takes place massage parlours saunas hourly hotels serving foreign tourists locals bangkok acquired nickname sin city asia level sex tourism,6.39,"bangkok,reputation,overseas,major,destination,sex,industry,prostitution,technically,illegal,rarely,openly,discussed,thailand,commonly,takes,place,massage,parlours,saunas,hourly,hotels,serving,foreign,tourists,locals,bangkok,acquired,nickname,sin,city,asia,level,sex,tourism",0.00,bangkok
"the culture of bangkok reflects its position as thailands centre of wealth and modernisation the city has long been the portal of entry of western concepts and material goods which have been adopted and blended with thai values to various degrees by its residents this is most evident in the lifestyles of the expanding middle class conspicuous consumption serves as a display of economic and social status and shopping centres are popular weekend hangouts ownership of electronics and consumer products such as mobile phones is ubiquitous this has been accompanied by a degree of secularism as religions role in everyday life has rather diminished although such trends have spread to other urban centres and to a degree the countryside bangkok remains at the forefront of social change
",culture bangkok reflects position thailands centre wealth modernisation city long portal entry western concepts material goods adopted blended thai values degrees residents evident lifestyles expanding middle class conspicuous consumption serves display economic social status shopping centres popular weekend hangouts ownership electronics consumer products mobile phones ubiquitous accompanied degree secularism religions role everyday life diminished trends spread urban centres degree countryside bangkok remains forefront social change,7.88,"culture,bangkok,reflects,position,thailands,centre,wealth,modernisation,city,long,portal,entry,western,concepts,material,goods,adopted,blended,thai,values,degrees,residents,evident,lifestyles,expanding,middle,class,conspicuous,consumption,serves,display,economic,social,status,shopping,centres,popular,weekend,hangouts,ownership,electronics,consumer,products,mobile,phones,ubiquitous,accompanied,degree,secularism,religions,role,everyday,life,diminished,trends,spread,urban,centres,degree,countryside,bangkok,remains,forefront,social,change",0.00,bangkok
"a distinct feature of bangkok is the ubiquity of street vendors selling goods ranging from food items to clothing and accessories it has been estimated that the city may have over  hawkers while the bma has authorised the practice in  sites the majority of activity in another  sites takes place illegally although they take up pavement space and block pedestrian traffic many of the citys residents depend on these vendors for their meals and the bmas efforts to curb their numbers have largely been unsuccessful
",distinct feature bangkok ubiquity street vendors selling goods ranging food items clothing accessories estimated city hawkers bma authorised practice sites majority activity sites takes place illegally pavement space block pedestrian traffic citys residents depend vendors meals bmas efforts curb numbers largely unsuccessful,8.37,"distinct,feature,bangkok,ubiquity,street,vendors,selling,goods,ranging,food,items,clothing,accessories,estimated,city,hawkers,bma,authorised,practice,sites,majority,activity,sites,takes,place,illegally,pavement,space,block,pedestrian,traffic,citys,residents,depend,vendors,meals,bmas,efforts,curb,numbers,largely,unsuccessful",0.00,bangkok
"the residents of bangkok celebrate many of thailands annual festivals during songkran on  april traditional rituals as well as water fights take place throughout the city loi krathong usually in november is accompanied by the golden mount fair new year celebrations take place at many venues the most prominent being the plaza in front of centralworld observances related to the royal family are held primarily in bangkok wreaths are laid at king chulalongkorns equestrian statue in the royal plaza on  october which is king chulalongkorn memorial day the present kings and queens birthdays respectively on  december and  august are marked as thailands national fathers day and national mothers day these national holidays are celebrated by royal audiences on the days eve in which the king or queen gives a speech and public gatherings on the day of the observance the kings birthday is also marked by the royal guards parade
",residents bangkok celebrate thailands annual festivals songkran april traditional rituals water fights place city loi krathong usually november accompanied golden mount fair new year celebrations place venues prominent plaza centralworld observances related royal family held primarily bangkok wreaths laid king chulalongkorns equestrian statue royal plaza october king chulalongkorn memorial day present kings queens birthdays respectively december august marked thailands national fathers day national mothers day national holidays celebrated royal audiences days eve king queen gives speech public gatherings day observance kings birthday marked royal guards parade,6.90,"residents,bangkok,celebrate,thailands,annual,festivals,songkran,april,traditional,rituals,water,fights,place,city,loi,krathong,usually,november,accompanied,golden,mount,fair,new,year,celebrations,place,venues,prominent,plaza,centralworld,observances,related,royal,family,held,primarily,bangkok,wreaths,laid,king,chulalongkorns,equestrian,statue,royal,plaza,october,king,chulalongkorn,memorial,day,present,kings,queens,birthdays,respectively,december,august,marked,thailands,national,fathers,day,national,mothers,day,national,holidays,celebrated,royal,audiences,days,eve,king,queen,gives,speech,public,gatherings,day,observance,kings,birthday,marked,royal,guards,parade",0.00,bangkok
"bangkok was designated as the world book capital for the year  by unesco
",bangkok designated world book capital year unesco,8.22,"bangkok,designated,world,book,capital,year,unesco",0.00,bangkok
"bangkoks first thai international gay pride festival took place on october   pride parades have also been held in bangkok with the first official parade held in  under the name bangkok naruemit pride parade pride parades were announced to be a part of bangkoks  monthly festivals in 
",bangkoks thai international gay pride festival took place october pride parades held bangkok official parade held bangkok naruemit pride parade pride parades announced bangkoks monthly festivals,7.04,"bangkoks,thai,international,gay,pride,festival,took,place,october,pride,parades,held,bangkok,official,parade,held,bangkok,naruemit,pride,parade,pride,parades,announced,bangkoks,monthly,festivals",0.00,bangkok
"bangkok is the centre of thailands media industry all national newspapers broadcast media and major publishers are based in the capital its  national newspapers had a combined daily circulation of about two million in  these include the mass oriented thai rath khao sod and daily news the first of which currently prints a million copies per day as well as the less sensational matichon and krungthep thurakij the bangkok post and the nation are the two national english language dailies foreign publications including the asian wall street journal financial times the straits times and the yomiuri shimbun also have operations in bangkok the large majority of thailands more than  magazines are published in the capital and include news magazines as well as lifestyle entertainment gossip and fashion related publications
",bangkok centre thailands media industry national newspapers broadcast media major publishers based capital national newspapers combined daily circulation million include mass oriented thai rath khao sod daily news currently prints million copies day sensational matichon krungthep thurakij bangkok post nation national english language dailies foreign publications including asian wall street journal financial times straits times yomiuri shimbun operations bangkok large majority thailands magazines published capital include news magazines lifestyle entertainment gossip fashion related publications,6.68,"bangkok,centre,thailands,media,industry,national,newspapers,broadcast,media,major,publishers,based,capital,national,newspapers,combined,daily,circulation,million,include,mass,oriented,thai,rath,khao,sod,daily,news,currently,prints,million,copies,day,sensational,matichon,krungthep,thurakij,bangkok,post,nation,national,english,language,dailies,foreign,publications,including,asian,wall,street,journal,financial,times,straits,times,yomiuri,shimbun,operations,bangkok,large,majority,thailands,magazines,published,capital,include,news,magazines,lifestyle,entertainment,gossip,fashion,related,publications",0.00,bangkok
