Unclean,Clean,Noise_Pre_Processing,Training_Data,Noise_Post_Processing,Query
"bangkok is also the hub of thailands broadcast television all six national terrestrial channels channels   and  modernine nbt and thai pbs have headquarters and main studios in the capital gmm grammy is thailands largest mass media conglomerate is also headquartered in bangkok as well with the exception of local news segments broadcast by the nbt all programming is done in bangkok and repeated throughout the provinces however this centralised model is weakening with the rise of cable television which has many local providers there are numerous cable and satellite channels based in bangkok truevisions is the major subscription television provider in bangkok and thailand and it also carries international programming bangkok was home to  of thailands  fm radio stations and  of its  am stations in  broadcast media reform stipulated by the  constitution has been progressing slowly although many community radio stations have emerged in the city
",bangkok hub thailands broadcast television national terrestrial channels channels modernine nbt thai pbs headquarters main studios capital gmm grammy thailands largest mass media conglomerate headquartered bangkok exception local news segments broadcast nbt programming bangkok repeated provinces centralised model weakening rise cable television local providers numerous cable satellite channels based bangkok truevisions major subscription television provider bangkok thailand carries international programming bangkok home thailands fm radio stations stations broadcast media reform stipulated constitution progressing slowly community radio stations emerged city,7.03,"bangkok,hub,thailands,broadcast,television,national,terrestrial,channels,channels,modernine,nbt,thai,pbs,headquarters,main,studios,capital,gmm,grammy,thailands,largest,mass,media,conglomerate,headquartered,bangkok,exception,local,news,segments,broadcast,nbt,programming,bangkok,repeated,provinces,centralised,model,weakening,rise,cable,television,local,providers,numerous,cable,satellite,channels,based,bangkok,truevisions,major,subscription,television,provider,bangkok,thailand,carries,international,programming,bangkok,home,thailands,fm,radio,stations,stations,broadcast,media,reform,stipulated,constitution,progressing,slowly,community,radio,stations,emerged,city",0.00,bangkok
"likewise bangkok has dominated the thai film industry since its inception although film settings normally feature locations throughout the country the city is home to all major film studios in thailand such as gdh   sahamongkol film international and five star production bangkok has dozens of cinemas and multiplexes and the city hosts two major film festivals annually the bangkok international film festival and the world film festival of bangkok
",likewise bangkok dominated thai film industry inception film settings normally feature locations country city home major film studios thailand gdh sahamongkol film international star production bangkok dozens cinemas multiplexes city hosts major film festivals annually bangkok international film festival world film festival bangkok,5.78,"likewise,bangkok,dominated,thai,film,industry,inception,film,settings,normally,feature,locations,country,city,home,major,film,studios,thailand,gdh,sahamongkol,film,international,star,production,bangkok,dozens,cinemas,multiplexes,city,hosts,major,film,festivals,annually,bangkok,international,film,festival,world,film,festival,bangkok",0.00,bangkok
"traditional thai art long developed within religious and royal contexts continues to be sponsored by various government agencies in bangkok including the department of fine arts office of traditional arts the support foundation in chitralada palace sponsors traditional and folk handicrafts various communities throughout the city still practice their traditional crafts including the production of khon masks alms bowls and classical musical instruments the national gallery hosts permanent collection of traditional and modern art with temporary contemporary exhibits bangkoks contemporary art scene has slowly grown from relative obscurity into the public sphere over the past two decades private galleries gradually emerged to provide exposure for new artists including the patravadi theatre and h gallery the centrally located bangkok art and culture centre opened in  following a fifteen year lobbying campaign is now the largest public exhibition space in the city there are also many other art galleries and museums including the privately owned museum of contemporary art
",traditional thai art long developed religious royal contexts continues sponsored government agencies bangkok including department fine arts office traditional arts support foundation chitralada palace sponsors traditional folk handicrafts communities city practice traditional crafts including production khon masks alms bowls classical musical instruments national gallery hosts permanent collection traditional modern art temporary contemporary exhibits bangkoks contemporary art scene slowly grown relative obscurity public sphere past decades private galleries gradually emerged provide exposure new artists including patravadi theatre h gallery centrally located bangkok art culture centre opened following year lobbying campaign largest public exhibition space city art galleries museums including privately owned museum contemporary art,5.00,"traditional,thai,art,long,developed,religious,royal,contexts,continues,sponsored,government,agencies,bangkok,including,department,fine,arts,office,traditional,arts,support,foundation,chitralada,palace,sponsors,traditional,folk,handicrafts,communities,city,practice,traditional,crafts,including,production,khon,masks,alms,bowls,classical,musical,instruments,national,gallery,hosts,permanent,collection,traditional,modern,art,temporary,contemporary,exhibits,bangkoks,contemporary,art,scene,slowly,grown,relative,obscurity,public,sphere,past,decades,private,galleries,gradually,emerged,provide,exposure,new,artists,including,patravadi,theatre,h,gallery,centrally,located,bangkok,art,culture,centre,opened,following,year,lobbying,campaign,largest,public,exhibition,space,city,art,galleries,museums,including,privately,owned,museum,contemporary,art",0.00,bangkok
"as is the national trend association football and muay thai dominate bangkoks spectator sport scene muangthong united bangkok united bg pathum united port and police tero are major thai league clubs based in the bangkok metropolitan region while the rajadamnern and lumpini stadiums are the main kickboxing venues
",national trend association football muay thai dominate bangkoks spectator sport scene muangthong united bangkok united bg pathum united port police tero major thai league clubs based bangkok metropolitan region rajadamnern lumpini stadiums main kickboxing venues,4.14,"national,trend,association,football,muay,thai,dominate,bangkoks,spectator,sport,scene,muangthong,united,bangkok,united,bg,pathum,united,port,police,tero,major,thai,league,clubs,based,bangkok,metropolitan,region,rajadamnern,lumpini,stadiums,main,kickboxing,venues",0.00,bangkok
"while sepak takraw can be seen played in open spaces throughout the city football and other modern sports are now the norm western sports introduced during the reign of king chulalongkorn were originally only available to the privileged and such status is still associated with certain sports golf is popular among the upwardly mobile and there are several courses in bangkok horse racing highly popular at the mid th century still takes place at the royal bangkok sports club
",sepak takraw seen played open spaces city football modern sports norm western sports introduced reign king chulalongkorn originally available privileged status associated certain sports golf popular upwardly mobile courses bangkok horse racing highly popular mid th century takes place royal bangkok sports club,7.55,"sepak,takraw,seen,played,open,spaces,city,football,modern,sports,norm,western,sports,introduced,reign,king,chulalongkorn,originally,available,privileged,status,associated,certain,sports,golf,popular,upwardly,mobile,courses,bangkok,horse,racing,highly,popular,mid,th,century,takes,place,royal,bangkok,sports,club",0.00,bangkok
"there are many public sporting facilities located throughout bangkok the two main centres are the national stadium complex which dates to  and the newer hua mak sports complex which was built for the  asian games bangkok had also hosted the games in   and  the most of any city the city was the host of the inaugural southeast asian games in  the  summer universiade and the  fifa futsal world cup
",public sporting facilities located bangkok main centres national stadium complex dates newer hua mak sports complex built asian games bangkok hosted games city city host inaugural southeast asian games summer universiade fifa futsal world cup,8.54,"public,sporting,facilities,located,bangkok,main,centres,national,stadium,complex,dates,newer,hua,mak,sports,complex,built,asian,games,bangkok,hosted,games,city,city,host,inaugural,southeast,asian,games,summer,universiade,fifa,futsal,world,cup",0.00,bangkok
"bangkok is connected to the rest of the country through the national highway and rail networks as well as by domestic flights to and from the citys two international airports its centuries old maritime transport of goods is still conducted through khlong toei port
",bangkok connected rest country national highway rail networks domestic flights citys international airports centuries old maritime transport goods conducted khlong toei port,8.30,"bangkok,connected,rest,country,national,highway,rail,networks,domestic,flights,citys,international,airports,centuries,old,maritime,transport,goods,conducted,khlong,toei,port",0.00,bangkok
"road based transport is the primary mode of travel in bangkok due to the citys organic development its streets do not follow an organized grid structure forty eight major roads link the different areas of the city branching into smaller streets and lanes  which serve local neighbourhoods eleven bridges over the chao phraya link the two sides of the city while several expressway and motorway routes bring traffic into and out of the city centre and link with nearby provinces
",road based transport primary mode travel bangkok citys organic development streets follow organized grid structure major roads link different areas city branching smaller streets lanes serve local neighbourhoods bridges chao phraya link sides city expressway motorway routes bring traffic city centre link nearby provinces,7.53,"road,based,transport,primary,mode,travel,bangkok,citys,organic,development,streets,follow,organized,grid,structure,major,roads,link,different,areas,city,branching,smaller,streets,lanes,serve,local,neighbourhoods,bridges,chao,phraya,link,sides,city,expressway,motorway,routes,bring,traffic,city,centre,link,nearby,provinces",0.00,bangkok
"bangkoks rapid growth in the s resulted in sharp increases in vehicle ownership and traffic demand which have since continuedin  there were  in use vehicles in bangkok of which  percent were private cars and  percent were motorcycles these increases in the face of limited carrying capacity caused severe traffic congestion evident by the early s the extent of the problem is such that the thai traffic police has a unit of officers trained in basic midwifery in order to assist deliveries which do not reach hospital in time while bangkoks limited road surface area  is often cited as a major because of its traffic jams other factors including high vehicle ownership rate relative to income level inadequate public transport systems and lack of transportation demand management also play a role efforts to alleviate the problem have included the construction of intersection bypasses and an extensive system of elevated highways as well as the creation of several new rapid transit systems the citys overall traffic conditions however remain poor
",bangkoks rapid growth resulted sharp increases vehicle ownership traffic demand continuedin use vehicles bangkok percent private cars percent motorcycles increases face limited carrying capacity caused severe traffic congestion evident early extent problem thai traffic police unit officers trained basic midwifery order assist deliveries reach hospital time bangkoks limited road surface area cited major traffic jams factors including high vehicle ownership rate relative income level inadequate public transport systems lack transportation demand management play role efforts alleviate problem included construction intersection bypasses extensive system elevated highways creation new rapid transit systems citys overall traffic conditions remain poor,6.86,"bangkoks,rapid,growth,resulted,sharp,increases,vehicle,ownership,traffic,demand,continuedin,use,vehicles,bangkok,percent,private,cars,percent,motorcycles,increases,face,limited,carrying,capacity,caused,severe,traffic,congestion,evident,early,extent,problem,thai,traffic,police,unit,officers,trained,basic,midwifery,order,assist,deliveries,reach,hospital,time,bangkoks,limited,road,surface,area,cited,major,traffic,jams,factors,including,high,vehicle,ownership,rate,relative,income,level,inadequate,public,transport,systems,lack,transportation,demand,management,play,role,efforts,alleviate,problem,included,construction,intersection,bypasses,extensive,system,elevated,highways,creation,new,rapid,transit,systems,citys,overall,traffic,conditions,remain,poor",0.00,bangkok
"traffic has been the main source of air pollution in bangkok which reached serious levels in the s but efforts to improve air quality by improving fuel quality and enforcing emission standards among others had visibly ameliorated the problem by the s atmospheric particulate matter levels dropped from  micrograms per cubic metre in  to  in  however increasing vehicle numbers and a lack of continued pollution control efforts threatens a reversal of the past success in januaryfebruary  weather conditions caused bouts of haze to cover the city with particulate matter under  micrometres  rising to unhealthy levels for several days on end
",traffic main source air pollution bangkok reached levels efforts improve air quality improving fuel quality enforcing emission standards visibly ameliorated problem atmospheric particulate matter levels dropped micrograms cubic metre increasing vehicle numbers lack continued pollution control efforts threatens reversal past success januaryfebruary weather conditions caused bouts haze cover city particulate matter micrometres rising unhealthy levels days end,6.71,"traffic,main,source,air,pollution,bangkok,reached,levels,efforts,improve,air,quality,improving,fuel,quality,enforcing,emission,standards,visibly,ameliorated,problem,atmospheric,particulate,matter,levels,dropped,micrograms,cubic,metre,increasing,vehicle,numbers,lack,continued,pollution,control,efforts,threatens,reversal,past,success,januaryfebruary,weather,conditions,caused,bouts,haze,cover,city,particulate,matter,micrometres,rising,unhealthy,levels,days,end",0.00,bangkok
"although the bma has created thirty signed bicycle routes along several roads totalling  kilometres  cycling is still largely impractical especially in the city centre most of these bicycle lanes share the pavement with pedestrians poor surface maintenance encroachment by hawkers and street vendors and a hostile environment for cyclists and pedestrians make cycling and walking unpopular methods of getting around in bangkok
",bma created thirty signed bicycle routes roads totalling kilometres cycling largely impractical especially city centre bicycle lanes share pavement pedestrians poor surface maintenance encroachment hawkers street vendors hostile environment cyclists pedestrians cycling walking unpopular methods getting bangkok,5.85,"bma,created,thirty,signed,bicycle,routes,roads,totalling,kilometres,cycling,largely,impractical,especially,city,centre,bicycle,lanes,share,pavement,pedestrians,poor,surface,maintenance,encroachment,hawkers,street,vendors,hostile,environment,cyclists,pedestrians,cycling,walking,unpopular,methods,getting,bangkok",0.00,bangkok
"bangkok has an extensive bus network providing local transit services within the greater bangkok area the bangkok mass transit authority  operates a monopoly on bus services with substantial concessions granted to private operators buses minibus vans and song thaeo operate on a total of  routes throughout the region a separate bus rapid transit system owned by the bma has been in operation since  known simply as the brt the system currently consists of a single line running from the business district at sathon to ratchaphruek on the western side of the city the transport co ltd is the bmtas long distance counterpart with services to all provinces operating out of bangkok
",bangkok extensive bus network providing local transit services greater bangkok area bangkok mass transit authority operates monopoly bus services substantial concessions granted private operators buses minibus vans song thaeo operate total routes region separate bus rapid transit system owned bma operation known simply brt system currently consists single line running business district sathon ratchaphruek western city transport co ltd bmtas long distance counterpart services provinces operating bangkok,6.47,"bangkok,extensive,bus,network,providing,local,transit,services,greater,bangkok,area,bangkok,mass,transit,authority,operates,monopoly,bus,services,substantial,concessions,granted,private,operators,buses,minibus,vans,song,thaeo,operate,total,routes,region,separate,bus,rapid,transit,system,owned,bma,operation,known,simply,brt,system,currently,consists,single,line,running,business,district,sathon,ratchaphruek,western,city,transport,co,ltd,bmtas,long,distance,counterpart,services,provinces,operating,bangkok",0.00,bangkok
"taxis are ubiquitous in bangkok and are a popular form of transport as of august update there are  cars  motorcycles and  tuk tuk motorized tricycles cumulatively registered for use as taxis meters have been required for car taxis since  while tuk tuk fares are usually negotiated motorcycle taxis operate from regulated ranks with either fixed or negotiable fares and are usually employed for relatively short journeys
",taxis ubiquitous bangkok popular form transport augustupdate cars motorcycles tuk tuk motorized tricycles cumulatively registered use taxis meters required car taxis tuk tuk fares usually negotiated motorcycle taxis operate regulated ranks fixed negotiable fares usually employed relatively short journeys,6.19,"taxis,ubiquitous,bangkok,popular,form,transport,augustupdate,cars,motorcycles,tuk,tuk,motorized,tricycles,cumulatively,registered,use,taxis,meters,required,car,taxis,tuk,tuk,fares,usually,negotiated,motorcycle,taxis,operate,regulated,ranks,fixed,negotiable,fares,usually,employed,relatively,short,journeys",0.00,bangkok
"bangkok is the location of hua lamphong railway station the main terminus of the national rail network operated by the state railway of thailand  in addition to long distance services the srt also operates a few daily commuter trains running from and to the outskirts of the city during the rush hour
",bangkok location hua lamphong railway station main terminus national rail network operated state railway thailand addition long distance services srt operates daily commuter trains running outskirts city rush hour,7.64,"bangkok,location,hua,lamphong,railway,station,main,terminus,national,rail,network,operated,state,railway,thailand,addition,long,distance,services,srt,operates,daily,commuter,trains,running,outskirts,city,rush,hour",0.00,bangkok
"bangkok is served by four rapid transit systems the bts skytrain the mrt the srt red lines and the elevated airport rail link although proposals for the development of rapid transit in bangkok had been made since  it was only in  that the bts finally began operation
",bangkok served rapid transit systems bts skytrain mrt srt red lines elevated airport rail link proposals development rapid transit bangkok bts finally began operation,8.61,"bangkok,served,rapid,transit,systems,bts,skytrain,mrt,srt,red,lines,elevated,airport,rail,link,proposals,development,rapid,transit,bangkok,bts,finally,began,operation",0.00,bangkok
"as of september update construction work is ongoing to extend the city wide transit systems reach including the construction of the light red grade separated commuter rail line the entire mass rapid transit master plan in bangkok metropolitan region consists of eight main lines and four feeder lines totaling  kilometres  to be completed by  in addition to rapid transit and heavy rail lines there have been proposals for several monorail systems
",september update construction work ongoing extend city wide transit systems reach including construction light red grade separated commuter rail line entire mass rapid transit master plan bangkok metropolitan region consists main lines feeder lines totaling kilometres completed addition rapid transit heavy rail lines proposals monorail systems,5.58,"september,update,construction,work,ongoing,extend,city,wide,transit,systems,reach,including,construction,light,red,grade,separated,commuter,rail,line,entire,mass,rapid,transit,master,plan,bangkok,metropolitan,region,consists,main,lines,feeder,lines,totaling,kilometres,completed,addition,rapid,transit,heavy,rail,lines,proposals,monorail,systems",0.00,bangkok
"although much diminished from its past prominence water based transport still plays an important role in bangkok and the immediate upstream and downstream provinces several water buses serve commuters daily the chao phraya express boat serves thirty four stops along the river carrying an average of  passengers per day in  while the smaller khlong saen saep boat service serves twenty seven stops on saen saep canal with  daily passengers long tail boats operate on fifteen regular routes on the chao phraya and passenger ferries at thirty two river crossings served an average of  daily passengers in 
",diminished past prominence water based transport plays important role bangkok immediate upstream downstream provinces water buses serve commuters daily chao phraya express boat serves thirty stops river carrying average passengers day smaller khlong saen saep boat service serves seven stops saen saep canal daily passengers long tail boats operate regular routes chao phraya passenger ferries thirty river crossings served average daily passengers,5.63,"diminished,past,prominence,water,based,transport,plays,important,role,bangkok,immediate,upstream,downstream,provinces,water,buses,serve,commuters,daily,chao,phraya,express,boat,serves,thirty,stops,river,carrying,average,passengers,day,smaller,khlong,saen,saep,boat,service,serves,seven,stops,saen,saep,canal,daily,passengers,long,tail,boats,operate,regular,routes,chao,phraya,passenger,ferries,thirty,river,crossings,served,average,daily,passengers",0.00,bangkok
"bangkok port popularly known by its location as khlong toei port was thailands main international port from its opening in  until it was superseded by the deep sea laem chabang port in  it is primarily a cargo port though its inland location limits access to ships of  deadweight tonnes or less the port handled  tonnes  of cargo in the first eight months of the  fiscal year about  percent the total of the countrys international ports
",bangkok port popularly known location khlong toei port thailands main international port opening superseded deep sea laem chabang port primarily cargo port inland location limits access ships deadweight tonnes port handled tonnes cargo months fiscal year percent total countrys international ports,7.78,"bangkok,port,popularly,known,location,khlong,toei,port,thailands,main,international,port,opening,superseded,deep,sea,laem,chabang,port,primarily,cargo,port,inland,location,limits,access,ships,deadweight,tonnes,port,handled,tonnes,cargo,months,fiscal,year,percent,total,countrys,international,ports",0.00,bangkok
"bangkok is one of asias busiest air transport hubs two commercial airports serve the city the older don mueang international airport and the newer suvarnabhumi airport suvarnabhumi which replaced don mueang as bangkoks main airport after its opening in  served  passengers in  making it the worlds th busiest airport by passenger volume this volume exceeded its designed capacity of  million passengers don mueang reopened for domestic flights in  and resumed international service focusing on low cost carriers in october  suvarnabhumi is undergoing expansion to increase its capacity to  million passengers by  and  million by 
",bangkok asias busiest air transport hubs commercial airports serve city older mueang international airport newer suvarnabhumi airport suvarnabhumi replaced mueang bangkoks main airport opening served passengers making worlds th busiest airport passenger volume volume exceeded designed capacity million passengers mueang reopened domestic flights resumed international service focusing low cost carriers october suvarnabhumi undergoing expansion increase capacity million passengers million,5.56,"bangkok,asias,busiest,air,transport,hubs,commercial,airports,serve,city,older,mueang,international,airport,newer,suvarnabhumi,airport,suvarnabhumi,replaced,mueang,bangkoks,main,airport,opening,served,passengers,making,worlds,th,busiest,airport,passenger,volume,volume,exceeded,designed,capacity,million,passengers,mueang,reopened,domestic,flights,resumed,international,service,focusing,low,cost,carriers,october,suvarnabhumi,undergoing,expansion,increase,capacity,million,passengers,million",0.00,bangkok
