Unclean,Clean,Noise_Pre_Processing,Training_Data,Noise_Post_Processing,Query
"bangkoks coastal location makes it particularly vulnerable to rising sea levels due to global warming and climate change a study by the oecd has estimated that  million people in bangkok may be exposed to coastal flooding by  the seventh highest figure among the worlds port cities   there are fears that the city may be submerged by  a study published in october  in nature communications corrected earlier models of coastal elevations and concluded that up to  million thaismostly in the greater bangkok metropolitan areaface the prospect of annual flooding events this is compounded by coastal erosion which is an issue in the gulf coastal area a small length of which lies within bangkoks bang khun thian district tidal flat ecosystems existed on the coast however many have been reclaimed for agriculture aquaculture and salt works
",bangkoks coastal location makes particularly vulnerable rising sea levels global warming climate change study oecd estimated million people bangkok exposed coastal flooding seventh highest figure worlds port cities fears city submerged study published october nature communications corrected earlier models coastal elevations concluded million thaismostly greater bangkok metropolitan areaface prospect annual flooding events compounded coastal erosion issue gulf coastal area small length lies bangkoks bang khun thian district tidal flat ecosystems existed coast reclaimed agriculture aquaculture salt works,6.81,"bangkoks,coastal,location,makes,particularly,vulnerable,rising,sea,levels,global,warming,climate,change,study,oecd,estimated,million,people,bangkok,exposed,coastal,flooding,seventh,highest,figure,worlds,port,cities,fears,city,submerged,study,published,october,nature,communications,corrected,earlier,models,coastal,elevations,concluded,million,thaismostly,greater,bangkok,metropolitan,areaface,prospect,annual,flooding,events,compounded,coastal,erosion,issue,gulf,coastal,area,small,length,lies,bangkoks,bang,khun,thian,district,tidal,flat,ecosystems,existed,coast,reclaimed,agriculture,aquaculture,salt,works",0.00,bangkok
"there are no mountains in bangkok the closest mountain range is the khao khiao massif about  km  southeast of the city phu khao thong the only hill in the metropolitan area originated with a very large chedi that king rama iii  built at wat saket the chedi collapsed during construction because the soft soil could not support its weight over the next few decades the abandoned mud and brick structure acquired the shape of a natural hill and became overgrown with weeds the locals called it phu khao  as if it were a natural feature in the s enclosing concrete walls were added to stop the hill from eroding
",mountains bangkok closest mountain range khao khiao massif km southeast city phu khao thong hill metropolitan area originated large chedi king rama iii built wat saket chedi collapsed construction soft soil support weight decades abandoned mud brick structure acquired shape natural hill overgrown weeds locals called phu khao natural feature enclosing concrete walls added stop hill eroding,8.54,"mountains,bangkok,closest,mountain,range,khao,khiao,massif,km,southeast,city,phu,khao,thong,hill,metropolitan,area,originated,large,chedi,king,rama,iii,built,wat,saket,chedi,collapsed,construction,soft,soil,support,weight,decades,abandoned,mud,brick,structure,acquired,shape,natural,hill,overgrown,weeds,locals,called,phu,khao,natural,feature,enclosing,concrete,walls,added,stop,hill,eroding",0.00,bangkok
"like most of thailand bangkok has a tropical savanna climate  under the kppen climate classification and is under the influence of the south asian monsoon system the city experiences three seasons hot rainy and cool although temperatures are fairly hot year round ranging from an average low of  c  in december to an average high of  c  in april the rainy season begins with the arrival of the southwest monsoon around mid may september is the wettest month with an average rainfall of  millimetres  the rainy season lasts until october when the dry and cool northeast monsoon takes over until february the hot season is generally dry but also sees occasional summer storms the surface magnitude of bangkoks urban heat island has been measured at  c  during the day and  c  at night the highest recorded temperature of bangkok metropolis was  c  in march  and the lowest recorded temperature was  c  in january 
",like thailand bangkok tropical savanna climate kppen climate classification influence south asian monsoon system city experiences seasons hot rainy cool temperatures fairly hot year round ranging average low c december average high c april rainy season begins arrival southwest monsoon mid september wettest month average rainfall millimetres rainy season lasts october dry cool northeast monsoon takes february hot season generally dry sees occasional summer storms surface magnitude bangkoks urban heat island measured c day c night highest recorded temperature bangkok metropolis c march lowest recorded temperature c january,7.13,"like,thailand,bangkok,tropical,savanna,climate,kppen,climate,classification,influence,south,asian,monsoon,system,city,experiences,seasons,hot,rainy,cool,temperatures,fairly,hot,year,round,ranging,average,low,c,december,average,high,c,april,rainy,season,begins,arrival,southwest,monsoon,mid,september,wettest,month,average,rainfall,millimetres,rainy,season,lasts,october,dry,cool,northeast,monsoon,takes,february,hot,season,generally,dry,sees,occasional,summer,storms,surface,magnitude,bangkoks,urban,heat,island,measured,c,day,c,night,highest,recorded,temperature,bangkok,metropolis,c,march,lowest,recorded,temperature,c,january",0.00,bangkok
"the climate impact group at nasas goddard institute for space studies projected severe weather impacts on bangkok caused by climate change it found that bangkok in  had  days at or above  c in  bangkok can expect  days at or above  c the group forecasts a rise by  to on average  to  days at or above  c
",climate impact group nasas goddard institute space studies projected severe weather impacts bangkok caused climate change found bangkok days c bangkok expect days c group forecasts rise average days c,8.55,"climate,impact,group,nasas,goddard,institute,space,studies,projected,severe,weather,impacts,bangkok,caused,climate,change,found,bangkok,days,c,bangkok,expect,days,c,group,forecasts,rise,average,days,c",0.00,bangkok
"the city has grown from its original centre along the river into a sprawling metropolis surrounded by swaths of suburban residential development extending north and south into neighbouring provinces the highly populated and growing cities of nonthaburi pak kret rangsit and samut prakan are effectively now suburbs of bangkok nevertheless large agricultural areas remain within the city proper at its eastern and western fringes and a small number of forest area is found within the city limits  rai  amounting to  percent of city area land use in the city consists of  percent residential use  percent agriculture and  percent used for commerce industry and government the bmas city planning department  is responsible for planning and shaping further development it published master plan updates in  and  and a third revision is undergoing public hearings in 
",city grown original centre river sprawling metropolis surrounded swaths suburban residential development extending north south neighbouring provinces highly populated growing cities nonthaburi pak kret rangsit samut prakan effectively suburbs bangkok large agricultural areas remain city proper eastern western fringes small number forest area found city limits rai amounting percent city area land use city consists percent residential use percent agriculture percent commerce industry government bmas city planning department responsible planning shaping development published master plan updates revision undergoing public hearings,6.15,"city,grown,original,centre,river,sprawling,metropolis,surrounded,swaths,suburban,residential,development,extending,north,south,neighbouring,provinces,highly,populated,growing,cities,nonthaburi,pak,kret,rangsit,samut,prakan,effectively,suburbs,bangkok,large,agricultural,areas,remain,city,proper,eastern,western,fringes,small,number,forest,area,found,city,limits,rai,amounting,percent,city,area,land,use,city,consists,percent,residential,use,percent,agriculture,percent,commerce,industry,government,bmas,city,planning,department,responsible,planning,shaping,development,published,master,plan,updates,revision,undergoing,public,hearings",0.00,bangkok
"bangkok lacks a single distinct central business district instead the areas of siam and ratchaprasong serve as a central shopping district containing many of the bigger malls and commercial areas in the city as well as siam station the only transfer point between the citys two elevated train lines the victory monument in ratchathewi district is among its most important road junctions serving over  bus lines as well as an elevated train station from the monument phahonyothin and ratchawithi  din daeng roads respectively run north and east linking to major residential areas most of the high density development areas are within the  square kilometre  area encircled by the ratchadaphisek inner ring road ratchadaphisek is lined with businesses and retail outlets and office buildings also cluster around ratchayothin intersection in chatuchak district to the north farther from the city centre most areas are primarily mid  or low density residential the thonburi side of the city is less developed with fewer high rises with the exception of a few secondary urban centres thonburi in the same manner as the outlying eastern districts consists mostly of residential and rural areas
",bangkok lacks single distinct central business district instead areas siam ratchaprasong serve central shopping district containing bigger malls commercial areas city siam station transfer point citys elevated train lines victory monument ratchathewi district important road junctions serving bus lines elevated train station monument phahonyothin ratchawithi din daeng roads respectively run north east linking major residential areas high density development areas square kilometre area encircled ratchadaphisek inner ring road ratchadaphisek lined businesses retail outlets office buildings cluster ratchayothin intersection chatuchak district north farther city centre areas primarily mid low density residential thonburi city developed fewer high rises exception secondary urban centres thonburi manner outlying eastern districts consists residential rural areas,6.57,"bangkok,lacks,single,distinct,central,business,district,instead,areas,siam,ratchaprasong,serve,central,shopping,district,containing,bigger,malls,commercial,areas,city,siam,station,transfer,point,citys,elevated,train,lines,victory,monument,ratchathewi,district,important,road,junctions,serving,bus,lines,elevated,train,station,monument,phahonyothin,ratchawithi,din,daeng,roads,respectively,run,north,east,linking,major,residential,areas,high,density,development,areas,square,kilometre,area,encircled,ratchadaphisek,inner,ring,road,ratchadaphisek,lined,businesses,retail,outlets,office,buildings,cluster,ratchayothin,intersection,chatuchak,district,north,farther,city,centre,areas,primarily,mid,low,density,residential,thonburi,city,developed,fewer,high,rises,exception,secondary,urban,centres,thonburi,manner,outlying,eastern,districts,consists,residential,rural,areas",0.00,bangkok
"while most of bangkoks streets are fronted by vernacular shophouses the largely unrestricted building euphoria of the s has transformed the city into an urban area of skyscrapers and high rises of contrasting and clashing styles there are  skyscrapers over  metres  tall in the city bangkok was ranked as the worlds eighth tallest city in  as a result of persistent economic disparity many slums have emerged in the city in  there were over one million people living in about  informal settlements some settlements are squatted such as the large slums in khlong toei district in total there were  squatted areas
",bangkoks streets fronted vernacular shophouses largely unrestricted building euphoria transformed city urban area skyscrapers high rises contrasting clashing styles skyscrapers metres tall city bangkok ranked worlds eighth tallest city result persistent economic disparity slums emerged city million people living informal settlements settlements squatted large slums khlong toei district total squatted areas,8.01,"bangkoks,streets,fronted,vernacular,shophouses,largely,unrestricted,building,euphoria,transformed,city,urban,area,skyscrapers,high,rises,contrasting,clashing,styles,skyscrapers,metres,tall,city,bangkok,ranked,worlds,eighth,tallest,city,result,persistent,economic,disparity,slums,emerged,city,million,people,living,informal,settlements,settlements,squatted,large,slums,khlong,toei,district,total,squatted,areas",0.00,bangkok
"bangkok has several parks although these amount to a per capita total park area of only  square metres  in the city proper total green space for the entire city is moderate at  square metres  per person in the more densely built up areas of the city these numbers are as low as  and  square metres  per person more recent numbers claim that there is  square metres  of green space per person compared to an average of  square metres  in other cities across asia in europe london has  m of green space per head bangkokians thus have  times less green space than is standard in the regions urban areas green belt areas include about  square kilometres  of rice paddies and orchards on the eastern and western edges of the city although their primary purpose is to serve as flood detention basins rather than to limit urban expansion bang kachao a  square kilometre  conservation area on an oxbow of the chao phraya lies just across the southern riverbank districts in samut prakan province a master development plan has been proposed to increase total park area to  square metres  per person
",bangkok parks capita total park area square metres city proper total green space entire city moderate square metres person densely built areas city numbers low square metres person recent numbers claim square metres green space person compared average square metres cities asia europe london green space head bangkokians times green space standard regions urban areas green belt areas include square kilometres rice paddies orchards eastern western edges city primary purpose serve flood detention basins limit urban expansion bang kachao square kilometre conservation area oxbow chao phraya lies southern riverbank districts samut prakan province master development plan proposed increase total park area square metres person,7.71,"bangkok,parks,capita,total,park,area,square,metres,city,proper,total,green,space,entire,city,moderate,square,metres,person,densely,built,areas,city,numbers,low,square,metres,person,recent,numbers,claim,square,metres,green,space,person,compared,average,square,metres,cities,asia,europe,london,green,space,head,bangkokians,times,green,space,standard,regions,urban,areas,green,belt,areas,include,square,kilometres,rice,paddies,orchards,eastern,western,edges,city,primary,purpose,serve,flood,detention,basins,limit,urban,expansion,bang,kachao,square,kilometre,conservation,area,oxbow,chao,phraya,lies,southern,riverbank,districts,samut,prakan,province,master,development,plan,proposed,increase,total,park,area,square,metres,person",0.00,bangkok
"bangkoks largest parks include the centrally located lumphini park near the si lomsathon business district with an area of  hectares  the  hectare  suanluang rama ix in the east of the city and the chatuchakqueen sirikitwachirabenchathat park complex in northern bangkok which has a combined area of  hectares  more parks are expected to be created through the green bangkok  project which aims to leave the city with  square metres  of green space per person including  of the city having tree cover
",bangkoks largest parks include centrally located lumphini park near si lomsathon business district area hectares hectare suanluang rama ix east city chatuchakqueen sirikitwachirabenchathat park complex northern bangkok combined area hectares parks expected created green bangkok project aims leave city square metres green space person including city tree cover,6.39,"bangkoks,largest,parks,include,centrally,located,lumphini,park,near,si,lomsathon,business,district,area,hectares,hectare,suanluang,rama,ix,east,city,chatuchakqueen,sirikitwachirabenchathat,park,complex,northern,bangkok,combined,area,hectares,parks,expected,created,green,bangkok,project,aims,leave,city,square,metres,green,space,person,including,city,tree,cover",0.00,bangkok
"the city of bangkok has a population of  according to the  census or  percent of the national population while  estimates place the figure at  million  roughly half are internal migrants from other thai provinces population registry statistics recorded  residents belonging to  households in  much of bangkoks daytime population commutes from surrounding provinces in the bangkok metropolitan region the total population of which is   bangkok is a cosmopolitan city the census showed that it is home to  expatriates from asian countries   from europe  from the americas  from oceania and  from africa migrants from neighbouring countries include  burmese  cambodians and  lao in  numbers show that there are  international migrants registered with the department of employment more than half of them migrants from cambodia laos and myanmar
",city bangkok population according census percent national population estimates place figure million roughly half internal migrants thai provinces population registry statistics recorded residents belonging households bangkoks daytime population commutes surrounding provinces bangkok metropolitan region total population bangkok cosmopolitan city census showed home expatriates asian countries europe americas oceania africa migrants neighbouring countries include burmese cambodians lao numbers international migrants registered department employment half migrants cambodia laos myanmar,6.79,"city,bangkok,population,according,census,percent,national,population,estimates,place,figure,million,roughly,half,internal,migrants,thai,provinces,population,registry,statistics,recorded,residents,belonging,households,bangkoks,daytime,population,commutes,surrounding,provinces,bangkok,metropolitan,region,total,population,bangkok,cosmopolitan,city,census,showed,home,expatriates,asian,countries,europe,americas,oceania,africa,migrants,neighbouring,countries,include,burmese,cambodians,lao,numbers,international,migrants,registered,department,employment,half,migrants,cambodia,laos,myanmar",0.00,bangkok
"following its establishment as capital city in  bangkok grew only slightly throughout the th and early th centuries british diplomat john crawfurd visiting in  estimated its population at no more than  as a result of western medicine brought by missionaries as well as increased immigration from both within siam and overseas bangkoks population gradually increased as the city modernized in the late th century this growth became even more pronounced in the s following the discovery of antibiotics although family planning and birth control were introduced in the s the lowered birth rate was more than offset by increased migration from the provinces as economic expansion accelerated only in the s have bangkoks population growth rates decreased following the national rate thailand had long since become highly centralized around the capital in  bangkoks population was fifty one times that of hat yai and songkhla the second largest urban centre at the time making it the worlds most prominent primate city
",following establishment capital city bangkok grew slightly th early th centuries british diplomat john crawfurd visiting estimated population result western medicine brought missionaries increased immigration siam overseas bangkoks population gradually increased city modernized late th century growth pronounced following discovery antibiotics family planning birth control introduced lowered birth rate offset increased migration provinces economic expansion accelerated bangkoks population growth rates decreased following national rate thailand long highly centralized capital bangkoks population times hat yai songkhla second largest urban centre time making worlds prominent primate city,7.40,"following,establishment,capital,city,bangkok,grew,slightly,th,early,th,centuries,british,diplomat,john,crawfurd,visiting,estimated,population,result,western,medicine,brought,missionaries,increased,immigration,siam,overseas,bangkoks,population,gradually,increased,city,modernized,late,th,century,growth,pronounced,following,discovery,antibiotics,family,planning,birth,control,introduced,lowered,birth,rate,offset,increased,migration,provinces,economic,expansion,accelerated,bangkoks,population,growth,rates,decreased,following,national,rate,thailand,long,highly,centralized,capital,bangkoks,population,times,hat,yai,songkhla,second,largest,urban,centre,time,making,worlds,prominent,primate,city",0.00,bangkok
"the majority of bangkoks population identify as thaii although details on the citys ethnic make up are unavailable as the national census does not document racej bangkoks cultural pluralism dates back to the early days of its founding several ethnic communities were formed by immigrants and forced settlers including the khmer northern thai lao vietnamese mon and malay most prominent were the chinese who played major roles in the citys trade and became the majority of bangkoks populationestimates include up to three fourths in  and almost half in the sk chinese immigration was restricted from the s and effectively ceased after the chinese revolution in  their prominence subsequently declined as younger generations of thai chinese integrated and adopted a thai identity bangkok is still nevertheless home to a large chinese community with the greatest concentration in yaowarat bangkoks chinatown
",majority bangkoks population identify thaii details citys ethnic unavailable national census document racej bangkoks cultural pluralism dates early days founding ethnic communities formed immigrants forced settlers including khmer northern thai lao vietnamese mon malay prominent chinese played major roles citys trade majority bangkoks populationestimates include fourths half sk chinese immigration restricted effectively ceased chinese revolution prominence subsequently declined younger generations thai chinese integrated adopted thai identity bangkok home large chinese community greatest concentration yaowarat bangkoks chinatown,6.96,"majority,bangkoks,population,identify,thaii,details,citys,ethnic,unavailable,national,census,document,racej,bangkoks,cultural,pluralism,dates,early,days,founding,ethnic,communities,formed,immigrants,forced,settlers,including,khmer,northern,thai,lao,vietnamese,mon,malay,prominent,chinese,played,major,roles,citys,trade,majority,bangkoks,populationestimates,include,fourths,half,sk,chinese,immigration,restricted,effectively,ceased,chinese,revolution,prominence,subsequently,declined,younger,generations,thai,chinese,integrated,adopted,thai,identity,bangkok,home,large,chinese,community,greatest,concentration,yaowarat,bangkoks,chinatown",0.00,bangkok
"religion in bangkok
",religion bangkok,5.00,"religion,bangkok",0.00,bangkok
