Unclean,Clean,Noise_Pre_Processing,Training_Data,Noise_Post_Processing,Query
"the berlin wall  was a guarded concrete barrier that encircled west berlin from  to  separating it from east berlin and east germanya  construction of the berlin wall was commenced by the government of the gdr on  august  it included guard towers placed along large concrete walls accompanied by a wide area  that contained anti vehicle trenches beds of nails and other defenses
",berlin wall guarded concrete barrier encircled west berlin separating east berlin east germanya construction berlin wall commenced government gdr august included guard towers placed large concrete walls accompanied wide area contained anti vehicle trenches beds nails defenses,6.60,"berlin,wall,guarded,concrete,barrier,encircled,west,berlin,separating,east,berlin,east,germanya,construction,berlin,wall,commenced,government,gdr,august,included,guard,towers,placed,large,concrete,walls,accompanied,wide,area,contained,anti,vehicle,trenches,beds,nails,defenses",0.00,berlin
"the eastern bloc portrayed the wall as protecting its population from fascist elements conspiring to prevent the will of the people from building a socialist state in the gdr the authorities officially referred to the berlin wall as the anti fascist protection rampart  the west berlin city government sometimes referred to it as the wall of shame a term coined by mayor willy brandt in reference to the walls restriction on freedom of movement along with the separate and much longer inner german border  which demarcated the border between east and west germany it came to symbolize physically the iron curtain that separated the western bloc and neutral countries from the eastern bloc during the cold war
",eastern bloc portrayed wall protecting population fascist elements conspiring prevent people building socialist state gdr authorities officially referred berlin wall anti fascist protection rampart west berlin city government referred wall shame term coined mayor willy brandt reference walls restriction freedom movement separate longer inner german border demarcated border east west germany came symbolize physically iron curtain separated western bloc neutral countries eastern bloc cold war,7.33,"eastern,bloc,portrayed,wall,protecting,population,fascist,elements,conspiring,prevent,people,building,socialist,state,gdr,authorities,officially,referred,berlin,wall,anti,fascist,protection,rampart,west,berlin,city,government,referred,wall,shame,term,coined,mayor,willy,brandt,reference,walls,restriction,freedom,movement,separate,longer,inner,german,border,demarcated,border,east,west,germany,came,symbolize,physically,iron,curtain,separated,western,bloc,neutral,countries,eastern,bloc,cold,war",0.00,berlin
"before the walls erection  million east germans circumvented eastern bloc emigration restrictions and defected from the gdr many by crossing over the border from east berlin into west berlin from there they could then travel to west germany and to other western european countries between  and  the wall prevented almost all such emigration during this period over  people attempted to escape and over  people succeeded in escaping over the wall with an estimated death toll ranging from  to more than  in and around berlin
",walls erection million east germans circumvented eastern bloc emigration restrictions defected gdr crossing border east berlin west berlin travel west germany western european countries wall prevented emigration period people attempted escape people succeeded escaping wall estimated death toll ranging berlin,8.40,"walls,erection,million,east,germans,circumvented,eastern,bloc,emigration,restrictions,defected,gdr,crossing,border,east,berlin,west,berlin,travel,west,germany,western,european,countries,wall,prevented,emigration,period,people,attempted,escape,people,succeeded,escaping,wall,estimated,death,toll,ranging,berlin",0.00,berlin
"in  a series of revolutions in nearby eastern bloc countriesin poland and hungary in particularcaused a chain reaction in east germany in particular the pan european picnic in august  set in motion a peaceful development during which the iron curtain largely broke the rulers in the east came under pressure the berlin wall fell and finally the eastern bloc fell apart after several weeks of civil unrest the east german government announced on  november  that all gdr citizens could visit west germany and west berlin crowds of east germans crossed and climbed onto the wall joined by west germans on the other side in a celebratory atmosphere over the next few weeks the likes of souvenir hunters chipped away parts of the wall the brandenburg gate a few meters from the berlin wall was opened on  december  the demolition of the wall officially began on  june  and was completed in  the fall of the berlin wall paved the way for german reunification which formally took place on  october 
",series revolutions nearby eastern bloc countriesin poland hungary particularcaused chain reaction east germany particular pan european picnic august set motion peaceful development iron curtain largely broke rulers east came pressure berlin wall fell finally eastern bloc fell apart weeks civil unrest east german government announced november gdr citizens visit west germany west berlin crowds east germans crossed climbed wall joined west germans celebratory atmosphere weeks likes souvenir hunters chipped away parts wall brandenburg gate meters berlin wall opened december demolition wall officially began june completed fall berlin wall paved way german reunification formally took place october,7.26,"series,revolutions,nearby,eastern,bloc,countriesin,poland,hungary,particularcaused,chain,reaction,east,germany,particular,pan,european,picnic,august,set,motion,peaceful,development,iron,curtain,largely,broke,rulers,east,came,pressure,berlin,wall,fell,finally,eastern,bloc,fell,apart,weeks,civil,unrest,east,german,government,announced,november,gdr,citizens,visit,west,germany,west,berlin,crowds,east,germans,crossed,climbed,wall,joined,west,germans,celebratory,atmosphere,weeks,likes,souvenir,hunters,chipped,away,parts,wall,brandenburg,gate,meters,berlin,wall,opened,december,demolition,wall,officially,began,june,completed,fall,berlin,wall,paved,way,german,reunification,formally,took,place,october",0.00,berlin
"after the end of world war ii in europe what remained of pre war germany west of the oder neisse line was divided into four occupation zones  each one controlled by one of the four occupying allied powers the united states the united kingdom france and the soviet union the capital of berlin as the seat of the allied control council was similarly subdivided into four sectors despite the citys location which was fully within the soviet zone
",end world war ii europe remained pre war germany west oder neisse line divided occupation zones controlled occupying allied powers united states united kingdom france soviet union capital berlin seat allied control council similarly subdivided sectors despite citys location fully soviet zone,8.13,"end,world,war,ii,europe,remained,pre,war,germany,west,oder,neisse,line,divided,occupation,zones,controlled,occupying,allied,powers,united,states,united,kingdom,france,soviet,union,capital,berlin,seat,allied,control,council,similarly,subdivided,sectors,despite,citys,location,fully,soviet,zone",0.00,berlin
"at the same time a parallel regime was established under the strict control of the western powers in the zones of post war germany occupied by them culminating in the foundation of the federal republic of germany in  which initially claimed to be the sole legitimate power in all of germany east and west the material standard of living in the western zones of berlin began to improve quickly and residents of the soviet zone soon began leaving for the west in large numbers fleeing hunger poverty and repression in the soviet zone for a better life in the west soon residents of other parts of the soviet zone began to escape to the west through berlin and this migration called in germany republikflucht deprived the soviet zone not only of working forces desperately needed for post war reconstruction but disproportionately highly educated people which came to be known as the brain draincitation needed
",time parallel regime established strict control western powers zones post war germany occupied culminating foundation federal republic germany initially claimed sole legitimate power germany east west material standard living western zones berlin began improve quickly residents soviet zone soon began leaving west large numbers fleeing hunger poverty repression soviet zone better life west soon residents parts soviet zone began escape west berlin migration called germany republikflucht deprived soviet zone working forces desperately needed post war reconstruction disproportionately highly educated people came known brain draincitation needed,7.60,"time,parallel,regime,established,strict,control,western,powers,zones,post,war,germany,occupied,culminating,foundation,federal,republic,germany,initially,claimed,sole,legitimate,power,germany,east,west,material,standard,living,western,zones,berlin,began,improve,quickly,residents,soviet,zone,soon,began,leaving,west,large,numbers,fleeing,hunger,poverty,repression,soviet,zone,better,life,west,soon,residents,parts,soviet,zone,began,escape,west,berlin,migration,called,germany,republikflucht,deprived,soviet,zone,working,forces,desperately,needed,post,war,reconstruction,disproportionately,highly,educated,people,came,known,brain,draincitation,needed",0.00,berlin
"in  in response to moves by the western powers to establish a separate federal system of government in the western zones and to extend the marshall plan to germany the soviets instituted the berlin blockade preventing people food materials and supplies from arriving in west berlin by land routes through the soviet zone the united states the united kingdom france canada australia new zealand and several other countries began a massive airlift supplying west berlin with food and other supplies the soviets mounted a public relations campaign against the western policy change communists attempted to disrupt the elections of  preceding large losses therein while  berliners demonstrated for the international airlift to continue in may  stalin lifted the blockade permitting the resumption of western shipments to berlin
",response moves western powers establish separate federal system government western zones extend marshall plan germany soviets instituted berlin blockade preventing people food materials supplies arriving west berlin land routes soviet zone united states united kingdom france canada australia new zealand countries began massive airlift supplying west berlin food supplies soviets mounted public relations campaign western policy change communists attempted disrupt elections preceding large losses berliners demonstrated international airlift continue stalin lifted blockade permitting resumption western shipments berlin,5.95,"response,moves,western,powers,establish,separate,federal,system,government,western,zones,extend,marshall,plan,germany,soviets,instituted,berlin,blockade,preventing,people,food,materials,supplies,arriving,west,berlin,land,routes,soviet,zone,united,states,united,kingdom,france,canada,australia,new,zealand,countries,began,massive,airlift,supplying,west,berlin,food,supplies,soviets,mounted,public,relations,campaign,western,policy,change,communists,attempted,disrupt,elections,preceding,large,losses,berliners,demonstrated,international,airlift,continue,stalin,lifted,blockade,permitting,resumption,western,shipments,berlin",0.00,berlin
"up until  the demarcation lines between east germany and the western occupied zones could be easily crossed in most places on  april  east german leaders met the soviet leader joseph stalin in moscow during the discussions stalins foreign minister vyacheslav molotov proposed that the east germans should introduce a system of passes for visits of west berlin residents to the territory of east berlin so as to stop free movement of western agents in the gdr stalin agreed calling the situation intolerable he advised the east germans to build up their border defenses telling them that the demarcation line between east and west germany should be considered a borderand not just any border but a dangerous one  the germans will guard the line of defence with their lives
",demarcation lines east germany western occupied zones easily crossed places april east german leaders met soviet leader joseph stalin moscow discussions stalins foreign minister vyacheslav molotov proposed east germans introduce system passes visits west berlin residents territory east berlin stop free movement western agents gdr stalin agreed calling situation intolerable advised east germans build border defenses telling demarcation line east west germany considered borderand border dangerous germans guard line defence lives,7.38,"demarcation,lines,east,germany,western,occupied,zones,easily,crossed,places,april,east,german,leaders,met,soviet,leader,joseph,stalin,moscow,discussions,stalins,foreign,minister,vyacheslav,molotov,proposed,east,germans,introduce,system,passes,visits,west,berlin,residents,territory,east,berlin,stop,free,movement,western,agents,gdr,stalin,agreed,calling,situation,intolerable,advised,east,germans,build,border,defenses,telling,demarcation,line,east,west,germany,considered,borderand,border,dangerous,germans,guard,line,defence,lives",0.00,berlin
"consequently the inner german border between the two german states was closed and a barbed wire fence erected the border between the western and eastern sectors of berlin however remained open although traffic between the soviet and the western sectors was somewhat restricted this resulted in berlin becoming a magnet for east germans desperate to escape life in the gdr and also a flashpoint for tension between the united states and the soviet union
",consequently inner german border german states closed barbed wire fence erected border western eastern sectors berlin remained open traffic soviet western sectors somewhat restricted resulted berlin magnet east germans desperate escape life gdr flashpoint tension united states soviet union,7.73,"consequently,inner,german,border,german,states,closed,barbed,wire,fence,erected,border,western,eastern,sectors,berlin,remained,open,traffic,soviet,western,sectors,somewhat,restricted,resulted,berlin,magnet,east,germans,desperate,escape,life,gdr,flashpoint,tension,united,states,soviet,union",0.00,berlin
"in  the soviets gave east germany authority over civilian movement in berlin passing control to a regime not recognized in the west initially east germany granted visits to allow its residents access to west germany however following the defection of large numbers of east germans  under this regime the new east german state legally restricted virtually all travel to the west in  soviet east german ambassador mikhail pervukhin observed that the presence in berlin of an open and essentially uncontrolled border between the socialist and capitalist worlds unwittingly prompts the population to make a comparison between both parts of the city which unfortunately does not always turn out in favour of democratic east berlin
",soviets gave east germany authority civilian movement berlin passing control regime recognized west initially east germany granted visits allow residents access west germany following defection large numbers east germans regime new east german state legally restricted virtually travel west soviet east german ambassador mikhail pervukhin observed presence berlin open essentially uncontrolled border socialist capitalist worlds unwittingly prompts population comparison parts city unfortunately turn favour democratic east berlin,6.47,"soviets,gave,east,germany,authority,civilian,movement,berlin,passing,control,regime,recognized,west,initially,east,germany,granted,visits,allow,residents,access,west,germany,following,defection,large,numbers,east,germans,regime,new,east,german,state,legally,restricted,virtually,travel,west,soviet,east,german,ambassador,mikhail,pervukhin,observed,presence,berlin,open,essentially,uncontrolled,border,socialist,capitalist,worlds,unwittingly,prompts,population,comparison,parts,city,unfortunately,turn,favour,democratic,east,berlin",0.00,berlin
"with the closing of the inner german border officially in  the border in berlin remained considerably more accessible because it was administered by all four occupying powers accordingly berlin became the main route by which east germans left for the west on  december  east germany introduced a new passport law that reduced the overall number of refugees leaving eastern germany
",closing inner german border officially border berlin remained considerably accessible administered occupying powers accordingly berlin main route east germans left west december east germany introduced new passport law reduced overall number refugees leaving eastern germany,6.56,"closing,inner,german,border,officially,border,berlin,remained,considerably,accessible,administered,occupying,powers,accordingly,berlin,main,route,east,germans,left,west,december,east,germany,introduced,new,passport,law,reduced,overall,number,refugees,leaving,eastern,germany",0.00,berlin
"it had the unintended result of drastically increasing the percentage of those leaving through west berlin from  to well over  by the end of  those caught trying to leave east berlin were subjected to heavy penalties but with no physical barrier and subway train access still available to west berlin such measures were ineffective the berlin sector border was essentially a loophole through which eastern bloc citizens could still escape the  million east germans who had left by  totalled approximately  of the entire east german population
",unintended result drastically increasing percentage leaving west berlin end caught trying leave east berlin subjected heavy penalties physical barrier subway train access available west berlin measures ineffective berlin sector border essentially loophole eastern bloc citizens escape million east germans left totalled approximately entire east german population,7.37,"unintended,result,drastically,increasing,percentage,leaving,west,berlin,end,caught,trying,leave,east,berlin,subjected,heavy,penalties,physical,barrier,subway,train,access,available,west,berlin,measures,ineffective,berlin,sector,border,essentially,loophole,eastern,bloc,citizens,escape,million,east,germans,left,totalled,approximately,entire,east,german,population",0.00,berlin
"an important reason that passage between east germany and west berlin was not stopped earlier was that doing so would cut off much of the railway traffic in east germany construction of a new railway bypassing west berlin the berlin outer ring commenced in  following the completion of the railway in  closing the border became a more practical propositioncitation needed
",important reason passage east germany west berlin stopped earlier cut railway traffic east germany construction new railway bypassing west berlin berlin outer ring commenced following completion railway closing border practical propositioncitation needed,7.53,"important,reason,passage,east,germany,west,berlin,stopped,earlier,cut,railway,traffic,east,germany,construction,new,railway,bypassing,west,berlin,berlin,outer,ring,commenced,following,completion,railway,closing,border,practical,propositioncitation,needed",0.00,berlin
"khrushchev had become emboldened upon seeing us president john f kennedys youth and inexperience which he considered a weakness in the  vienna summit kennedy made the error of admitting that the us would not actively oppose the building of a barrier a feeling of miscalculation and failure immediately afterwards was admitted by kennedy in a candid interview with new york times columnist james scotty reston on saturday  august  the leaders of the gdr attended a garden party at a government guesthouse in dllnsee in a wooded area to the north of east berlin there ulbricht signed the order to close the border and erect a wall
",khrushchev emboldened seeing president john f kennedys youth inexperience considered weakness vienna summit kennedy error admitting actively oppose building barrier feeling miscalculation failure immediately admitted kennedy candid interview new york times columnist james scotty reston saturday august leaders gdr attended garden party government guesthouse dllnsee wooded area north east berlin ulbricht signed order close border erect wall,7.79,"khrushchev,emboldened,seeing,president,john,f,kennedys,youth,inexperience,considered,weakness,vienna,summit,kennedy,error,admitting,actively,oppose,building,barrier,feeling,miscalculation,failure,immediately,admitted,kennedy,candid,interview,new,york,times,columnist,james,scotty,reston,saturday,august,leaders,gdr,attended,garden,party,government,guesthouse,dllnsee,wooded,area,north,east,berlin,ulbricht,signed,order,close,border,erect,wall",0.00,berlin
"at midnight the police and units of the east german army began to close the border and by sunday morning  august the border with west berlin was closed east german troops and workers had begun to tear up streets running alongside the border to make them impassable to most vehicles and to install barbed wire entanglements and fences along the  kilometres  around the three western sectors and the  kilometres  that divided west and east berlin the date of  august became commonly referred to as barbed wire sunday in germany
",midnight police units east german army began close border sunday morning august border west berlin closed east german troops workers begun tear streets running alongside border impassable vehicles install barbed wire entanglements fences kilometres western sectors kilometres divided west east berlin date august commonly referred barbed wire sunday germany,7.60,"midnight,police,units,east,german,army,began,close,border,sunday,morning,august,border,west,berlin,closed,east,german,troops,workers,begun,tear,streets,running,alongside,border,impassable,vehicles,install,barbed,wire,entanglements,fences,kilometres,western,sectors,kilometres,divided,west,east,berlin,date,august,commonly,referred,barbed,wire,sunday,germany",0.00,berlin
"the barrier was built inside east berlin on east german territory to ensure that it did not encroach on west berlin at any point generally the wall was only slightly inside east berlin but in a few places it was some distance from the legal border most notably at potsdamer bahnhof and the lenn triangle that is now much of the potsdamer platz development
",barrier built inside east berlin east german territory ensure encroach west berlin point generally wall slightly inside east berlin places distance legal border notably potsdamer bahnhof lenn triangle potsdamer platz development,9.27,"barrier,built,inside,east,berlin,east,german,territory,ensure,encroach,west,berlin,point,generally,wall,slightly,inside,east,berlin,places,distance,legal,border,notably,potsdamer,bahnhof,lenn,triangle,potsdamer,platz,development",0.00,berlin
"with the closing of the eastwest sector boundary in berlin the vast majority of east germans could no longer travel or emigrate to west germany berlin soon went from being the easiest place to make an unauthorized crossing between east and west germany to being the most difficult many families were split while east berliners employed in the west were cut off from their jobs west berlin became an isolated exclave in a hostile land west berliners demonstrated against the wall led by their mayor  willy brandt who criticized the united states for failing to respond and went so far as to suggest to washington what to do next kennedy was furious  allied intelligence agencies had hypothesized about a wall to stop the flood of refugees but the main candidate for its location was around the perimeter of the city in  secretary of state dean rusk proclaimed the wall certainly ought not to be a permanent feature of the european landscape i see no reason why the soviet union should think it isit is to their advantage in any way to leave there that monument to communist failure
",closing eastwest sector boundary berlin vast majority east germans longer travel emigrate west germany berlin soon went easiest place unauthorized crossing east west germany difficult families split east berliners employed west cut jobs west berlin isolated exclave hostile land west berliners demonstrated wall led mayor willy brandt criticized united states failing respond went far suggest washington kennedy furious allied intelligence agencies hypothesized wall stop flood refugees main candidate location perimeter city secretary state dean rusk proclaimed wall certainly ought permanent feature european landscape reason soviet union think isit advantage way leave monument communist failure,8.70,"closing,eastwest,sector,boundary,berlin,vast,majority,east,germans,longer,travel,emigrate,west,germany,berlin,soon,went,easiest,place,unauthorized,crossing,east,west,germany,difficult,families,split,east,berliners,employed,west,cut,jobs,west,berlin,isolated,exclave,hostile,land,west,berliners,demonstrated,wall,led,mayor,willy,brandt,criticized,united,states,failing,respond,went,far,suggest,washington,kennedy,furious,allied,intelligence,agencies,hypothesized,wall,stop,flood,refugees,main,candidate,location,perimeter,city,secretary,state,dean,rusk,proclaimed,wall,certainly,ought,permanent,feature,european,landscape,reason,soviet,union,think,isit,advantage,way,leave,monument,communist,failure",0.00,berlin
