Unclean,Clean,Noise_Pre_Processing,Training_Data,Noise_Post_Processing,Query
"after hearing the broadcast east germans began gathering at the wall at the six checkpoints between east and west berlin demanding that border guards immediately open the gates the surprised and overwhelmed guards made many hectic telephone calls to their superiors about the problem at first they were ordered to find the more aggressive people gathered at the gates and stamp their passports with a special stamp that barred them from returning to east germanyin effect revoking their citizenship however this still left thousands of people demanding to be let through as schabowski said we canpage needed it soon became clear that no one among the east german authorities would take personal responsibility for issuing orders to use lethal force so the vastly outnumbered soldiers had no way to hold back the huge crowd of east german citizens finally at  pm on  november harald jger the commander of the bornholmer strae border crossing yielded allowing for the guards to open the checkpoints and allowing people through with little or no identity checking as the ossis swarmed through they were greeted by wessis waiting with flowers and champagne amid wild rejoicing soon afterward a crowd of west berliners jumped on top of the wall and were soon joined by east german youngsters the evening of  november  is known as the night the wall came down
",hearing broadcast east germans began gathering wall checkpoints east west berlin demanding border guards immediately open gates surprised overwhelmed guards hectic telephone calls superiors problem ordered find aggressive people gathered gates stamp passports special stamp barred returning east germanyin effect revoking citizenship left thousands people demanding let schabowski said canpageneeded soon clear east german authorities personal responsibility issuing orders use lethal force vastly outnumbered soldiers way hold huge crowd east german citizens finally pm november harald jger commander bornholmer strae border crossing yielded allowing guards open checkpoints allowing people little identity checking ossis swarmed greeted wessis waiting flowers champagne amid wild rejoicing soon afterward crowd west berliners jumped wall soon joined east german youngsters evening november known night wall came,7.61,"hearing,broadcast,east,germans,began,gathering,wall,checkpoints,east,west,berlin,demanding,border,guards,immediately,open,gates,surprised,overwhelmed,guards,hectic,telephone,calls,superiors,problem,ordered,find,aggressive,people,gathered,gates,stamp,passports,special,stamp,barred,returning,east,germanyin,effect,revoking,citizenship,left,thousands,people,demanding,let,schabowski,said,canpageneeded,soon,clear,east,german,authorities,personal,responsibility,issuing,orders,use,lethal,force,vastly,outnumbered,soldiers,way,hold,huge,crowd,east,german,citizens,finally,pm,november,harald,jger,commander,bornholmer,strae,border,crossing,yielded,allowing,guards,open,checkpoints,allowing,people,little,identity,checking,ossis,swarmed,greeted,wessis,waiting,flowers,champagne,amid,wild,rejoicing,soon,afterward,crowd,west,berliners,jumped,wall,soon,joined,east,german,youngsters,evening,november,known,night,wall,came",0.00,berlin
"another border crossing to the south may have been opened earlier an account by heinz schfer indicates that he also acted independently and ordered the opening of the gate at waltersdorf rudow a couple of hours earlier this may explain reports of east berliners appearing in west berlin earlier than the opening of the bornholmer strae border crossing
",border crossing south opened earlier account heinz schfer indicates acted independently ordered opening gate waltersdorf rudow couple hours earlier explain reports east berliners appearing west berlin earlier opening bornholmer strae border crossing,7.39,"border,crossing,south,opened,earlier,account,heinz,schfer,indicates,acted,independently,ordered,opening,gate,waltersdorf,rudow,couple,hours,earlier,explain,reports,east,berliners,appearing,west,berlin,earlier,opening,bornholmer,strae,border,crossing",0.00,berlin
"thirty years after the fall of the berlin wall the guardian collected short stories from  november  by five german writers who reflect on the day in this kathrin schmidt remembers comically i downed almost an entire bottle of schnapps
",thirty years fall berlin wall guardian collected short stories november german writers reflect day kathrin schmidt remembers comically downed entire bottle schnapps,7.23,"thirty,years,fall,berlin,wall,guardian,collected,short,stories,november,german,writers,reflect,day,kathrin,schmidt,remembers,comically,downed,entire,bottle,schnapps",0.00,berlin
"the berlin wall from the east berlin side 
",berlin wall east berlin,9.30,"berlin,wall,east,berlin",0.00,berlin
"an exhibition dedicated to the th anniversary to the berlin wall destruction was located at potsdamer platz arkaden
",exhibition dedicated th anniversary berlin wall destruction located potsdamer platz arkaden,6.03,"exhibition,dedicated,th,anniversary,berlin,wall,destruction,located,potsdamer,platz,arkaden",0.00,berlin
"a hole in the berlin wall 
",hole berlin wall,11.11,"hole,berlin,wall",0.00,berlin
"nothing still accurately represents the walls original appearance better than a very short stretch at bernauer strae associated with the berlin wall documentation center other remnants are badly damaged by souvenir seekers fragments of the wall were taken and some were sold around the world appearing both with and without certificates of authenticity these fragments are now a staple on the online auction service ebay as well as german souvenir shops today the eastern side is covered in graffiti that did not exist while the wall was guarded by the armed soldiers of east germany previously graffiti appeared only on the western side along some tourist areas of the city centre the city government has marked the location of the former wall by a row of cobblestones in the street in most places only the first wall is marked except near potsdamer platz where the stretch of both walls is marked giving visitors an impression of the dimension of the barrier systemcitation needed
",accurately represents walls original appearance better short stretch bernauer strae associated berlin wall documentation center remnants badly damaged souvenir seekers fragments wall taken sold world appearing certificates authenticity fragments staple online auction service ebay german souvenir shops today eastern covered graffiti exist wall guarded armed soldiers east germany previously graffiti appeared western tourist areas city centre city government marked location wall row cobblestones street places wall marked near potsdamer platz stretch walls marked giving visitors impression dimension barrier systemcitation needed,8.44,"accurately,represents,walls,original,appearance,better,short,stretch,bernauer,strae,associated,berlin,wall,documentation,center,remnants,badly,damaged,souvenir,seekers,fragments,wall,taken,sold,world,appearing,certificates,authenticity,fragments,staple,online,auction,service,ebay,german,souvenir,shops,today,eastern,covered,graffiti,exist,wall,guarded,armed,soldiers,east,germany,previously,graffiti,appeared,western,tourist,areas,city,centre,city,government,marked,location,wall,row,cobblestones,street,places,wall,marked,near,potsdamer,platz,stretch,walls,marked,giving,visitors,impression,dimension,barrier,systemcitation,needed",0.00,berlin
"after the fall of the berlin wall there were initiatives that they want to preserve the death strip walkways and redevelop them into a hiking and cycling area known as berliner mauerweg it is part of the initiative by the berlin senate since  october 
",fall berlin wall initiatives want preserve death strip walkways redevelop hiking cycling area known berliner mauerweg initiative berlin senate october,9.52,"fall,berlin,wall,initiatives,want,preserve,death,strip,walkways,redevelop,hiking,cycling,area,known,berliner,mauerweg,initiative,berlin,senate,october",0.00,berlin
"a  poll conducted by russias vtsiom found that more than half of all russians do not know who built the berlin wall ten percent of people surveyed thought berlin residents built it themselves six percent said western powers built it and four percent thought it was a bilateral initiative of the soviet union and the west fifty eight percent said they did not know who built it with just  percent correctly naming the soviet union and its then communist ally east germany
",poll conducted russias vtsiom found half russians know built berlin wall percent people surveyed thought berlin residents built percent said western powers built percent thought bilateral initiative soviet union west percent said know built percent correctly naming soviet union communist ally east germany,8.28,"poll,conducted,russias,vtsiom,found,half,russians,know,built,berlin,wall,percent,people,surveyed,thought,berlin,residents,built,percent,said,western,powers,built,percent,thought,bilateral,initiative,soviet,union,west,percent,said,know,built,percent,correctly,naming,soviet,union,communist,ally,east,germany",0.00,berlin
"on  august  germany marked the th anniversary of east germany beginning the erection of the berlin wall chancellor angela merkel joined with president christian wulff and berlin mayor klaus wowereit at the bernauer strae memorial park to remember lives and liberty speeches extolled freedom and a minute of silence at noon honored those who died trying to flee to the west it is our shared responsibility to keep the memory alive and to pass it on to the coming generations as a reminder to stand up for freedom and democracy to ensure that such injustice may never happen again entreated mayor wowereit it has been shown once again freedom is invincible at the end no wall can permanently withstand the desire for freedom proclaimed president wulff
",august germany marked th anniversary east germany beginning erection berlin wall chancellor angela merkel joined president christian wulff berlin mayor klaus wowereit bernauer strae memorial park remember lives liberty speeches extolled freedom minute silence noon honored died trying flee west shared responsibility memory alive pass coming generations reminder stand freedom democracy ensure injustice happen entreated mayor wowereit shown freedom invincible end wall permanently withstand desire freedom proclaimed president wulff,7.60,"august,germany,marked,th,anniversary,east,germany,beginning,erection,berlin,wall,chancellor,angela,merkel,joined,president,christian,wulff,berlin,mayor,klaus,wowereit,bernauer,strae,memorial,park,remember,lives,liberty,speeches,extolled,freedom,minute,silence,noon,honored,died,trying,flee,west,shared,responsibility,memory,alive,pass,coming,generations,reminder,stand,freedom,democracy,ensure,injustice,happen,entreated,mayor,wowereit,shown,freedom,invincible,end,wall,permanently,withstand,desire,freedom,proclaimed,president,wulff",0.00,berlin
"documentary films specifically about the berlin wall include
",documentary films specifically berlin wall include,3.28,"documentary,films,specifically,berlin,wall,include",0.00,berlin
"fictional films featuring the berlin wall have included
",fictional films featuring berlin wall included,3.57,"fictional,films,featuring,berlin,wall,included",0.00,berlin
"some novels specifically about the berlin wall include
",novels specifically berlin wall include,5.45,"novels,specifically,berlin,wall,include",0.00,berlin
"music related to the berlin wall includes
",music related berlin wall includes,4.76,"music,related,berlin,wall,includes",0.00,berlin
"artworks related to the berlin wall include
",artworks related berlin wall include,4.55,"artworks,related,berlin,wall,include",0.00,berlin
"video games related to the berlin wall include
",video games related berlin wall include,4.26,"video,games,related,berlin,wall,include",0.00,berlin
