Unclean,Clean,Noise_Pre_Processing,Training_Data,Noise_Post_Processing,Query
"united states and uk sources had expected the soviet sector to be sealed off from west berlin but were surprised by how long the east germans took for such a move they considered the wall as an end to concerns about a gdrsoviet retaking or capture of the whole of berlin the wall would presumably have been an unnecessary project if such plans were afloat thus they concluded that the possibility of a soviet military conflict over berlin had decreased
",united states uk sources expected soviet sector sealed west berlin surprised long east germans took considered wall end concerns gdrsoviet retaking capture berlin wall presumably unnecessary project plans afloat concluded possibility soviet military conflict berlin decreased,9.71,"united,states,uk,sources,expected,soviet,sector,sealed,west,berlin,surprised,long,east,germans,took,considered,wall,end,concerns,gdrsoviet,retaking,capture,berlin,wall,presumably,unnecessary,project,plans,afloat,concluded,possibility,soviet,military,conflict,berlin,decreased",0.00,berlin
"the east german government claimed that the wall was an anti fascist protective rampart  intended to dissuade aggression from the west another official justification was the activities of western agents in eastern europe the eastern german government also claimed that west berliners were buying out state subsidized goods in east berlin east germans and others greeted such statements with skepticism as most of the time the border was only closed for citizens of east germany traveling to the west but not for residents of west berlin travelling to the east the construction of the wall had caused considerable hardship to families divided by it most people believed that the wall was mainly a means of preventing the citizens of east germany from entering or fleeing to west berlin
",east german government claimed wall anti fascist protective rampart intended dissuade aggression west official justification activities western agents eastern europe eastern german government claimed west berliners buying state subsidized goods east berlin east germans greeted statements skepticism time border closed citizens east germany traveling west residents west berlin travelling east construction wall caused considerable hardship families divided people believed wall mainly means preventing citizens east germany entering fleeing west berlin,7.39,"east,german,government,claimed,wall,anti,fascist,protective,rampart,intended,dissuade,aggression,west,official,justification,activities,western,agents,eastern,europe,eastern,german,government,claimed,west,berliners,buying,state,subsidized,goods,east,berlin,east,germans,greeted,statements,skepticism,time,border,closed,citizens,east,germany,traveling,west,residents,west,berlin,travelling,east,construction,wall,caused,considerable,hardship,families,divided,people,believed,wall,mainly,means,preventing,citizens,east,germany,entering,fleeing,west,berlin",0.00,berlin
"the national security agency was the only american intelligence agency that was aware that east germany was to take action to deal with the brain drain problem on  august  the nsa intercepted an advance warning information of the socialist unity partys plan to close the intra berlin border between east and west berlin completely for foot traffic the interagency intelligence berlin watch committee assessed that this intercept might be the first step in a plan to close the border this warning did not reach john f kennedy until noon on  august  while he was vacationing in his yacht off the kennedy compound in hyannis port massachusetts while kennedy was angry that he had no advance warning he was relieved that the east germans and the soviets had only divided berlin without taking any action against west berlins access to the west however he denounced the berlin wall whose erection worsened the relations between the united states and the soviet union
",national security agency american intelligence agency aware east germany action deal brain drain problem august nsa intercepted advance warning information socialist unity partys plan close intra berlin border east west berlin completely foot traffic interagency intelligence berlin watch committee assessed intercept step plan close border warning reach john f kennedy noon august vacationing yacht kennedy compound hyannis port massachusetts kennedy angry advance warning relieved east germans soviets divided berlin taking action west berlins access west denounced berlin wall erection worsened relations united states soviet union,7.80,"national,security,agency,american,intelligence,agency,aware,east,germany,action,deal,brain,drain,problem,august,nsa,intercepted,advance,warning,information,socialist,unity,partys,plan,close,intra,berlin,border,east,west,berlin,completely,foot,traffic,interagency,intelligence,berlin,watch,committee,assessed,intercept,step,plan,close,border,warning,reach,john,f,kennedy,noon,august,vacationing,yacht,kennedy,compound,hyannis,port,massachusetts,kennedy,angry,advance,warning,relieved,east,germans,soviets,divided,berlin,taking,action,west,berlins,access,west,denounced,berlin,wall,erection,worsened,relations,united,states,soviet,union",0.00,berlin
"in response to the erection of the berlin wall a retired general lucius d clay was appointed by kennedy as his special advisor with ambassadorial rank clay had been the military governor of the us zone of occupation in germany during the period of the berlin blockade and had ordered the first measures in what became the berlin airlift he was immensely popular with the residents of west berlin and his appointment was an unambiguous sign that kennedy would not compromise on the status of west berlin as a symbolic gesture kennedy sent clay and vice president lyndon b johnson to west berlin they landed at tempelhof airport on the afternoon of saturday  august  and were greeted enthusiastically by the local population
",response erection berlin wall retired general lucius clay appointed kennedy special advisor ambassadorial rank clay military governor zone occupation germany period berlin blockade ordered measures berlin airlift immensely popular residents west berlin appointment unambiguous sign kennedy compromise status west berlin symbolic gesture kennedy sent clay vice president lyndon b johnson west berlin landed tempelhof airport afternoon saturday august greeted enthusiastically local population,8.30,"response,erection,berlin,wall,retired,general,lucius,clay,appointed,kennedy,special,advisor,ambassadorial,rank,clay,military,governor,zone,occupation,germany,period,berlin,blockade,ordered,measures,berlin,airlift,immensely,popular,residents,west,berlin,appointment,unambiguous,sign,kennedy,compromise,status,west,berlin,symbolic,gesture,kennedy,sent,clay,vice,president,lyndon,b,johnson,west,berlin,landed,tempelhof,airport,afternoon,saturday,august,greeted,enthusiastically,local,population",0.00,berlin
"on sunday morning yous troops marched from west germany through east germany bound for west berlin lead elementsarranged in a column of  vehicles and trailers carrying  men divided into five march unitsleft the helmstedt marienborn checkpoint at  at marienborn the soviet checkpoint next to helmstedt on the west german east german border us personnel were counted by guards the column was  kilometres  long and covered  kilometres  from marienborn to berlin in full battle gear east german police watched from beside trees next to the autobahn all the way along
",sunday morning yous troops marched west germany east germany bound west berlin lead elementsarranged column vehicles trailers carrying men divided march unitsleft helmstedt marienborn checkpoint marienborn soviet checkpoint helmstedt west german east german border personnel counted guards column kilometres long covered kilometres marienborn berlin battle gear east german police watched trees autobahn way,6.39,"sunday,morning,yous,troops,marched,west,germany,east,germany,bound,west,berlin,lead,elementsarranged,column,vehicles,trailers,carrying,men,divided,march,unitsleft,helmstedt,marienborn,checkpoint,marienborn,soviet,checkpoint,helmstedt,west,german,east,german,border,personnel,counted,guards,column,kilometres,long,covered,kilometres,marienborn,berlin,battle,gear,east,german,police,watched,trees,autobahn,way",0.00,berlin
"the front of the convoy arrived at the outskirts of berlin just before noon to be met by clay and johnson before parading through the streets of berlin in front of a large crowd at  on  august lyndon johnson left west berlin in the hands of general frederick o hartel and his brigade of  officers and men for the next three and a half years american battalions would rotate into west berlin by autobahn at three month intervals to demonstrate allied rights to the city
",convoy arrived outskirts berlin noon met clay johnson parading streets berlin large crowd august lyndon johnson left west berlin hands general frederick hartel brigade officers men half years american battalions rotate west berlin autobahn month intervals demonstrate allied rights city,9.59,"convoy,arrived,outskirts,berlin,noon,met,clay,johnson,parading,streets,berlin,large,crowd,august,lyndon,johnson,left,west,berlin,hands,general,frederick,hartel,brigade,officers,men,half,years,american,battalions,rotate,west,berlin,autobahn,month,intervals,demonstrate,allied,rights,city",0.00,berlin
"the berlin wall was more than  kilometres  long in june  a second parallel fence also known as a hinterland wall  was built some  metres  farther into east german territory the houses contained between the wall and fences were razed and the inhabitants relocated thus establishing what later became known as the death strip the death strip was covered with raked sand or gravel rendering footprints easy to notice easing the detection of trespassers and also enabling officers to see which guards had neglected their task it offered no cover and most importantly it offered clear fields of fire for the wall guards
",berlin wall kilometres long june second parallel fence known hinterland wall built metres farther east german territory houses contained wall fences razed inhabitants relocated establishing later known death strip death strip covered raked sand gravel rendering footprints easy notice easing detection trespassers enabling officers guards neglected task offered cover importantly offered clear fields fire wall guards,7.48,"berlin,wall,kilometres,long,june,second,parallel,fence,known,hinterland,wall,built,metres,farther,east,german,territory,houses,contained,wall,fences,razed,inhabitants,relocated,establishing,later,known,death,strip,death,strip,covered,raked,sand,gravel,rendering,footprints,easy,notice,easing,detection,trespassers,enabling,officers,guards,neglected,task,offered,cover,importantly,offered,clear,fields,fire,wall,guards",0.00,berlin
"through the years the berlin wall evolved through four versions
",years berlin wall evolved versions,7.81,"years,berlin,wall,evolved,versions",0.00,berlin
"the top of the wall was lined with a smooth pipe intended to make it more difficult to scale the wall was reinforced by mesh fencing signal fencing anti vehicle trenches barbed wire dogs on long lines beds of nails  under balconies hanging over the death strip over  watchtowers and  bunkers with hundreds of guards this version of the wall is the one most commonly seen in photographs and surviving fragments of the wall in berlin and elsewhere around the world are generally pieces of the fourth generation wall the layout came to resemble the inner german border in most technical aspects except that the berlin wall had no landmines nor spring guns maintenance was performed on the outside of the wall by personnel who accessed the area outside it either via ladders or via hidden doors within the wall these doors could not be opened by a single person needing two separate keys in two separate keyholes to unlock
",wall lined smooth pipe intended difficult scale wall reinforced mesh fencing signal fencing anti vehicle trenches barbed wire dogs long lines beds nails balconies hanging death strip watchtowers bunkers hundreds guards version wall commonly seen photographs surviving fragments wall berlin world generally pieces fourth generation wall layout came resemble inner german border technical aspects berlin wall landmines spring guns maintenance performed outside wall personnel accessed area outside ladders hidden doors wall doors opened single person needing separate keys separate keyholes unlock,8.60,"wall,lined,smooth,pipe,intended,difficult,scale,wall,reinforced,mesh,fencing,signal,fencing,anti,vehicle,trenches,barbed,wire,dogs,long,lines,beds,nails,balconies,hanging,death,strip,watchtowers,bunkers,hundreds,guards,version,wall,commonly,seen,photographs,surviving,fragments,wall,berlin,world,generally,pieces,fourth,generation,wall,layout,came,resemble,inner,german,border,technical,aspects,berlin,wall,landmines,spring,guns,maintenance,performed,outside,wall,personnel,accessed,area,outside,ladders,hidden,doors,wall,doors,opened,single,person,needing,separate,keys,separate,keyholes,unlock",0.00,berlin
"as was the case with the inner german border an unfortified strip of eastern territory was left outside the wall this outer strip was used by workers to paint over graffiti and perform other maintenance on the outside of the wall unlike the inner german border however the outer strip was usually no more than four meters wide and in photos from the era the exact location of the actual border in many places appears not even to have been marked also in contrast with the inner german border little interest was shown by east german law enforcement in keeping outsiders off the outer strip sidewalks of west berlin streets even ran inside it
",case inner german border unfortified strip eastern territory left outside wall outer strip workers paint graffiti perform maintenance outside wall unlike inner german border outer strip usually meters wide photos era exact location actual border places appears marked contrast inner german border little interest shown east german law enforcement keeping outsiders outer strip sidewalks west berlin streets ran inside,8.57,"case,inner,german,border,unfortified,strip,eastern,territory,left,outside,wall,outer,strip,workers,paint,graffiti,perform,maintenance,outside,wall,unlike,inner,german,border,outer,strip,usually,meters,wide,photos,era,exact,location,actual,border,places,appears,marked,contrast,inner,german,border,little,interest,shown,east,german,law,enforcement,keeping,outsiders,outer,strip,sidewalks,west,berlin,streets,ran,inside",0.00,berlin
"besides the sector sector boundary within berlin itself the wall also separated west berlin from the present day state of brandenburg the following present day municipalities listed in counter clockwise direction share a border with the former west berlin
",sector sector boundary berlin wall separated west berlin present day state brandenburg following present day municipalities listed counter clockwise direction share border west berlin,5.86,"sector,sector,boundary,berlin,wall,separated,west,berlin,present,day,state,brandenburg,following,present,day,municipalities,listed,counter,clockwise,direction,share,border,west,berlin",0.00,berlin
"there were nine border crossings between east and west berlin these allowed visits by west berliners other west germans western foreigners and allied personnel into east berlin as well as visits by gdr citizens and citizens of other socialist countries into west berlin provided that they held the necessary permits these crossings were restricted according to which nationality was allowed to use it  the best known was the vehicle and pedestrian checkpoint at the corner of friedrichstrae and zimmerstrae  which was restricted to allied personnel and foreigners
",border crossings east west berlin allowed visits west berliners west germans western foreigners allied personnel east berlin visits gdr citizens citizens socialist countries west berlin provided held necessary permits crossings restricted according nationality allowed use best known vehicle pedestrian checkpoint corner friedrichstrae zimmerstrae restricted allied personnel foreigners,7.09,"border,crossings,east,west,berlin,allowed,visits,west,berliners,west,germans,western,foreigners,allied,personnel,east,berlin,visits,gdr,citizens,citizens,socialist,countries,west,berlin,provided,held,necessary,permits,crossings,restricted,according,nationality,allowed,use,best,known,vehicle,pedestrian,checkpoint,corner,friedrichstrae,zimmerstrae,restricted,allied,personnel,foreigners",0.00,berlin
"several other border crossings existed between west berlin and surrounding east germany these could be used for transit between west germany and west berlin for visits by west berliners into east germany for transit into countries neighbouring east germany  and for visits by east germans into west berlin carrying a permit after the  agreements new crossings were opened to allow west berlin waste to be transported into east german dumps as well as some crossings for access to west berlins exclaves 
",border crossings existed west berlin surrounding east germany transit west germany west berlin visits west berliners east germany transit countries neighbouring east germany visits east germans west berlin carrying permit agreements new crossings opened allow west berlin waste transported east german dumps crossings access west berlins exclaves,6.76,"border,crossings,existed,west,berlin,surrounding,east,germany,transit,west,germany,west,berlin,visits,west,berliners,east,germany,transit,countries,neighbouring,east,germany,visits,east,germans,west,berlin,carrying,permit,agreements,new,crossings,opened,allow,west,berlin,waste,transported,east,german,dumps,crossings,access,west,berlins,exclaves",0.00,berlin
"four autobahns connected west berlin to west germany including berlin helmstedt autobahn which entered east german territory between the towns of helmstedt and marienborn  and which entered west berlin at dreilinden  in southwestern berlin access to west berlin was also possible by railway  and by boat for commercial shipping via canals and rivers
",autobahns connected west berlin west germany including berlin helmstedt autobahn entered east german territory towns helmstedt marienborn entered west berlin dreilinden southwestern berlin access west berlin possible railway boat commercial shipping canals rivers,5.71,"autobahns,connected,west,berlin,west,germany,including,berlin,helmstedt,autobahn,entered,east,german,territory,towns,helmstedt,marienborn,entered,west,berlin,dreilinden,southwestern,berlin,access,west,berlin,possible,railway,boat,commercial,shipping,canals,rivers",0.00,berlin
"non german westerners could cross the border at friedrichstrae station in east berlin and at checkpoint charlie when the wall was erected berlins complex public transit networks the s bahn and you bahn were divided with it some lines were cut in half many stations were shut down three western lines traveled through brief sections of east berlin territory passing through eastern stations  without stopping both the eastern and western networks converged at friedrichstrae which became a major crossing point for those  with permission to cross
",non german westerners cross border friedrichstrae station east berlin checkpoint charlie wall erected berlins complex public transit networks bahn bahn divided lines cut half stations shut western lines traveled brief sections east berlin territory passing eastern stations stopping eastern western networks converged friedrichstrae major crossing point permission cross,6.96,"non,german,westerners,cross,border,friedrichstrae,station,east,berlin,checkpoint,charlie,wall,erected,berlins,complex,public,transit,networks,bahn,bahn,divided,lines,cut,half,stations,shut,western,lines,traveled,brief,sections,east,berlin,territory,passing,eastern,stations,stopping,eastern,western,networks,converged,friedrichstrae,major,crossing,point,permission,cross",0.00,berlin
"west germans and citizens of other western countries could generally visit east germany often after applying for a visa at an east german embassy several weeks in advance visas for day trips restricted to east berlin were issued without previous application in a simplified procedure at the border crossing however east german authorities could refuse entry permits without stating a reason in the s visitors from the western part of the city who wanted to visit the eastern part had to exchange at least dm  into east german currency at the poor exchange rate of  it was forbidden to export east german currency from the east but money not spent could be left at the border for possible future visits tourists crossing from the west had to also pay for a visa which cost dm  west berliners did not have to pay this fee
",west germans citizens western countries generally visit east germany applying visa east german embassy weeks advance visas day trips restricted east berlin issued previous application simplified procedure border crossing east german authorities refuse entry permits stating reason visitors western city wanted visit eastern exchange dm east german currency poor exchange rate forbidden export east german currency east money spent left border possible future visits tourists crossing west pay visa cost dm west berliners pay fee,8.41,"west,germans,citizens,western,countries,generally,visit,east,germany,applying,visa,east,german,embassy,weeks,advance,visas,day,trips,restricted,east,berlin,issued,previous,application,simplified,procedure,border,crossing,east,german,authorities,refuse,entry,permits,stating,reason,visitors,western,city,wanted,visit,eastern,exchange,dm,east,german,currency,poor,exchange,rate,forbidden,export,east,german,currency,east,money,spent,left,border,possible,future,visits,tourists,crossing,west,pay,visa,cost,dm,west,berliners,pay,fee",0.00,berlin
"west berliners initially could not visit east berlin or east germany at allall crossing points were closed to them between  august  and  december  in  negotiations between east and west resulted in a limited possibility for visits during the christmas season that year  similar very limited arrangements were made in   and 
",west berliners initially visit east berlin east germany allall crossing points closed august december negotiations east west resulted limited possibility visits christmas season year similar limited arrangements,7.10,"west,berliners,initially,visit,east,berlin,east,germany,allall,crossing,points,closed,august,december,negotiations,east,west,resulted,limited,possibility,visits,christmas,season,year,similar,limited,arrangements",0.00,berlin
"in  with the four power agreement on berlin agreements were reached that allowed west berliners to apply for visas to enter east berlin and east germany regularly comparable to the regulations already in force for west germans however east german authorities could still refuse entry permits
",power agreement berlin agreements reached allowed west berliners apply visas enter east berlin east germany regularly comparable regulations force west germans east german authorities refuse entry permits,6.51,"power,agreement,berlin,agreements,reached,allowed,west,berliners,apply,visas,enter,east,berlin,east,germany,regularly,comparable,regulations,force,west,germans,east,german,authorities,refuse,entry,permits",0.00,berlin
"east berliners and east germans could not at first travel to west berlin or west germany at all this regulation remained in force essentially until the fall of the wall but over the years several exceptions to these rules were introduced the most significant being
",east berliners east germans travel west berlin west germany regulation remained force essentially fall wall years exceptions rules introduced significant,9.43,"east,berliners,east,germans,travel,west,berlin,west,germany,regulation,remained,force,essentially,fall,wall,years,exceptions,rules,introduced,significant",0.00,berlin
"for each of these exceptions gdr citizens had to apply for individual approval which was never guaranteed in addition even if travel was approved gdr travellers could exchange only a very small amount of east german marks into deutsche marks  thus limiting the financial resources available for them to travel to the west this led to the west german practice of granting a small amount of dm annually  to gdr citizens visiting west germany and west berlin to help alleviate this situation
",exceptions gdr citizens apply individual approval guaranteed addition travel approved gdr travellers exchange small east german marks deutsche marks limiting financial resources available travel west led west german practice granting small dm annually gdr citizens visiting west germany west berlin help alleviate situation,7.98,"exceptions,gdr,citizens,apply,individual,approval,guaranteed,addition,travel,approved,gdr,travellers,exchange,small,east,german,marks,deutsche,marks,limiting,financial,resources,available,travel,west,led,west,german,practice,granting,small,dm,annually,gdr,citizens,visiting,west,germany,west,berlin,help,alleviate,situation",0.00,berlin
