Unclean,Clean,Noise_Pre_Processing,Training_Data,Noise_Post_Processing,Query
"the use of blue and white as the second kit colors owes its origins to the defunct latter day portuguese monarchy and dates from the s but it became the permanent second choice accidentally in the  world cup final brazils opponents were sweden who also wear yellow and a draw gave the home team sweden the right to play in yellow brazil who travelled with no second kit hurriedly purchased a set of blue shirts and sewed on them the badges taken from their yellow shirts
",use blue white second kit colors owes origins defunct day portuguese monarchy dates permanent second choice accidentally world cup final brazils opponents sweden wear yellow draw gave home team sweden right play yellow brazil travelled second kit hurriedly purchased set blue shirts sewed badges taken yellow shirts,8.28,"use,blue,white,second,kit,colors,owes,origins,defunct,day,portuguese,monarchy,dates,permanent,second,choice,accidentally,world,cup,final,brazils,opponents,sweden,wear,yellow,draw,gave,home,team,sweden,right,play,yellow,brazil,travelled,second,kit,hurriedly,purchased,set,blue,shirts,sewed,badges,taken,yellow,shirts",0.00,brazil
"the brazil national team is known by different names in various parts of the world nicknames for the squad in brazil include canarinho meaning little canary a reference to a species of bird commonly found in brazil that has a vivid yellow color this phrase was popularized by the late cartoonist fernando mangabeira pieruccetti during the  world cup despite the team not wearing the color yet back then amarelinha  seleo  verde amarela  pentacampeo  and esquadro de ouro  some latin american commentators often refer to the brazil team as el scratch  among others
",brazil national team known different names parts world nicknames squad brazil include canarinho meaning little canary reference species bird commonly found brazil vivid yellow color phrase popularized late cartoonist fernando mangabeira pieruccetti world cup despite team wearing color amarelinha seleo verde amarela pentacampeo esquadro de ouro latin american commentators refer brazil team el scratch,6.74,"brazil,national,team,known,different,names,parts,world,nicknames,squad,brazil,include,canarinho,meaning,little,canary,reference,species,bird,commonly,found,brazil,vivid,yellow,color,phrase,popularized,late,cartoonist,fernando,mangabeira,pieruccetti,world,cup,despite,team,wearing,color,amarelinha,seleo,verde,amarela,pentacampeo,esquadro,de,ouro,latin,american,commentators,refer,brazil,team,el,scratch",0.00,brazil
"the following players have been called up to the brazil squad in the last  months

",following players called brazil squad months,10.84,"following,players,called,brazil,squad,months",0.00,brazil
"mrio zagallo became the first person to win the fifa world cup both as a player  and as a manager  in  when he was of age  he won the fifa world cup which made him the second youngest coach to win the fifa world cup while still in brazil as an assistant coach the team won the  fifa world cup
",mrio zagallo person win fifa world cup player manager age fifa world cup second youngest coach win fifa world cup brazil assistant coach team fifa world cup,11.26,"mrio,zagallo,person,win,fifa,world,cup,player,manager,age,fifa,world,cup,second,youngest,coach,win,fifa,world,cup,brazil,assistant,coach,team,fifa,world,cup",0.00,brazil
"brazil has qualified for every fifa world cup they entered never requiring a qualifying play off with five titles they have won the tournament on more occasions than any other national team
",brazil qualified fifa world cup entered requiring qualifying play titles tournament occasions national team,9.47,"brazil,qualified,fifa,world,cup,entered,requiring,qualifying,play,titles,tournament,occasions,national,team",0.00,brazil
"below is a result summary of all matches brazil have played against fifa recognized teams updated to  december 
",result summary matches brazil played fifa recognized teams updated december,7.14,"result,summary,matches,brazil,played,fifa,recognized,teams,updated,december",0.00,brazil
