Unclean,Clean,Noise_Pre_Processing,Training_Data,Noise_Post_Processing,Query
"brazil is one of the three countries in latin america with an operational synchrotron laboratory a research facility on physics chemistry material science and life sciences and brazil is the only latin american country to have a semiconductor company with its own fabrication plant the ceitec according to the global information technology report  of the world economic forum brazil is the worlds st largest developer of information technology brazil was ranked th in the global innovation index in  up from th in 
",brazil countries latin america operational synchrotron laboratory research facility physics chemistry material science life sciences brazil latin american country semiconductor company fabrication plant ceitec according global information technology report world economic forum brazil worlds st largest developer information technology brazil ranked th global innovation index th,6.99,"brazil,countries,latin,america,operational,synchrotron,laboratory,research,facility,physics,chemistry,material,science,life,sciences,brazil,latin,american,country,semiconductor,company,fabrication,plant,ceitec,according,global,information,technology,report,world,economic,forum,brazil,worlds,st,largest,developer,information,technology,brazil,ranked,th,global,innovation,index,th",0.00,brazil
"brazil is the worlds tenth largest energy consumer with much of its energy coming from renewable sources particularly hydroelectricity and ethanol the itaipu dam is the worlds largest hydroelectric plant by energy generation and the country has other large plants like belo monte and tucuru the first car with an ethanol engine was produced in  and the first airplane engine running on ethanol in 
",brazil worlds tenth largest energy consumer energy coming renewable sources particularly hydroelectricity ethanol itaipu dam worlds largest hydroelectric plant energy generation country large plants like belo monte tucuru car ethanol engine produced airplane engine running ethanol,7.04,"brazil,worlds,tenth,largest,energy,consumer,energy,coming,renewable,sources,particularly,hydroelectricity,ethanol,itaipu,dam,worlds,largest,hydroelectric,plant,energy,generation,country,large,plants,like,belo,monte,tucuru,car,ethanol,engine,produced,airplane,engine,running,ethanol",0.00,brazil
"at the end of  brazil was the nd country in the world in terms of installed hydroelectric power  and biomass  the th country in the world in terms of installed wind power  and the th country in the world in terms of installed solar power   on track to also become one of the top  in the world in solar energy at the end of  brazil was the th largest producer of wind energy in the world  behind only china usa and germany and the th largest producer of solar energy in the world 
",end brazil nd country world terms installed hydroelectric power biomass th country world terms installed wind power th country world terms installed solar power track world solar energy end brazil th largest producer wind energy world china usa germany th largest producer solar energy world,10.00,"end,brazil,nd,country,world,terms,installed,hydroelectric,power,biomass,th,country,world,terms,installed,wind,power,th,country,world,terms,installed,solar,power,track,world,solar,energy,end,brazil,th,largest,producer,wind,energy,world,china,usa,germany,th,largest,producer,solar,energy,world",0.00,brazil
"in the electric energy matrix the difference between brazil and the world is even greater while the world only had  of renewable electric energy in  brazil had  the brazilian electric matrix was composed of hydraulic energy  biomass  wind energy  solar energy  natural gas  oil products  nuclear  coal and derivatives 
brazil has the largest electricity sector in latin america
its capacity at the end of  was  mw
",electric energy matrix difference brazil world greater world renewable electric energy brazil brazilian electric matrix composed hydraulic energy biomass wind energy solar energy natural gas oil products nuclear coal derivatives brazil largest electricity sector latin americaits capacity end mw,6.52,"electric,energy,matrix,difference,brazil,world,greater,world,renewable,electric,energy,brazil,brazilian,electric,matrix,composed,hydraulic,energy,biomass,wind,energy,solar,energy,natural,gas,oil,products,nuclear,coal,derivatives,brazil,largest,electricity,sector,latin,americaits,capacity,end,mw",0.00,brazil
"as for oil the brazilian government has embarked on a program over the decades to reduce dependence on imported oil which previously accounted for more than  of the countrys oil needs brazil became self sufficient in oil in  in  the country closed the year as the th oil producer in the world with an average of close to  million barrels per day becoming an exporter of the product
",oil brazilian government embarked program decades reduce dependence imported oil previously accounted countrys oil needs brazil self sufficient oil country closed year th oil producer world average close million barrels day exporter product,9.16,"oil,brazilian,government,embarked,program,decades,reduce,dependence,imported,oil,previously,accounted,countrys,oil,needs,brazil,self,sufficient,oil,country,closed,year,th,oil,producer,world,average,close,million,barrels,day,exporter,product",0.00,brazil
"brazils railway system has been declining since  when emphasis shifted to highway construction the total length of railway track was  km  in  as compared with  km  in  most of the railway system belonged to the federal railroad corporation rffsa which was privatized in  the so paulo metro was the first underground transit system in brazil the other metro systems are in rio de janeiro porto alegre recife belo horizonte braslia salvador and fortaleza the country has an extensive rail network of  kilometers  in length the tenth largest network in the world currently the brazilian government unlike the past seeks to encourage this mode of transport an example of this incentive is the project of the rioso paulo high speed rail that will connect the two main cities of the country to carry passengers
",brazils railway system declining emphasis shifted highway construction total length railway track km compared km railway system belonged federal railroad corporation rffsa privatized paulo metro underground transit system brazil metro systems rio de janeiro porto alegre recife belo horizonte braslia salvador fortaleza country extensive rail network kilometers length tenth largest network world currently brazilian government unlike past seeks encourage mode transport example incentive project rioso paulo high speed rail connect main cities country carry passengers,7.20,"brazils,railway,system,declining,emphasis,shifted,highway,construction,total,length,railway,track,km,compared,km,railway,system,belonged,federal,railroad,corporation,rffsa,privatized,paulo,metro,underground,transit,system,brazil,metro,systems,rio,de,janeiro,porto,alegre,recife,belo,horizonte,braslia,salvador,fortaleza,country,extensive,rail,network,kilometers,length,tenth,largest,network,world,currently,brazilian,government,unlike,past,seeks,encourage,mode,transport,example,incentive,project,rioso,paulo,high,speed,rail,connect,main,cities,country,carry,passengers",0.00,brazil
"there are about  airports in brazil including landing fields the second largest number in the world after the united states so pauloguarulhos international airport near so paulo is the largest and busiest airport with nearly  million passengers annually while handling the vast majority of commercial traffic for the country
",airports brazil including landing fields second largest number world united states pauloguarulhos international airport near paulo largest busiest airport nearly million passengers annually handling vast majority commercial traffic country,6.15,"airports,brazil,including,landing,fields,second,largest,number,world,united,states,pauloguarulhos,international,airport,near,paulo,largest,busiest,airport,nearly,million,passengers,annually,handling,vast,majority,commercial,traffic,country",0.00,brazil
"the population of brazil as recorded by the  pnad was approximately  million  with a ratio of men to women of  and  of the population defined as urban the population is heavily concentrated in the southeastern  and northeastern  regions while the two most extensive regions the center west and the north which together make up  of the brazilian territory have a total of only  million inhabitants
",population brazil recorded pnad approximately million ratio men women population defined urban population heavily concentrated southeastern northeastern regions extensive regions center west north brazilian territory total million inhabitants,9.32,"population,brazil,recorded,pnad,approximately,million,ratio,men,women,population,defined,urban,population,heavily,concentrated,southeastern,northeastern,regions,extensive,regions,center,west,north,brazilian,territory,total,million,inhabitants",0.00,brazil
"the first census in brazil was carried out in  and recorded a population of  from  to   million europeans arrived brazils population increased significantly between  and  because of a decline in the mortality rate even though the birth rate underwent a slight decline in the s the annual population growth rate was  rising to  in the s and remaining at  in the s as life expectancy rose from  to  years and to  years in 
it has been steadily falling since the s from  per year between  and  to  in  and is expected to fall to a negative value of  by  thus completing the demographic transition
",census brazil carried recorded population million europeans arrived brazils population increased significantly decline mortality rate birth rate underwent slight decline annual population growth rate rising remaining life expectancy rose years years steadily falling year expected fall negative value completing demographic transition,10.61,"census,brazil,carried,recorded,population,million,europeans,arrived,brazils,population,increased,significantly,decline,mortality,rate,birth,rate,underwent,slight,decline,annual,population,growth,rate,rising,remaining,life,expectancy,rose,years,years,steadily,falling,year,expected,fall,negative,value,completing,demographic,transition",0.00,brazil
"race and ethnicity in brazil
",race ethnicity brazil,6.90,"race,ethnicity,brazil",0.00,brazil
"since the arrival of the portuguese in  considerable genetic mixing between amerindians europeans and africans has taken place in all regions of the country  from the th century brazil opened its borders to immigration about five million people from over  countries migrated to brazil between  and  most of them of portuguese italian spanish german ukrainian polish jewish russian chinese japanese and arab origin brazil has the second largest jewish community in latin america making up  of its population
",arrival portuguese considerable genetic mixing amerindians europeans africans taken place regions country th century brazil opened borders immigration million people countries migrated brazil portuguese italian spanish german ukrainian polish jewish russian chinese japanese arab origin brazil second largest jewish community latin america making population,6.71,"arrival,portuguese,considerable,genetic,mixing,amerindians,europeans,africans,taken,place,regions,country,th,century,brazil,opened,borders,immigration,million,people,countries,migrated,brazil,portuguese,italian,spanish,german,ukrainian,polish,jewish,russian,chinese,japanese,arab,origin,brazil,second,largest,jewish,community,latin,america,making,population",0.00,brazil
"people of considerable amerindian ancestry form the majority of the population in the northern northeastern and center western regions in  the national indian foundation estimated that brazil has  different uncontacted tribes up from their estimate of  in  brazil is believed to have the largest number of uncontacted peoples in the world
",people considerable amerindian ancestry form majority population northern northeastern center western regions national indian foundation estimated brazil different uncontacted tribes estimate brazil believed largest number uncontacted peoples world,6.78,"people,considerable,amerindian,ancestry,form,majority,population,northern,northeastern,center,western,regions,national,indian,foundation,estimated,brazil,different,uncontacted,tribes,estimate,brazil,believed,largest,number,uncontacted,peoples,world",0.00,brazil
"religion in brazil 
",religion brazil,5.00,"religion,brazil",0.00,brazil
"christianity is the countrys predominant faith with roman catholicism being its largest denomination brazil has the worlds largest catholic population according to the  demographic census   of the population followed roman catholicism  protestantism  kardecist spiritism  other religions undeclared or undetermined while  had no religion
",christianity countrys predominant faith roman catholicism largest denomination brazil worlds largest catholic population according demographic census population followed roman catholicism protestantism kardecist spiritism religions undeclared undetermined religion,4.73,"christianity,countrys,predominant,faith,roman,catholicism,largest,denomination,brazil,worlds,largest,catholic,population,according,demographic,census,population,followed,roman,catholicism,protestantism,kardecist,spiritism,religions,undeclared,undetermined,religion",0.00,brazil
"religion in brazil was formed from the meeting of the catholic church with the religious traditions of enslaved african peoples and indigenous peoples this confluence of faiths during the portuguese colonization of brazil led to the development of a diverse array of syncretistic practices within the overarching umbrella of brazilian catholic church characterized by traditional portuguese festivities
",religion brazil formed meeting catholic church religious traditions enslaved african peoples indigenous peoples confluence faiths portuguese colonization brazil led development diverse array syncretistic practices overarching umbrella brazilian catholic church characterized traditional portuguese festivities,5.96,"religion,brazil,formed,meeting,catholic,church,religious,traditions,enslaved,african,peoples,indigenous,peoples,confluence,faiths,portuguese,colonization,brazil,led,development,diverse,array,syncretistic,practices,overarching,umbrella,brazilian,catholic,church,characterized,traditional,portuguese,festivities",0.00,brazil
"in recent decades protestantism particularly in forms of pentecostalism and evangelicalism has spread in brazil while the proportion of catholics has dropped significantly after protestantism individuals professing no religion are also a significant group exceeding  of the population as of the  census the cities of boa vista salvador and porto velho have the greatest proportion of irreligious residents in brazil teresina fortaleza and florianpolis were the most roman catholic in the country greater rio de janeiro not including the city proper is the most irreligious and least roman catholic brazilian periphery while greater porto alegre and greater fortaleza are on the opposite sides of the lists respectively
",recent decades protestantism particularly forms pentecostalism evangelicalism spread brazil proportion catholics dropped significantly protestantism individuals professing religion significant group exceeding population census cities boa vista salvador porto velho greatest proportion irreligious residents brazil teresina fortaleza florianpolis roman catholic country greater rio de janeiro including city proper irreligious roman catholic brazilian periphery greater porto alegre greater fortaleza opposite sides lists respectively,6.54,"recent,decades,protestantism,particularly,forms,pentecostalism,evangelicalism,spread,brazil,proportion,catholics,dropped,significantly,protestantism,individuals,professing,religion,significant,group,exceeding,population,census,cities,boa,vista,salvador,porto,velho,greatest,proportion,irreligious,residents,brazil,teresina,fortaleza,florianpolis,roman,catholic,country,greater,rio,de,janeiro,including,city,proper,irreligious,roman,catholic,brazilian,periphery,greater,porto,alegre,greater,fortaleza,opposite,sides,lists,respectively",0.00,brazil
"in october  the brazilian senate approved and enacted by the president of brazil in february  an agreement with the vatican in which the legal statute of the catholic church in brazil is recognized the agreement confirmed norms that were normally complied with regarding religious education in public elementary schools  marriage and spiritual assistance in prisons and hospitals the project was criticized by parliamentarians who understood the end of the secular state with the approval of the agreement
",october brazilian senate approved enacted president brazil february agreement vatican legal statute catholic church brazil recognized agreement confirmed norms normally complied religious education public elementary schools marriage spiritual assistance prisons hospitals project criticized parliamentarians understood end secular state approval agreement,7.31,"october,brazilian,senate,approved,enacted,president,brazil,february,agreement,vatican,legal,statute,catholic,church,brazil,recognized,agreement,confirmed,norms,normally,complied,religious,education,public,elementary,schools,marriage,spiritual,assistance,prisons,hospitals,project,criticized,parliamentarians,understood,end,secular,state,approval,agreement",0.00,brazil
"public health services are universal and offered to all citizens of the country for free however the construction and maintenance of health centers and hospitals are financed by taxes and the country spends about  of its gdp on expenditures in the area in  brazil had  doctors and  hospital beds for every  inhabitants
",public health services universal offered citizens country free construction maintenance health centers hospitals financed taxes country spends gdp expenditures area brazil doctors hospital beds inhabitants,8.46,"public,health,services,universal,offered,citizens,country,free,construction,maintenance,health,centers,hospitals,financed,taxes,country,spends,gdp,expenditures,area,brazil,doctors,hospital,beds,inhabitants",0.00,brazil
"despite all the progress made since the creation of the universal health care system in  there are still several public health problems in brazil in  the main points to be solved were the high infant  and maternal mortality rates 
",despite progress creation universal health care system public health problems brazil main points solved high infant maternal mortality rates,8.66,"despite,progress,creation,universal,health,care,system,public,health,problems,brazil,main,points,solved,high,infant,maternal,mortality,rates",0.00,brazil
"the official language of brazil is portuguese  which almost all of the population speaks and is virtually the only language used in newspapers radio television and for business and administrative purposes brazil is the only portuguese speaking nation in the americas making the language an important part of brazilian national identity and giving it a national culture distinct from those of its spanish speaking neighbors
",official language brazil portuguese population speaks virtually language newspapers radio television business administrative purposes brazil portuguese speaking nation americas making language important brazilian national identity giving national culture distinct spanish speaking neighbors,7.80,"official,language,brazil,portuguese,population,speaks,virtually,language,newspapers,radio,television,business,administrative,purposes,brazil,portuguese,speaking,nation,americas,making,language,important,brazilian,national,identity,giving,national,culture,distinct,spanish,speaking,neighbors",0.00,brazil
"there are significant communities of german  and italian  origins in the southern and southeastern regions whose ancestors native languages were carried along to brazil and which still alive there are influenced by the portuguese language talian is officially a historic patrimony of rio grande do sul and two german dialects possess co official status in a few municipalities italian is also recognized as ethnic language in the santa teresa microregion and vila velha  and is taught as mandatory second language at school
",significant communities german italian origins southern southeastern regions ancestors native languages carried brazil alive influenced portuguese language talian officially historic patrimony rio grande sul german dialects possess co official status municipalities italian recognized ethnic language santa teresa microregion vila velha taught mandatory second language school,7.06,"significant,communities,german,italian,origins,southern,southeastern,regions,ancestors,native,languages,carried,brazil,alive,influenced,portuguese,language,talian,officially,historic,patrimony,rio,grande,sul,german,dialects,possess,co,official,status,municipalities,italian,recognized,ethnic,language,santa,teresa,microregion,vila,velha,taught,mandatory,second,language,school",0.00,brazil
"according to ibge  urban areas already concentrate  of the population while the southeast region remains the most populated one with over  million inhabitants
the largest urban agglomerations in brazil are so paulo rio de janeiro and belo horizonte  all in the southeastern region  with   and  million inhabitants respectively the majority of state capitals are the largest cities in their states except for vitria the capital of esprito santo and florianpolis the capital of santa catarina
",according ibge urban areas concentrate population southeast region remains populated million inhabitantsthe largest urban agglomerations brazil paulo rio de janeiro belo horizonte southeastern region million inhabitants respectively majority state capitals largest cities states vitria capital esprito santo florianpolis capital santa catarina,6.92,"according,ibge,urban,areas,concentrate,population,southeast,region,remains,populated,million,inhabitantsthe,largest,urban,agglomerations,brazil,paulo,rio,de,janeiro,belo,horizonte,southeastern,region,million,inhabitants,respectively,majority,state,capitals,largest,cities,states,vitria,capital,esprito,santo,florianpolis,capital,santa,catarina",0.00,brazil
"the core culture of brazil is derived from portuguese culture because of its strong colonial ties with the portuguese empire among other influences the portuguese introduced the portuguese language roman catholicism and colonial architectural styles the culture was also strongly influenced by african indigenous and non portuguese european cultures and traditions
",core culture brazil derived portuguese culture strong colonial ties portuguese empire influences portuguese introduced portuguese language roman catholicism colonial architectural styles culture strongly influenced african indigenous non portuguese european cultures traditions,5.48,"core,culture,brazil,derived,portuguese,culture,strong,colonial,ties,portuguese,empire,influences,portuguese,introduced,portuguese,language,roman,catholicism,colonial,architectural,styles,culture,strongly,influenced,african,indigenous,non,portuguese,european,cultures,traditions",0.00,brazil
"some aspects of brazilian culture were influenced by the contributions of italian german and other european as well as japanese jewish and arab immigrants who arrived in large numbers in the south and southeast of brazil during the th and th centuries the indigenous amerindians influenced brazils language and cuisine and the africans influenced language cuisine music dance and religion
",aspects brazilian culture influenced contributions italian german european japanese jewish arab immigrants arrived large numbers south southeast brazil th th centuries indigenous amerindians influenced brazils language cuisine africans influenced language cuisine music dance religion,6.68,"aspects,brazilian,culture,influenced,contributions,italian,german,european,japanese,jewish,arab,immigrants,arrived,large,numbers,south,southeast,brazil,th,th,centuries,indigenous,amerindians,influenced,brazils,language,cuisine,africans,influenced,language,cuisine,music,dance,religion",0.00,brazil
"the architecture of brazil is influenced by europe especially portugal it has a history that goes back  years to the time when pedro lvares cabral landed in brazil in  portuguese colonial architecture was the first wave of architecture to go to brazil it is the basis for all brazilian architecture of later centuries in the th century during the time of the empire of brazil the country followed european trends and adopted neoclassical and gothic revival architecture then in the th century especially in brasilia brazil experimented with modernist architecture
",architecture brazil influenced europe especially portugal history goes years time pedro lvares cabral landed brazil portuguese colonial architecture wave architecture brazil basis brazilian architecture later centuries th century time empire brazil country followed european trends adopted neoclassical gothic revival architecture th century especially brasilia brazil experimented modernist architecture,7.45,"architecture,brazil,influenced,europe,especially,portugal,history,goes,years,time,pedro,lvares,cabral,landed,brazil,portuguese,colonial,architecture,wave,architecture,brazil,basis,brazilian,architecture,later,centuries,th,century,time,empire,brazil,country,followed,european,trends,adopted,neoclassical,gothic,revival,architecture,th,century,especially,brasilia,brazil,experimented,modernist,architecture",0.00,brazil
