Unclean,Clean,Noise_Pre_Processing,Training_Data,Noise_Post_Processing,Query
"brazil nt  officially the federative republic of brazil  is the largest country in south america and in latin america at  million square kilometers  and with over  million people brazil is the worlds fifth largest country by area and the seventh most populous its capital is braslia and its most populous city is so paulo the federation is composed of the union of the  states and the federal district it is the only country in the americas to have portuguese as an official language it is one of the most multicultural and ethnically diverse nations due to over a century of mass immigration from around the world and the most populous roman catholic majority country
",brazil nt officially federative republic brazil largest country south america latin america million square kilometers million people brazil worlds fifth largest country area seventh populous capital braslia populous city paulo federation composed union states federal district country americas portuguese official language multicultural ethnically diverse nations century mass immigration world populous roman catholic majority country,8.97,"brazil,nt,officially,federative,republic,brazil,largest,country,south,america,latin,america,million,square,kilometers,million,people,brazil,worlds,fifth,largest,country,area,seventh,populous,capital,braslia,populous,city,paulo,federation,composed,union,states,federal,district,country,americas,portuguese,official,language,multicultural,ethnically,diverse,nations,century,mass,immigration,world,populous,roman,catholic,majority,country",0.00,brazil
"bounded by the atlantic ocean on the east brazil has a coastline of  kilometers  it borders all other countries and territories in south america except ecuador and chile and covers roughly half of the continents land area its amazon basin includes a vast tropical forest home to diverse wildlife a variety of ecological systems and extensive natural resources spanning numerous protected habitats this unique environmental heritage positions brazil at number one of  megadiverse countries and is the subject of significant global interest as environmental degradation through processes like deforestation has direct impacts on global issues like climate change and biodiversity loss
",bounded atlantic ocean east brazil coastline kilometers borders countries territories south america ecuador chile covers roughly half continents land area amazon basin includes vast tropical forest home diverse wildlife variety ecological systems extensive natural resources spanning numerous protected habitats unique environmental heritage positions brazil number megadiverse countries subject significant global interest environmental degradation processes like deforestation direct impacts global issues like climate change biodiversity loss,5.27,"bounded,atlantic,ocean,east,brazil,coastline,kilometers,borders,countries,territories,south,america,ecuador,chile,covers,roughly,half,continents,land,area,amazon,basin,includes,vast,tropical,forest,home,diverse,wildlife,variety,ecological,systems,extensive,natural,resources,spanning,numerous,protected,habitats,unique,environmental,heritage,positions,brazil,number,megadiverse,countries,subject,significant,global,interest,environmental,degradation,processes,like,deforestation,direct,impacts,global,issues,like,climate,change,biodiversity,loss",0.00,brazil
"the territory which would become known as brazil was inhabited by numerous tribal nations prior to the landing in  of explorer pedro lvares cabral who claimed the discovered land for the portuguese empire brazil remained a portuguese colony until  when the capital of the empire was transferred from lisbon to rio de janeiro in  the colony was elevated to the rank of kingdom upon the formation of the united kingdom of portugal brazil and the algarves independence was achieved in  with the creation of the empire of brazil a unitary state governed under a constitutional monarchy and a parliamentary system the ratification of the first constitution in  led to the formation of a bicameral legislature now called the national congress slavery was abolished in  the country became a presidential republic in  following a military coup dtat an authoritarian military junta came to power in  and ruled until  after which civilian governance resumed brazils current constitution formulated in  defines it as a democratic federal republic due to its rich culture and history the country ranks thirteenth in the world by number of unesco world heritage sites
",territory known brazil inhabited numerous tribal nations prior landing explorer pedro lvares cabral claimed discovered land portuguese empire brazil remained portuguese colony capital empire transferred lisbon rio de janeiro colony elevated rank kingdom formation united kingdom portugal brazil algarves independence achieved creation empire brazil unitary state governed constitutional monarchy parliamentary system ratification constitution led formation bicameral legislature called national congress slavery abolished country presidential republic following military coup dtat authoritarian military junta came power ruled civilian governance resumed brazils current constitution formulated defines democratic federal republic rich culture history country ranks thirteenth world number unesco world heritage sites,7.53,"territory,known,brazil,inhabited,numerous,tribal,nations,prior,landing,explorer,pedro,lvares,cabral,claimed,discovered,land,portuguese,empire,brazil,remained,portuguese,colony,capital,empire,transferred,lisbon,rio,de,janeiro,colony,elevated,rank,kingdom,formation,united,kingdom,portugal,brazil,algarves,independence,achieved,creation,empire,brazil,unitary,state,governed,constitutional,monarchy,parliamentary,system,ratification,constitution,led,formation,bicameral,legislature,called,national,congress,slavery,abolished,country,presidential,republic,following,military,coup,dtat,authoritarian,military,junta,came,power,ruled,civilian,governance,resumed,brazils,current,constitution,formulated,defines,democratic,federal,republic,rich,culture,history,country,ranks,thirteenth,world,number,unesco,world,heritage,sites",0.00,brazil
"a major non nato ally of the united states brazil is a regional and middle power and is also classified as an emerging power categorised as a developing country with a high human development index brazil is considered an advanced emerging economy having the twelfth largest gdp in the world by nominal and ninth by ppp measures the largest in latin america as an upper middle income economy by the world bank and a newly industrialized country brazil has the largest share of global wealth in south america and it is one of the worlds major breadbaskets being the largest producer of coffee for the last  years however the country retains noticeable corruption crime and social inequality brazil is a founding member of the united nations the g brics mercosul organization of american states organization of ibero american states and the community of portuguese language countries
",major non nato ally united states brazil regional middle power classified emerging power categorised developing country high human development index brazil considered advanced emerging economy twelfth largest gdp world nominal ninth ppp measures largest latin america upper middle income economy world bank newly industrialized country brazil largest share global wealth south america worlds major breadbaskets largest producer coffee years country retains noticeable corruption crime social inequality brazil founding member united nations g brics mercosul organization american states organization ibero american states community portuguese language countries,6.92,"major,non,nato,ally,united,states,brazil,regional,middle,power,classified,emerging,power,categorised,developing,country,high,human,development,index,brazil,considered,advanced,emerging,economy,twelfth,largest,gdp,world,nominal,ninth,ppp,measures,largest,latin,america,upper,middle,income,economy,world,bank,newly,industrialized,country,brazil,largest,share,global,wealth,south,america,worlds,major,breadbaskets,largest,producer,coffee,years,country,retains,noticeable,corruption,crime,social,inequality,brazil,founding,member,united,nations,g,brics,mercosul,organization,american,states,organization,ibero,american,states,community,portuguese,language,countries",0.00,brazil
"the word brazil likely comes from the portuguese word for brazilwood a tree that once grew plentifully along the brazilian coast in portuguese brazilwood is called pau brasil with the word brasil commonly given the etymology red like an ember formed from brasa  and the suffix  il  as brazilwood produces a deep red dye it was highly valued by the european textile industry and was the earliest commercially exploited product from brazil throughout the th century massive amounts of brazilwood were harvested by indigenous peoples  along the brazilian coast who sold the timber to european traders  in return for assorted european consumer goods
",word brazil likely comes portuguese word brazilwood tree grew plentifully brazilian coast portuguese brazilwood called pau brasil word brasil commonly given etymology red like ember formed brasa suffix il brazilwood produces deep red dye highly valued european textile industry earliest commercially exploited product brazil th century massive amounts brazilwood harvested indigenous peoples brazilian coast sold timber european traders return assorted european consumer goods,6.19,"word,brazil,likely,comes,portuguese,word,brazilwood,tree,grew,plentifully,brazilian,coast,portuguese,brazilwood,called,pau,brasil,word,brasil,commonly,given,etymology,red,like,ember,formed,brasa,suffix,il,brazilwood,produces,deep,red,dye,highly,valued,european,textile,industry,earliest,commercially,exploited,product,brazil,th,century,massive,amounts,brazilwood,harvested,indigenous,peoples,brazilian,coast,sold,timber,european,traders,return,assorted,european,consumer,goods",0.00,brazil
"the official portuguese name of the land in original portuguese records was the land of the holy cross  but european sailors and merchants commonly called it the land of brazil  because of the brazilwood trade the popular appellation eclipsed and eventually supplanted the official portuguese name some early sailors called it the land of parrots
",official portuguese land original portuguese records land holy cross european sailors merchants commonly called land brazil brazilwood trade popular appellation eclipsed eventually supplanted official portuguese early sailors called land parrots,7.20,"official,portuguese,land,original,portuguese,records,land,holy,cross,european,sailors,merchants,commonly,called,land,brazil,brazilwood,trade,popular,appellation,eclipsed,eventually,supplanted,official,portuguese,early,sailors,called,land,parrots",0.00,brazil
"in the guaran language an official language of paraguay brazil is called pindorama this was the name the indigenous population gave to the region meaning land of the palm trees
",guaran language official language paraguay brazil called pindorama indigenous population gave region meaning land palm trees,7.91,"guaran,language,official,language,paraguay,brazil,called,pindorama,indigenous,population,gave,region,meaning,land,palm,trees",0.00,brazil
"some of the earliest human remains found in the americas luzia woman were found in the area of pedro leopoldo minas gerais and provide evidence of human habitation going back at least  years 
the earliest pottery ever found in the western hemisphere was excavated in the amazon basin of brazil and radiocarbon dated to  years ago  the pottery was found near santarm and provides evidence that the tropical forest region supported a complex prehistoric culture the marajoara culture flourished on maraj in the amazon delta from ad  to  developing sophisticated pottery social stratification large populations mound building and complex social formations such as chiefdoms
",earliest human remains found americas luzia woman found area pedro leopoldo minas gerais provide evidence human habitation going years earliest pottery found western hemisphere excavated amazon basin brazil radiocarbon dated years ago pottery found near santarm provides evidence tropical forest region supported complex prehistoric culture marajoara culture flourished maraj amazon delta ad developing sophisticated pottery social stratification large populations mound building complex social formations chiefdoms,5.81,"earliest,human,remains,found,americas,luzia,woman,found,area,pedro,leopoldo,minas,gerais,provide,evidence,human,habitation,going,years,earliest,pottery,found,western,hemisphere,excavated,amazon,basin,brazil,radiocarbon,dated,years,ago,pottery,found,near,santarm,provides,evidence,tropical,forest,region,supported,complex,prehistoric,culture,marajoara,culture,flourished,maraj,amazon,delta,ad,developing,sophisticated,pottery,social,stratification,large,populations,mound,building,complex,social,formations,chiefdoms",0.00,brazil
"around the time of the portuguese arrival the territory of current day brazil had an estimated indigenous population of  million people mostly semi nomadic who subsisted on hunting fishing gathering and migrant agriculture the indigenous population of brazil comprised several large indigenous ethnic groups  the tup people were subdivided into the tupiniquins and tupinambs and there were also many subdivisions of the other groups
",time portuguese arrival territory current day brazil estimated indigenous population million people semi nomadic subsisted hunting fishing gathering migrant agriculture indigenous population brazil comprised large indigenous ethnic groups tup people subdivided tupiniquins tupinambs subdivisions groups,6.70,"time,portuguese,arrival,territory,current,day,brazil,estimated,indigenous,population,million,people,semi,nomadic,subsisted,hunting,fishing,gathering,migrant,agriculture,indigenous,population,brazil,comprised,large,indigenous,ethnic,groups,tup,people,subdivided,tupiniquins,tupinambs,subdivisions,groups",0.00,brazil
"following the  treaty of tordesillas the land now called brazil was claimed for the portuguese empire on  april  with the arrival of the portuguese fleet commanded by pedro lvares cabral the portuguese encountered indigenous peoples divided into several ethnic societies most of whom spoke languages of the tupiguaran family and fought among themselves though the first settlement was founded in  colonization effectively began in  when king john iii of portugal divided the territory into the fifteen private and autonomous captaincy colonies of brazil
",following treaty tordesillas land called brazil claimed portuguese empire april arrival portuguese fleet commanded pedro lvares cabral portuguese encountered indigenous peoples divided ethnic societies spoke languages tupiguaran family fought settlement founded colonization effectively began king johniii portugal divided territory private autonomous captaincy colonies brazil,6.86,"following,treaty,tordesillas,land,called,brazil,claimed,portuguese,empire,april,arrival,portuguese,fleet,commanded,pedro,lvares,cabral,portuguese,encountered,indigenous,peoples,divided,ethnic,societies,spoke,languages,tupiguaran,family,fought,settlement,founded,colonization,effectively,began,king,johniii,portugal,divided,territory,private,autonomous,captaincy,colonies,brazil",0.00,brazil
"however the decentralized and unorganized tendencies of the captaincy colonies proved problematic and in  the portuguese king restructured them into the governorate general of brazil in the city of salvador which became the capital of a single and centralized portuguese colony in south america in the first two centuries of colonization indigenous and european groups lived in constant war establishing opportunistic alliances in order to gain advantages against each other
",decentralized unorganized tendencies captaincy colonies proved problematic portuguese king restructured governorate general brazil city salvador capital single centralized portuguese colony south america centuries colonization indigenous european groups lived constant war establishing opportunistic alliances order gain advantages,7.16,"decentralized,unorganized,tendencies,captaincy,colonies,proved,problematic,portuguese,king,restructured,governorate,general,brazil,city,salvador,capital,single,centralized,portuguese,colony,south,america,centuries,colonization,indigenous,european,groups,lived,constant,war,establishing,opportunistic,alliances,order,gain,advantages",0.00,brazil
"by the mid th century cane sugar had become brazils most important export while slaves purchased in sub saharan africa in the slave market of western africa  had become its largest import to cope with plantations of sugarcane due to increasing international demand for brazilian sugar portuguese brazil received more than  million slaves from africa between the years of  to 
",mid th century cane sugar brazils important export slaves purchased sub saharan africa slave market western africa largest import cope plantations sugarcane increasing international demand brazilian sugar portuguese brazil received million slaves africa years,6.91,"mid,th,century,cane,sugar,brazils,important,export,slaves,purchased,sub,saharan,africa,slave,market,western,africa,largest,import,cope,plantations,sugarcane,increasing,international,demand,brazilian,sugar,portuguese,brazil,received,million,slaves,africa,years",0.00,brazil
"by the end of the th century sugarcane exports began to decline and the discovery of gold by bandeirantes in the s would become the new backbone of the colonys economy fostering a brazilian gold rush which attracted thousands of new settlers to brazil from portugal and all portuguese colonies around the world this increased level of immigration in turn caused some conflicts between newcomers and old settlers
",end th century sugarcane exports began decline discovery gold bandeirantes new backbone colonys economy fostering brazilian gold rush attracted thousands new settlers brazil portugal portuguese colonies world increased level immigration turn caused conflicts newcomers old settlers,7.77,"end,th,century,sugarcane,exports,began,decline,discovery,gold,bandeirantes,new,backbone,colonys,economy,fostering,brazilian,gold,rush,attracted,thousands,new,settlers,brazil,portugal,portuguese,colonies,world,increased,level,immigration,turn,caused,conflicts,newcomers,old,settlers",0.00,brazil
"portuguese expeditions known as bandeiras gradually expanded brazils original colonial frontiers in south america to its approximately current borders in this era other european powers tried to colonize parts of brazil in incursions that the portuguese had to fight notably the french in rio during the s in maranho during the s and the dutch in bahia and pernambuco during the dutchportuguese war after the end of iberian union
",portuguese expeditions known bandeiras gradually expanded brazils original colonial frontiers south america approximately current borders era european powers tried colonize parts brazil incursions portuguese fight notably french rio maranho dutch bahia pernambuco dutchportuguese war end iberian union,7.46,"portuguese,expeditions,known,bandeiras,gradually,expanded,brazils,original,colonial,frontiers,south,america,approximately,current,borders,era,european,powers,tried,colonize,parts,brazil,incursions,portuguese,fight,notably,french,rio,maranho,dutch,bahia,pernambuco,dutchportuguese,war,end,iberian,union",0.00,brazil
"the portuguese colonial administration in brazil had two objectives that would ensure colonial order and the monopoly of portugals wealthiest and largest colony to keep under control and eradicate all forms of slave rebellion and resistance such as the quilombo of palmares and to repress all movements for autonomy or independence such as the minas conspiracy
",portuguese colonial administration brazil objectives ensure colonial order monopoly portugals wealthiest largest colony control eradicate forms slave rebellion resistance quilombo palmares repress movements autonomy independence minas conspiracy,8.03,"portuguese,colonial,administration,brazil,objectives,ensure,colonial,order,monopoly,portugals,wealthiest,largest,colony,control,eradicate,forms,slave,rebellion,resistance,quilombo,palmares,repress,movements,autonomy,independence,minas,conspiracy",0.00,brazil
"in late  spanish and napoleonic forces threatened the security of continental portugal causing prince regent joo in the name of queen maria i to move the royal court from lisbon to rio de janeiro there they established some of brazils first financial institutions such as its local stock exchanges and its national bank additionally ending the portuguese monopoly on brazilian trade and opening brazil to other nations in  in retaliation for being forced into exile the prince regent ordered the portuguese conquest of french guiana
",late spanish napoleonic forces threatened security continental portugal causing prince regent joo queen maria royal court lisbon rio de janeiro established brazils financial institutions local stock exchanges national bank additionally ending portuguese monopoly brazilian trade opening brazil nations retaliation forced exile prince regent ordered portuguese conquest french guiana,6.94,"late,spanish,napoleonic,forces,threatened,security,continental,portugal,causing,prince,regent,joo,queen,maria,royal,court,lisbon,rio,de,janeiro,established,brazils,financial,institutions,local,stock,exchanges,national,bank,additionally,ending,portuguese,monopoly,brazilian,trade,opening,brazil,nations,retaliation,forced,exile,prince,regent,ordered,portuguese,conquest,french,guiana",0.00,brazil
"with the end of the peninsular war in  the courts of europe demanded that queen maria i and prince regent joo return to portugal deeming it unfit for the head of an ancient european monarchy to reside in a colony in  to justify continuing to live in brazil where the royal court had thrived for six years the crown established the united kingdom of portugal brazil and the algarves thus creating a pluricontinental transatlantic monarchic state however the leadership in portugal resentful of the new status of its larger colony continued to demand the return of the court to lisbon  in  acceding to the demands of revolutionaries who had taken the city of porto joo vi departed for lisbon there he swore an oath to the new constitution leaving his son prince pedro de alcntara as regent of the kingdom of brazil
",end peninsular war courts europe demanded queen maria prince regent joo return portugal deeming unfit head ancient european monarchy reside colony justify continuing live brazil royal court thrived years crown established united kingdom portugal brazil algarves creating pluricontinental transatlantic monarchic state leadership portugal resentful new status larger colony continued demand return court lisbon acceding demands revolutionaries taken city porto joo vi departed lisbon swore oath new constitution leaving son prince pedro de alcntara regent kingdom brazil,8.12,"end,peninsular,war,courts,europe,demanded,queen,maria,prince,regent,joo,return,portugal,deeming,unfit,head,ancient,european,monarchy,reside,colony,justify,continuing,live,brazil,royal,court,thrived,years,crown,established,united,kingdom,portugal,brazil,algarves,creating,pluricontinental,transatlantic,monarchic,state,leadership,portugal,resentful,new,status,larger,colony,continued,demand,return,court,lisbon,acceding,demands,revolutionaries,taken,city,porto,joo,vi,departed,lisbon,swore,oath,new,constitution,leaving,son,prince,pedro,de,alcntara,regent,kingdom,brazil",0.00,brazil
"tensions between portuguese and brazilians increased and the portuguese cortes guided by the new political regime imposed by the liberal revolution tried to re establish brazil as a colony the brazilians refused to yield and prince pedro decided to stand with them declaring the countrys independence from portugal on  september  a month later prince pedro was declared the first emperor of brazil with the royal title of dom pedro i resulting in the founding of the empire of brazil
",tensions portuguese brazilians increased portuguese cortes guided new political regime imposed liberal revolution tried establish brazil colony brazilians refused yield prince pedro decided stand declaring countrys independence portugal september month later prince pedro declared emperor brazil royal title dom pedroi resulting founding empire brazil,7.23,"tensions,portuguese,brazilians,increased,portuguese,cortes,guided,new,political,regime,imposed,liberal,revolution,tried,establish,brazil,colony,brazilians,refused,yield,prince,pedro,decided,stand,declaring,countrys,independence,portugal,september,month,later,prince,pedro,declared,emperor,brazil,royal,title,dom,pedroi,resulting,founding,empire,brazil",0.00,brazil
