Unclean,Clean,Noise_Pre_Processing,Training_Data,Noise_Post_Processing,Query
"the brazil national football team  nicknamed seleo canarinha  represents brazil in mens international football and is administered by the brazilian football confederation  the governing body for football in brazil they have been a member of fifa since  and a member of conmebol since 
",brazil national football team nicknamed seleo canarinha represents brazil mens international football administered brazilian football confederation governing body football brazil member fifa member conmebol,6.67,"brazil,national,football,team,nicknamed,seleo,canarinha,represents,brazil,mens,international,football,administered,brazilian,football,confederation,governing,body,football,brazil,member,fifa,member,conmebol",0.00,brazil
"brazil is the most successful national team in the fifa world cup being crowned winner five times     and  the seleo also has the best overall performance in the world cup competition both in proportional and absolute terms with a record of  victories in  matches played  goal difference  points and  losses it is the only national team to have played in all world cup editions without any absence nor need for playoffs and the only team to have won the world cup in four different continents once in europe  once in south america  twice in north america  and once in asia  brazil is also the most successful team in the now defunct fifa confederations cup winning it four times in    and 
",brazil successful national team fifa world cup crowned winner times seleo best overall performance world cup competition proportional absolute terms record victories matches played goal difference points losses national team played world cup editions absence need playoffs team world cup different continents europe south america twice north america asia brazil successful team defunct fifa confederations cup winning times,8.99,"brazil,successful,national,team,fifa,world,cup,crowned,winner,times,seleo,best,overall,performance,world,cup,competition,proportional,absolute,terms,record,victories,matches,played,goal,difference,points,losses,national,team,played,world,cup,editions,absence,need,playoffs,team,world,cup,different,continents,europe,south,america,twice,north,america,asia,brazil,successful,team,defunct,fifa,confederations,cup,winning,times",0.00,brazil
"in ranking standings brazil have the highest average football elo rating and the fourth all time peak football elo rating established in  in fifas ranking system brazil holds the record for most team of the year first ranking wins with  many commentators experts and former players have considered the brazil team of  to be the greatest team of all time other brazilian teams are also highly estimated and regularly appear listed among the best teams of all time such as the brazil teams of  and the squads of the  period with honorary mentions for the gifted  side in  the brazil national team achieved  consecutive matches undefeated a feat which they held as a world record for  years
",ranking standings brazil highest average football elo rating fourth time peak football elo rating established fifas ranking system brazil holds record team year ranking wins commentators experts players considered brazil team greatest team time brazilian teams highly estimated regularly appear listed best teams time brazil teams squads period honorary mentions gifted brazil national team achieved consecutive matches undefeated feat held world record years,7.85,"ranking,standings,brazil,highest,average,football,elo,rating,fourth,time,peak,football,elo,rating,established,fifas,ranking,system,brazil,holds,record,team,year,ranking,wins,commentators,experts,players,considered,brazil,team,greatest,team,time,brazilian,teams,highly,estimated,regularly,appear,listed,best,teams,time,brazil,teams,squads,period,honorary,mentions,gifted,brazil,national,team,achieved,consecutive,matches,undefeated,feat,held,world,record,years",0.00,brazil
"brazil has developed many rivalries through the years with the most notable ones being with argentinaknown as the superclssico das amricas in portuguese italyknown as the clssico mundial in portuguese or the world derby in english uruguay due to the traumatic maracanazo and the netherlands due to several important meetings between the two teams at several world cups
",brazil developed rivalries years notable ones argentinaknown superclssico das amricas portuguese italyknown clssico mundial portuguese world derby english uruguay traumatic maracanazo netherlands important meetings teams world cups,8.40,"brazil,developed,rivalries,years,notable,ones,argentinaknown,superclssico,das,amricas,portuguese,italyknown,clssico,mundial,portuguese,world,derby,english,uruguay,traumatic,maracanazo,netherlands,important,meetings,teams,world,cups",0.00,brazil
"it is generally believed that the inaugural game of the brazil national football team was a  match between a rio de janeiro and so paulo select team and the english club exeter city held in fluminenses stadium brazil won  with goals by oswaldo gomes and osman though it is claimed that the match was a  draw
",generally believed inaugural game brazil national football team match rio de janeiro paulo select team english club exeter city held fluminenses stadium brazil goals oswaldo gomes osman claimed match draw,8.44,"generally,believed,inaugural,game,brazil,national,football,team,match,rio,de,janeiro,paulo,select,team,english,club,exeter,city,held,fluminenses,stadium,brazil,goals,oswaldo,gomes,osman,claimed,match,draw",0.00,brazil
"in  brazil played in the first world cup held in uruguay the squad defeated bolivia but lost to yugoslavia being eliminated from the competition they lost in the first round to spain in  in italy but reached the semi finals in france in  being defeated  by eventual winners italy brazil were the only south american team to participate in this competition
",brazil played world cup held uruguay squad defeated bolivia lost yugoslavia eliminated competition lost round spain italy reached semi finals france defeated eventual winners italy brazil south american team participate competition,8.43,"brazil,played,world,cup,held,uruguay,squad,defeated,bolivia,lost,yugoslavia,eliminated,competition,lost,round,spain,italy,reached,semi,finals,france,defeated,eventual,winners,italy,brazil,south,american,team,participate,competition",0.00,brazil
"the  south american championship held in brazil ended a  year streak without official titles the last one had been in the  south american championship also played on brazilian soil
",south american championship held brazil ended year streak official titles south american championship played brazilian soil,7.18,"south,american,championship,held,brazil,ended,year,streak,official,titles,south,american,championship,played,brazilian,soil",0.00,brazil
"after that brazil first achieved international prominence when it hosted the  fifa world cup the team went into the last game of the final round against uruguay at estdio do maracan in rio needing only a draw to win the world cup uruguay however won the match and the cup in a game known as the maracanazo the match led to a period of national mourning
",brazil achieved international prominence hosted fifa world cup team went game final round uruguay estdio maracan rio needing draw win world cup uruguay match cup game known maracanazo match led period national mourning,9.35,"brazil,achieved,international,prominence,hosted,fifa,world,cup,team,went,game,final,round,uruguay,estdio,maracan,rio,needing,draw,win,world,cup,uruguay,match,cup,game,known,maracanazo,match,led,period,national,mourning",0.00,brazil
"for the  world cup in switzerland brazil was then almost completely renovated with the team colours changed  from all white to the yellow blue and green of the national flag to forget the maracanazo but still had a group of star players brazil reached the quarter final where they were beaten  by tournament favourites hungary in one of the ugliest matches in football history known as the battle of berne
",world cup switzerland brazil completely renovated team colours changed white yellow blue green national flag forget maracanazo group star players brazil reached quarter final beaten tournament favourites hungary ugliest matches football history known battle berne,8.62,"world,cup,switzerland,brazil,completely,renovated,team,colours,changed,white,yellow,blue,green,national,flag,forget,maracanazo,group,star,players,brazil,reached,quarter,final,beaten,tournament,favourites,hungary,ugliest,matches,football,history,known,battle,berne",0.00,brazil
"for the  world cup brazil were drawn in a group with england the ussr and austria they beat austria  in their first match then drew  with england before the match coach vicente feola made three substitutions that were crucial for brazil to defeat the soviets zito garrincha and pel from the kick off they kept up the pressure relentlessly and after three minutes which were later described as the greatest three minutes in the history of football vav gave brazil the lead they won the match by  pel scored the only goal of their quarter final match against wales and they beat france  in the semi final brazil then beat sweden  in the final winning their first world cup and becoming the first nation to win a world cup title outside of its own continent pel described it tearfully as a nation coming of age
",world cup brazil drawn group england ussr austria beat austria match drew england match coach vicente feola substitutions crucial brazil defeat soviets zito garrincha pel kick kept pressure relentlessly minutes later described greatest minutes history football vav gave brazil lead match pel scored goal quarter final match wales beat france semi final brazil beat sweden final winning world cup nation win world cup title outside continent pel described tearfully nation coming age,9.03,"world,cup,brazil,drawn,group,england,ussr,austria,beat,austria,match,drew,england,match,coach,vicente,feola,substitutions,crucial,brazil,defeat,soviets,zito,garrincha,pel,kick,kept,pressure,relentlessly,minutes,later,described,greatest,minutes,history,football,vav,gave,brazil,lead,match,pel,scored,goal,quarter,final,match,wales,beat,france,semi,final,brazil,beat,sweden,final,winning,world,cup,nation,win,world,cup,title,outside,continent,pel,described,tearfully,nation,coming,age",0.00,brazil
"in the  world cup brazil earned its second title with garrincha as the star player a mantle and responsibility laid upon him after the regular talisman pel was injured during the second group match against czechoslovakia and unable to play for the rest of the tournament
",world cup brazil earned second title garrincha star player mantle responsibility laid regular talisman pel injured second group match czechoslovakia unable play rest tournament,8.12,"world,cup,brazil,earned,second,title,garrincha,star,player,mantle,responsibility,laid,regular,talisman,pel,injured,second,group,match,czechoslovakia,unable,play,rest,tournament",0.00,brazil
"in the  world cup brazil had their worst performance in a world cup the  tournament was remembered for its excessively physical play and pel was one of the players most affected against portugal several violent tackles by the portuguese defenders caused pel to leave the match and the tournament brazil lost this match and was eliminated in the first round of the world cup for the first time since  they have not failed to reach the knockout stages of the competition since brazil became the second nation to be eliminated in the first round while holding the world cup crown following italy in  after the     and  world cups france italy spain and germany were also added to this list after the tournament pel declared that he did not wish to play in the world cup again nonetheless he returned in 
",world cup brazil worst performance world cup tournament remembered excessively physical play pel players affected portugal violent tackles portuguese defenders caused pel leave match tournament brazil lost match eliminated round world cup time failed reach knockout stages competition brazil second nation eliminated round holding world cup crown following italy world cups france italy spain germany added list tournament pel declared wish play world cup nonetheless returned,9.24,"world,cup,brazil,worst,performance,world,cup,tournament,remembered,excessively,physical,play,pel,players,affected,portugal,violent,tackles,portuguese,defenders,caused,pel,leave,match,tournament,brazil,lost,match,eliminated,round,world,cup,time,failed,reach,knockout,stages,competition,brazil,second,nation,eliminated,round,holding,world,cup,crown,following,italy,world,cups,france,italy,spain,germany,added,list,tournament,pel,declared,wish,play,world,cup,nonetheless,returned",0.00,brazil
"brazil won its third world cup in mexico in  it fielded what has since then often been considered the best world cup football squad ever led by pel in his last world cup finals captain carlos alberto torres jairzinho tosto grson and rivelino even though garrincha had retired this team was still a force to be reckoned with they won all six of their gamesagainst czechoslovakia england and romania during group play and against peru uruguay and italy in the knockout rounds jairzinho was the second top scorer with seven goals and is the only player to score in every match in a world cup pel finished with four goals brazil lifted the jules rimet trophy for the third time  which meant that they were allowed to keep it a replacement was then commissioned though it would be  years before brazil won it again
",brazil world cup mexico fielded considered best world cup football squad led pel world cup finals captain carlos alberto torres jairzinho tosto grson rivelino garrincha retired team force reckoned gamesagainst czechoslovakia england romania group play peru uruguay italy knockout rounds jairzinho second scorer seven goals player score match world cup pel finished goals brazil lifted jules rimet trophy time meant allowed replacement commissioned years brazil,9.75,"brazil,world,cup,mexico,fielded,considered,best,world,cup,football,squad,led,pel,world,cup,finals,captain,carlos,alberto,torres,jairzinho,tosto,grson,rivelino,garrincha,retired,team,force,reckoned,gamesagainst,czechoslovakia,england,romania,group,play,peru,uruguay,italy,knockout,rounds,jairzinho,second,scorer,seven,goals,player,score,match,world,cup,pel,finished,goals,brazil,lifted,jules,rimet,trophy,time,meant,allowed,replacement,commissioned,years,brazil",0.00,brazil
"after the international retirement of pel and other stars from the  squad brazil was not able to overcome the netherlands at the  world cup in west germany and finished in fourth place after losing the third place game to poland
",international retirement pel stars squad brazil able overcome netherlands world cup west germany finished fourth place losing place game poland,8.73,"international,retirement,pel,stars,squad,brazil,able,overcome,netherlands,world,cup,west,germany,finished,fourth,place,losing,place,game,poland",0.00,brazil
"in the second group stage of the  world cup brazil competed with tournament hosts argentina for top spot and a place in the finals in their last group match brazil defeated poland  to go to the top of the group with a goal difference of  argentina had had a goal difference of  but in its last group match it defeated peru  and thus qualified for the final in a match accused of ultimately unproven match fixing brazil subsequently beat italy in the third place play off and were the only team to remain unbeaten in the tournament
",second group stage world cup brazil competed tournament hosts argentina spot place finals group match brazil defeated poland group goal difference argentina goal difference group match defeated peru qualified final match accused ultimately unproven match fixing brazil subsequently beat italy place play team remain unbeaten tournament,9.60,"second,group,stage,world,cup,brazil,competed,tournament,hosts,argentina,spot,place,finals,group,match,brazil,defeated,poland,group,goal,difference,argentina,goal,difference,group,match,defeated,peru,qualified,final,match,accused,ultimately,unproven,match,fixing,brazil,subsequently,beat,italy,place,play,team,remain,unbeaten,tournament",0.00,brazil
"at the  world cup held in spain brazil were the tournament favorites and easily moved through the early part of the draw but a  defeat in barcelona to italy in a classic world cup match eliminated them from the tournament in the match that they refer to as sarris tragedy referencing the stadiums name the  team with a midfield of scrates zico falco and der is remembered as perhaps the greatest team never to win a world cup
",world cup held spain brazil tournament favorites easily moved early draw defeat barcelona italy classic world cup match eliminated tournament match refer sarris tragedy referencing stadiums team midfield scrates zico falco der remembered greatest team win world cup,9.39,"world,cup,held,spain,brazil,tournament,favorites,easily,moved,early,draw,defeat,barcelona,italy,classic,world,cup,match,eliminated,tournament,match,refer,sarris,tragedy,referencing,stadiums,team,midfield,scrates,zico,falco,der,remembered,greatest,team,win,world,cup",0.00,brazil
"several players including scrates and zico from  returned to play at the  world cup in mexico brazil still a very good team and more disciplined defensively than four years earlier met the michel platini led france in the quarter finals in a classic of total football the game played to a  draw in regulation time and after a goalless extra time it all came down to a penalty shoot out where brazil was defeated 
",players including scrates zico returned play world cup mexico brazil good team disciplined defensively years earlier met michel platini led france quarter finals classic total football game played draw regulation time goalless extra time came penalty shoot brazil defeated,8.47,"players,including,scrates,zico,returned,play,world,cup,mexico,brazil,good,team,disciplined,defensively,years,earlier,met,michel,platini,led,france,quarter,finals,classic,total,football,game,played,draw,regulation,time,goalless,extra,time,came,penalty,shoot,brazil,defeated",0.00,brazil
"after a  year hiatus brazil was victorious in the  copa amrica this being their fourth victory in four tournaments hosted in brazil this achievement ended brazils  year streak absent a championship the last one had been in the  world cup
",year hiatus brazil victorious copa amrica fourth victory tournaments hosted brazil achievement ended brazils year streak absent championship world cup,8.40,"year,hiatus,brazil,victorious,copa,amrica,fourth,victory,tournaments,hosted,brazil,achievement,ended,brazils,year,streak,absent,championship,world,cup",0.00,brazil
"at the  world cup in italy brazil was coached by sebastio lazaroni that had been the coach in the  copa amrica with a defensive scheme whose main symbol was midfielder dunga forward careca and three centre backs the team lacked creativity but made it to the second round brazil was eliminated by diego maradona led argentina in the round of  in turin losing to their south american archrivals 
",world cup italy brazil coached sebastio lazaroni coach copa amrica defensive scheme main symbol midfielder dunga forward careca centre backs team lacked creativity second round brazil eliminated diego maradona led argentina round turin losing south american archrivals,7.87,"world,cup,italy,brazil,coached,sebastio,lazaroni,coach,copa,amrica,defensive,scheme,main,symbol,midfielder,dunga,forward,careca,centre,backs,team,lacked,creativity,second,round,brazil,eliminated,diego,maradona,led,argentina,round,turin,losing,south,american,archrivals",0.00,brazil
"brazil went  years without winning a world cup or even participating in a final their struggles ended at the  tournament in the united states where a solid side headed by romrio and bebeto in attack captain dunga in midfield goalkeeper cludio taffarel and defender jorginho won the world cup for a then record fourth time highlights of their campaign included a  victory over the united states in the round of  at stanford university a  win over the netherlands in the quarter finals in dallas and a  victory over sweden in the semi finals at pasadenas rose bowl this set up brazilitaly in the final in pasadena a game played in searing heat which ended as a goalless draw with italys defence led by franco baresi keeping out romrio penalty kicks loomed and brazil became champions with roberto baggio missing italys last penalty despite the triumph the  world cup winning team is not held in the same high esteem in brazil as their other world cup winning teams fourfourtwo magazine labelled the  team unloved in brazil due to their pragmatic defensive style over the more typical brazilian style of attacking flair
",brazil went years winning world cup participating final struggles ended tournament united states solid headed romrio bebeto attack captain dunga midfield goalkeeper cludio taffarel defender jorginho world cup record fourth time highlights campaign included victory united states round stanford university win netherlands quarter finals dallas victory sweden semi finals pasadenas rose bowl set brazilitaly final pasadena game played searing heat ended goalless draw italys defence led franco baresi keeping romrio penalty kicks loomed brazil champions roberto baggio missing italys penalty despite triumph world cup winning team held high esteem brazil world cup winning teams fourfourtwo magazine labelled team unloved brazil pragmatic defensive style typical brazilian style attacking flair,7.34,"brazil,went,years,winning,world,cup,participating,final,struggles,ended,tournament,united,states,solid,headed,romrio,bebeto,attack,captain,dunga,midfield,goalkeeper,cludio,taffarel,defender,jorginho,world,cup,record,fourth,time,highlights,campaign,included,victory,united,states,round,stanford,university,win,netherlands,quarter,finals,dallas,victory,sweden,semi,finals,pasadenas,rose,bowl,set,brazilitaly,final,pasadena,game,played,searing,heat,ended,goalless,draw,italys,defence,led,franco,baresi,keeping,romrio,penalty,kicks,loomed,brazil,champions,roberto,baggio,missing,italys,penalty,despite,triumph,world,cup,winning,team,held,high,esteem,brazil,world,cup,winning,teams,fourfourtwo,magazine,labelled,team,unloved,brazil,pragmatic,defensive,style,typical,brazilian,style,attacking,flair",0.00,brazil
"entering the  world cup as defending champions brazil finished runner up having topped their group and won the next two rounds brazil beat the netherlands on penalties in the semi final following a  draw player of the tournament ronaldo scored four goals and made three assists en route to the final the build up to the final itself was overshadowed by ronaldo suffering a convulsive fit only hours before kick off the starting line up without ronaldo was released to a shocked world media but after pleading that he felt fine and requested to play ronaldo was reinstated by the coach before giving a below par performance as france led by zidane won 
",entering world cup defending champions brazil finished runner topped group rounds brazil beat netherlands penalties semi final following draw player tournament ronaldo scored goals assists en route final build final overshadowed ronaldo suffering convulsive fit hours kick starting line ronaldo released shocked world media pleading felt fine requested play ronaldo reinstated coach giving par performance france led zidane,8.44,"entering,world,cup,defending,champions,brazil,finished,runner,topped,group,rounds,brazil,beat,netherlands,penalties,semi,final,following,draw,player,tournament,ronaldo,scored,goals,assists,en,route,final,build,final,overshadowed,ronaldo,suffering,convulsive,fit,hours,kick,starting,line,ronaldo,released,shocked,world,media,pleading,felt,fine,requested,play,ronaldo,reinstated,coach,giving,par,performance,france,led,zidane",0.00,brazil
