Unclean,Clean,Noise_Pre_Processing,Training_Data,Noise_Post_Processing,Query
"fuelled by the three rs  brazil won its fifth championship at the  world cup held in south korea and japan brazil beat all three opponents in group play in south korea and topped the group in brazils opening game against turkey in ulsan rivaldo fell to the ground clutching his face after turkeys hakan nsal had kicked the ball at his legs rivaldo escaped suspension but was fined  for play acting and became the first player ever to be punished in fifas crackdown on diving in their knockout round matches in japan brazil defeated belgium  in kobe in the round of  brazil defeated england  in the quarter finals in shizuoka with the winning goal coming from an unexpected free kick by ronaldinho from  yards out the semi final was against turkey in saitama brazil won  the final was between germany and brazil in yokohama where ronaldo scored two goals in brazils  triumph ronaldo also won the golden shoe as the tournaments leading scorer with  goals brazils success saw them receive the laureus world sports award for team of the year
",fuelled rs brazil fifth championship world cup held south korea japan brazil beat opponents group play south korea topped group brazils opening game turkey ulsan rivaldo fell ground clutching face turkeys hakan nsal kicked ball legs rivaldo escaped suspension fined play acting player punished fifas crackdown diving knockout round matches japan brazil defeated belgium kobe round brazil defeated england quarter finals shizuoka winning goal coming unexpected free kick ronaldinho yards semi final turkey saitama brazil final germany brazil yokohama ronaldo scored goals brazils triumph ronaldo golden shoe tournaments leading scorer goals brazils success saw receive laureus world sports award team year,7.61,"fuelled,rs,brazil,fifth,championship,world,cup,held,south,korea,japan,brazil,beat,opponents,group,play,south,korea,topped,group,brazils,opening,game,turkey,ulsan,rivaldo,fell,ground,clutching,face,turkeys,hakan,nsal,kicked,ball,legs,rivaldo,escaped,suspension,fined,play,acting,player,punished,fifas,crackdown,diving,knockout,round,matches,japan,brazil,defeated,belgium,kobe,round,brazil,defeated,england,quarter,finals,shizuoka,winning,goal,coming,unexpected,free,kick,ronaldinho,yards,semi,final,turkey,saitama,brazil,final,germany,brazil,yokohama,ronaldo,scored,goals,brazils,triumph,ronaldo,golden,shoe,tournaments,leading,scorer,goals,brazils,success,saw,receive,laureus,world,sports,award,team,year",0.00,brazil
"brazil won the  copa amrica their third win in four competitions since 
brazil also won the  fifa confederations cup for the second time manager carlos alberto parreira built his side through a  formation nicknamed the magic quartet the attack was built around four players ronaldo adriano kak and ronaldinho
",brazil copa amrica win competitions brazil fifa confederations cup second time manager carlos alberto parreira built formation nicknamed magic quartet attack built players ronaldo adriano kak ronaldinho,7.12,"brazil,copa,amrica,win,competitions,brazil,fifa,confederations,cup,second,time,manager,carlos,alberto,parreira,built,formation,nicknamed,magic,quartet,attack,built,players,ronaldo,adriano,kak,ronaldinho",0.00,brazil
"in the  world cup brazil won its first two games against croatia  and australia  in the final group game against japan brazil won  ronaldo scored twice and equalled the record for the most goals scored across all world cups in the round of  brazil beat ghana  ronaldos goal was his th in world cup history breaking the record brazil however was eliminated in the quarter finals against france losing  to a thierry henry goal
",world cup brazil games croatia australia final group game japan brazil ronaldo scored twice equalled record goals scored world cups round brazil beat ghana ronaldos goal th world cup history breaking record brazil eliminated quarter finals france losing thierry henry goal,7.76,"world,cup,brazil,games,croatia,australia,final,group,game,japan,brazil,ronaldo,scored,twice,equalled,record,goals,scored,world,cups,round,brazil,beat,ghana,ronaldos,goal,th,world,cup,history,breaking,record,brazil,eliminated,quarter,finals,france,losing,thierry,henry,goal",0.00,brazil
"dunga was hired as brazils new team manager in  brazil then won the  copa amrica where forward robinho was awarded the golden boot and named the tournaments best player two years later brazil won the  fifa confederations cup defeating the yous  in the final to seal their third confederations cup title kak was named as the player of the tournament while striker lus fabiano won the top goalscorer award
",dunga hired brazils new team manager brazil copa amrica forward robinho awarded golden boot named tournaments best player years later brazil fifa confederations cup defeating yous final seal confederations cup title kak named player tournament striker lus fabiano goalscorer award,7.18,"dunga,hired,brazils,new,team,manager,brazil,copa,amrica,forward,robinho,awarded,golden,boot,named,tournaments,best,player,years,later,brazil,fifa,confederations,cup,defeating,yous,final,seal,confederations,cup,title,kak,named,player,tournament,striker,lus,fabiano,goalscorer,award",0.00,brazil
"at the  world cup in south africa brazil won their first two matches against north korea  and the ivory coast  respectively their last match against portugal ended in a  draw they faced chile in the round of  winning  although in the quarter final they fell to the netherlands 
",world cup south africa brazil matches north korea ivory coast respectively match portugal ended draw faced chile round winning quarter final fell netherlands,8.99,"world,cup,south,africa,brazil,matches,north,korea,ivory,coast,respectively,match,portugal,ended,draw,faced,chile,round,winning,quarter,final,fell,netherlands",0.00,brazil
"in july  mano menezes was named as brazils new coach at the  copa amrica brazil lost against paraguay and was eliminated in the quarter finals on  july  due to a lack of competitive matches because the team had automatically qualified for the  world cup as tournament hosts brazil was ranked th in the fifa ranking
",july mano menezes named brazils new coach copa amrica brazil lost paraguay eliminated quarter finals july lack competitive matches team automatically qualified world cup tournament hosts brazil ranked th fifa ranking,7.62,"july,mano,menezes,named,brazils,new,coach,copa,amrica,brazil,lost,paraguay,eliminated,quarter,finals,july,lack,competitive,matches,team,automatically,qualified,world,cup,tournament,hosts,brazil,ranked,th,fifa,ranking",0.00,brazil
"on  june  brazil was ranked nd in the fifa ranking their lowest ever rank brazil entered the  confederations cup with the objective of defending their title in the final brazil faced spain winning  and sealing their fourth confederations cup title neymar was named player of the tournament and received the golden ball award and the adidas bronze shoe and jlio csar won the golden glove award for the best goalkeeper of the tournament
",june brazil ranked nd fifa ranking lowest rank brazil entered confederations cup objective defending title final brazil faced spain winning sealing fourth confederations cup title neymar named player tournament received golden ball award adidas bronze shoe jlio csar golden glove award best goalkeeper tournament,6.67,"june,brazil,ranked,nd,fifa,ranking,lowest,rank,brazil,entered,confederations,cup,objective,defending,title,final,brazil,faced,spain,winning,sealing,fourth,confederations,cup,title,neymar,named,player,tournament,received,golden,ball,award,adidas,bronze,shoe,jlio,csar,golden,glove,award,best,goalkeeper,tournament",0.00,brazil
"in the opening match of the  world cup against croatia two goals from neymar and one from oscar saw the seleo off to a winning start in their first world cup on home soil in  years the team then drew with mexico before confirming qualification to the knockout stage by defeating cameroon  with neymar again scoring twice and fred and fernandinho providing further goals brazil faced chile in the round of  taking an th minute lead through david luizs first goal for the seleo in a  draw brazil prevailed  on penalties with neymar david luiz and marcelo converting their kicks and goalkeeper jlio csar saving three times
",opening match world cup croatia goals neymar oscar saw seleo winning start world cup home soil years team drew mexico confirming qualification knockout stage defeating cameroon neymar scoring twice fred fernandinho providing goals brazil faced chile round taking th minute lead david luizs goal seleo draw brazil prevailed penalties neymar david luiz marcelo converting kicks goalkeeper jlio csar saving times,7.58,"opening,match,world,cup,croatia,goals,neymar,oscar,saw,seleo,winning,start,world,cup,home,soil,years,team,drew,mexico,confirming,qualification,knockout,stage,defeating,cameroon,neymar,scoring,twice,fred,fernandinho,providing,goals,brazil,faced,chile,round,taking,th,minute,lead,david,luizs,goal,seleo,draw,brazil,prevailed,penalties,neymar,david,luiz,marcelo,converting,kicks,goalkeeper,jlio,csar,saving,times",0.00,brazil
"the team again faced south american opposition in the quarter final defeating colombia  with goals from central defenders david luiz and the team captain thiago silva late in the match neymar was stretchered off after juan camilo zigas knee had made contact with the forwards back neymar was taken to hospital and was diagnosed with a fractured vertebra ruling him out for the remainder of the tournament prior to this neymar had scored four goals provided one assist and been named man of the match twice brazil faced further problems ahead of their semi final against germany as thiago silva was to serve a one match suspension for receiving his second yellow card of the tournament in the quarter final
",team faced south american opposition quarter final defeating colombia goals central defenders david luiz team captain thiago silva late match neymar stretchered juan camilo zigas knee contact forwards neymar taken hospital diagnosed fractured vertebra ruling remainder tournament prior neymar scored goals provided assist named man match twice brazil faced problems ahead semi final germany thiago silva serve match suspension receiving second yellow card tournament quarter final,7.65,"team,faced,south,american,opposition,quarter,final,defeating,colombia,goals,central,defenders,david,luiz,team,captain,thiago,silva,late,match,neymar,stretchered,juan,camilo,zigas,knee,contact,forwards,neymar,taken,hospital,diagnosed,fractured,vertebra,ruling,remainder,tournament,prior,neymar,scored,goals,provided,assist,named,man,match,twice,brazil,faced,problems,ahead,semi,final,germany,thiago,silva,serve,match,suspension,receiving,second,yellow,card,tournament,quarter,final",0.00,brazil
"the seleo went on to lose  to the germans  their biggest ever defeat at the world cup and first home loss in a competitive match since  towards the end of the match the home crowd began to old each pass from the german team and booed their own players off the pitch after the final whistle the match has been nicknamed the mineirazo making reference to the nations previous world cup defeat on home soil the maracanazo against uruguay in  and the estdio do mineiro where the match took place brazil subsequently lost  to the netherlands in the third place play off match the team ended the tournament with the worst defensive record of the  competing nations having conceded  goals the only other countries to concede  or more goals in the current world cup format are north korea and saudi arabia following these results scolari announced his resignation
",seleo went lose germans biggest defeat world cup home loss competitive match end match home crowd began old pass german team booed players pitch final whistle match nicknamed mineirazo making reference nations previous world cup defeat home soil maracanazo uruguay estdio mineiro match took place brazil subsequently lost netherlands place play match team ended tournament worst defensive record competing nations conceded goals countries concede goals current world cup format north korea saudi arabia following results scolari announced resignation,8.18,"seleo,went,lose,germans,biggest,defeat,world,cup,home,loss,competitive,match,end,match,home,crowd,began,old,pass,german,team,booed,players,pitch,final,whistle,match,nicknamed,mineirazo,making,reference,nations,previous,world,cup,defeat,home,soil,maracanazo,uruguay,estdio,mineiro,match,took,place,brazil,subsequently,lost,netherlands,place,play,match,team,ended,tournament,worst,defensive,record,competing,nations,conceded,goals,countries,concede,goals,current,world,cup,format,north,korea,saudi,arabia,following,results,scolari,announced,resignation",0.00,brazil
"on  july  dunga was announced as the new manager of brazil returning to the position for the first time since the teams exit at the  world cup
",july dunga announced new manager brazil returning position time teams exit world cup,9.79,"july,dunga,announced,new,manager,brazil,returning,position,time,teams,exit,world,cup",0.00,brazil
"dungas first match in his second reign as brazils manager was a friendly match against  world cup quarter finalists colombia at sun life stadium in miami on  september  with brazil winning the match  through an rd minute neymar free kick goal dunga followed this up with wins against ecuador  in the  superclsico de las amricas against argentina  against japan  against turkey  and against austria  dunga continued brazils winning streak in  by defeating france  in another friendly they followed this with wins against chile  mexico  and honduras 
",dungas match second reign brazils manager friendly match world cup quarter finalists colombia sun life stadium miami september brazil winning match rd minute neymar free kick goal dunga followed wins ecuador superclsico de las amricas argentina japan turkey austria dunga continued brazils winning streak defeating france friendly followed wins chile mexico honduras,6.19,"dungas,match,second,reign,brazils,manager,friendly,match,world,cup,quarter,finalists,colombia,sun,life,stadium,miami,september,brazil,winning,match,rd,minute,neymar,free,kick,goal,dunga,followed,wins,ecuador,superclsico,de,las,amricas,argentina,japan,turkey,austria,dunga,continued,brazils,winning,streak,defeating,france,friendly,followed,wins,chile,mexico,honduras",0.00,brazil
"brazil started the tournament with a victory against peru after coming from behind by   followed by a  defeat against colombia and a  victory against venezuela in the knockout stage brazil faced paraguay and was eliminated after drawing  in normal time and losing  in the penalty shootout as such brazil was unable to qualify for a fifa confederations cup  for the first time in almost  years
",brazil started tournament victory peru coming followed defeat colombia victory venezuela knockout stage brazil faced paraguay eliminated drawing normal time losing penalty shootout brazil unable qualify fifa confederations cup time years,8.65,"brazil,started,tournament,victory,peru,coming,followed,defeat,colombia,victory,venezuela,knockout,stage,brazil,faced,paraguay,eliminated,drawing,normal,time,losing,penalty,shootout,brazil,unable,qualify,fifa,confederations,cup,time,years",0.00,brazil
"brazil began the  copa amrica centenario with a scoreless draw against ecuador with the ecuadorians having a goal wrongly disallowed in the second half this was followed by an emphatic  victory over haiti with philippe coutinho scoring a hat trick needing only a draw to progress to the knockout stage of the tournament brazil suffered a controversial  loss to peru with ral ruidaz scoring in the th minute by guiding the ball into the net with his arm this loss brazils first loss to peru since  saw brazil eliminated from the tournament in the group stage for the first time since 
",brazil began copa amrica centenario scoreless draw ecuador ecuadorians goal wrongly disallowed second half followed emphatic victory haiti philippe coutinho scoring hat trick needing draw progress knockout stage tournament brazil suffered controversial loss peru ral ruidaz scoring th minute guiding ball net arm loss brazils loss peru saw brazil eliminated tournament group stage time,8.05,"brazil,began,copa,amrica,centenario,scoreless,draw,ecuador,ecuadorians,goal,wrongly,disallowed,second,half,followed,emphatic,victory,haiti,philippe,coutinho,scoring,hat,trick,needing,draw,progress,knockout,stage,tournament,brazil,suffered,controversial,loss,peru,ral,ruidaz,scoring,th,minute,guiding,ball,net,arm,loss,brazils,loss,peru,saw,brazil,eliminated,tournament,group,stage,time",0.00,brazil
"on  june  tite replaced dunga as manager of brazil tite who had managed corinthians the  brazilian champions and  club world cup champions was confirmed as his replacement six days later tites debut was marked with a  away victory against ecuador on  september followed by a  win over colombia a  win against bolivia and a  victory away against venezuela bringing brazil to the top of the world cup qualifiers leaderboard for the first time since  brazil then defeated paraguay  to become the first team other than the hosts russia to qualify for the  world cup
",june tite replaced dunga manager brazil tite managed corinthians brazilian champions club world cup champions confirmed replacement days later tites debut marked away victory ecuador september followed win colombia win bolivia victory away venezuela bringing brazil world cup qualifiers leaderboard time brazil defeated paraguay team hosts russia qualify world cup,7.83,"june,tite,replaced,dunga,manager,brazil,tite,managed,corinthians,brazilian,champions,club,world,cup,champions,confirmed,replacement,days,later,tites,debut,marked,away,victory,ecuador,september,followed,win,colombia,win,bolivia,victory,away,venezuela,bringing,brazil,world,cup,qualifiers,leaderboard,time,brazil,defeated,paraguay,team,hosts,russia,qualify,world,cup",0.00,brazil
"brazil started their  world cup campaign with a draw against switzerland  brazils goal coming from a  yard bending strike from philippe coutinho  their first non win in an opener since  in the following match against costa rica on  june goals from coutinho and neymar in stoppage time saw brazil win  they won their final group game  over serbia with goals from paulinho and thiago silva meaning qualification for the last  as group winners on  july goals from neymar and roberto firmino saw brazil  win over mexico to advance to the quarter finals on  july brazil were eliminated from the  world cup by belgium in the quarter finals losing  with fernandinho scoring an own goal for belgium while renato augusto scored the only goal for brazil
",brazil started world cup campaign draw switzerland brazils goal coming yard bending strike philippe coutinho non win opener following match costa rica june goals coutinho neymar stoppage time saw brazil win final group game serbia goals paulinho thiago silva meaning qualification group winners july goals neymar roberto firmino saw brazil win mexico advance quarter finals july brazil eliminated world cup belgium quarter finals losing fernandinho scoring goal belgium renato augusto scored goal brazil,6.99,"brazil,started,world,cup,campaign,draw,switzerland,brazils,goal,coming,yard,bending,strike,philippe,coutinho,non,win,opener,following,match,costa,rica,june,goals,coutinho,neymar,stoppage,time,saw,brazil,win,final,group,game,serbia,goals,paulinho,thiago,silva,meaning,qualification,group,winners,july,goals,neymar,roberto,firmino,saw,brazil,win,mexico,advance,quarter,finals,july,brazil,eliminated,world,cup,belgium,quarter,finals,losing,fernandinho,scoring,goal,belgium,renato,augusto,scored,goal,brazil",0.00,brazil
"in spite of world cup failure the cbf continued to trust tite and allowed him to continue his job as coach of brazil for the  copa amrica held at home however brazilian perpetration for the tournament at home was hampered by the injury of neymar in a friendly match where brazil thrashed  afc asian cup champions qatar  despite this loss tite managed brazil to their first copa amrica title since  brazil overcame bolivia  after a goalless first half and peru in a celebratory  demolition between these matches brazil drew venezuela in a  draw with three goals ruled out by var brazil met paraguay in the quarter finals where they won a  penalty shootout after a goalless draw in the semi finals brazil beat neighboring argentina  to set up a rematch with peru in the final brazil managed to defeat the peruvians once again  to conquer their ninth copa amrica title
",spite world cup failure cbf continued trust tite allowed continue job coach brazil copa amrica held home brazilian perpetration tournament home hampered injury neymar friendly match brazil thrashed afc asian cup champions qatar despite loss tite managed brazil copa amrica title brazil overcame bolivia goalless half peru celebratory demolition matches brazil drew venezuela draw goals ruled var brazil met paraguay quarter finals penalty shootout goalless draw semi finals brazil beat neighboring argentina set rematch peru final brazil managed defeat peruvians conquer ninth copa amrica title,7.51,"spite,world,cup,failure,cbf,continued,trust,tite,allowed,continue,job,coach,brazil,copa,amrica,held,home,brazilian,perpetration,tournament,home,hampered,injury,neymar,friendly,match,brazil,thrashed,afc,asian,cup,champions,qatar,despite,loss,tite,managed,brazil,copa,amrica,title,brazil,overcame,bolivia,goalless,half,peru,celebratory,demolition,matches,brazil,drew,venezuela,draw,goals,ruled,var,brazil,met,paraguay,quarter,finals,penalty,shootout,goalless,draw,semi,finals,brazil,beat,neighboring,argentina,set,rematch,peru,final,brazil,managed,defeat,peruvians,conquer,ninth,copa,amrica,title",0.00,brazil
"on  june  brazil beat paraguay  in a world cup qualifier in asuncin  the first time they had won in the country since  in the  world cup brazil finished first in their group having beaten serbia  switzerland  and losing  to cameroon the team then faced south korea in the round of  winning with a  goal margin and progressed to the quarterfinals where they eventually lost  on penalties to croatia following their exit from the world cup tite resigned as head coach
",june brazil beat paraguay world cup qualifier asuncin time country world cup brazil finished group beaten serbia switzerland losing cameroon team faced south korea round winning goal margin progressed quarterfinals eventually lost penalties croatia following exit world cup tite resigned head coach,8.15,"june,brazil,beat,paraguay,world,cup,qualifier,asuncin,time,country,world,cup,brazil,finished,group,beaten,serbia,switzerland,losing,cameroon,team,faced,south,korea,round,winning,goal,margin,progressed,quarterfinals,eventually,lost,penalties,croatia,following,exit,world,cup,tite,resigned,head,coach",0.00,brazil
"brazils first team colors were white with blue collars but following the defeat at maracan in the  world cup the colors were criticised for lacking patriotism with permission from the brazilian sports confederation the newspaper correio da manh held a competition to design a new kit incorporating the four colors of the brazilian flag the winning design was a yellow jersey with green trim and blue shorts with the white trim drawn by aldyr garcia schlee a nineteen year old from pelotas the new colors were first used in march  in a match against chile and have been used ever since topper were the manufacturers of brazils kit up to and including the match against wales on  september  umbro took over before the next match versus yugoslavia in october  nike began making brazil kits in late  in time for the  copa amrica and the  world cup
",brazils team colors white blue collars following defeat maracan world cup colors criticised lacking patriotism permission brazilian sports confederation newspaper correio da manh held competition design new kit incorporating colors brazilian flag winning design yellow jersey green trim blue shorts white trim drawn aldyr garcia schlee nineteen year old pelotas new colors march match chile topper manufacturers brazils kit including match wales september umbro took match versus yugoslavia october nike began making brazil kits late time copa amrica world cup,7.82,"brazils,team,colors,white,blue,collars,following,defeat,maracan,world,cup,colors,criticised,lacking,patriotism,permission,brazilian,sports,confederation,newspaper,correio,da,manh,held,competition,design,new,kit,incorporating,colors,brazilian,flag,winning,design,yellow,jersey,green,trim,blue,shorts,white,trim,drawn,aldyr,garcia,schlee,nineteen,year,old,pelotas,new,colors,march,match,chile,topper,manufacturers,brazils,kit,including,match,wales,september,umbro,took,match,versus,yugoslavia,october,nike,began,making,brazil,kits,late,time,copa,amrica,world,cup",0.00,brazil
