Unclean,Clean,Noise_Pre_Processing,Training_Data,Noise_Post_Processing,Query
"the foreign affairs policies of the monarchy dealt with issues with the countries of the southern cone with whom brazil had borders long after the cisplatine war that resulted in the independence of uruguay brazil won three international wars during the  year reign of pedro ii these were the platine war the uruguayan war and the devastating paraguayan war the largest war effort in brazilian history
",foreign affairs policies monarchy dealt issues countries southern cone brazil borders long cisplatine war resulted independence uruguay brazil international wars year reign pedroii platine war uruguayan war devastating paraguayan war largest war effort brazilian history,7.46,"foreign,affairs,policies,monarchy,dealt,issues,countries,southern,cone,brazil,borders,long,cisplatine,war,resulted,independence,uruguay,brazil,international,wars,year,reign,pedroii,platine,war,uruguayan,war,devastating,paraguayan,war,largest,war,effort,brazilian,history",0.00,brazil
"throughout world war ii brazil remained neutral until august  brazil suffered retaliation by nazi germany and fascist italy in a strategic dispute over the south atlantic and therefore entered on the allied side in addition to its participation in the battle of the atlantic brazil also sent an expeditionary force to fight in the italian campaign
",world war ii brazil remained neutral august brazil suffered retaliation nazi germany fascist italy strategic dispute south atlantic entered allied addition participation battle atlantic brazil sent expeditionary force fight italian campaign,7.18,"world,war,ii,brazil,remained,neutral,august,brazil,suffered,retaliation,nazi,germany,fascist,italy,strategic,dispute,south,atlantic,entered,allied,addition,participation,battle,atlantic,brazil,sent,expeditionary,force,fight,italian,campaign",0.00,brazil
"the new regime was intended to be transitory but gradually closed in on itself and became a full dictatorship with the promulgation of the fifth institutional act in  oppression was not limited to those who resorted to guerrilla tactics to fight the regime but also reached institutional opponents artists journalists and other members of civil society inside and outside the country through the infamous operation condor like other brutal authoritarian regimes due to an economic boom known as an economic miracle the regime reached a peak in popularity in the early s slowly however the wear and tear of years of dictatorial power that had not slowed the repression even after the defeat of the leftist guerrillas plus the inability to deal with the economic crises of the period and popular pressure made an opening policy inevitable which from the regime side was led by generals ernesto geisel and golbery do couto e silva with the enactment of the amnesty law in  brazil began a slow return to democracy which was completed during the s
",new regime intended transitory gradually closed dictatorship promulgation fifth institutional act oppression limited resorted guerrilla tactics fight regime reached institutional opponents artists journalists members civil society inside outside country infamous operation condor like brutal authoritarian regimes economic boom known economic miracle regime reached peak popularity early slowly wear tear years dictatorial power slowed repression defeat leftist guerrillas plus inability deal economic crises period popular pressure opening policy inevitable regime led generals ernesto geisel golbery couto e silva enactment amnesty law brazil began slow return democracy completed,8.53,"new,regime,intended,transitory,gradually,closed,dictatorship,promulgation,fifth,institutional,act,oppression,limited,resorted,guerrilla,tactics,fight,regime,reached,institutional,opponents,artists,journalists,members,civil,society,inside,outside,country,infamous,operation,condor,like,brutal,authoritarian,regimes,economic,boom,known,economic,miracle,regime,reached,peak,popularity,early,slowly,wear,tear,years,dictatorial,power,slowed,repression,defeat,leftist,guerrillas,plus,inability,deal,economic,crises,period,popular,pressure,opening,policy,inevitable,regime,led,generals,ernesto,geisel,golbery,couto,e,silva,enactment,amnesty,law,brazil,began,slow,return,democracy,completed",0.00,brazil
"the peaceful transition of power from cardoso to his main opposition leader luiz incio lula da silva  was seen as proof that brazil had achieved a long sought political stability however sparked by indignation and frustrations accumulated over decades from corruption police brutality inefficiencies of the political establishment and public service numerous peaceful protests erupted in brazil from the middle of first term of dilma rousseff who had succeeded lula after winning election in  and again in  by narrow margins
",peaceful transition power cardoso main opposition leader luiz incio lula da silva seen proof brazil achieved long sought political stability sparked indignation frustrations accumulated decades corruption police brutality inefficiencies political establishment public service numerous peaceful protests erupted brazil middle term dilma rousseff succeeded lula winning election narrow margins,6.10,"peaceful,transition,power,cardoso,main,opposition,leader,luiz,incio,lula,da,silva,seen,proof,brazil,achieved,long,sought,political,stability,sparked,indignation,frustrations,accumulated,decades,corruption,police,brutality,inefficiencies,political,establishment,public,service,numerous,peaceful,protests,erupted,brazil,middle,term,dilma,rousseff,succeeded,lula,winning,election,narrow,margins",0.00,brazil
"in the fiercely disputed  elections the controversial conservative candidate jair bolsonaro of the social liberal party  was elected president winning in the second round fernando haddad of the workers party  with the support of  of the valid votes in the early s brazil became one of the hardest hit countries during the covid  pandemic receiving the second highest death toll worldwide after the united states experts have largely blamed the situation on the leadership of president bolsonaro who throughout the pandemic has repeatedly downplayed the threat of covid  and dissuaded states and cities from enforcing quarantine measures prioritizing the nations economy
",fiercely disputed elections controversial conservative candidate jair bolsonaro social liberal party elected president winning second round fernando haddad workers party support valid votes early brazil hardest hit countries covid pandemic receiving second highest death toll worldwide united states experts largely blamed situation leadership president bolsonaro pandemic repeatedly downplayed threat covid dissuaded states cities enforcing quarantine measures prioritizing nations economy,6.27,"fiercely,disputed,elections,controversial,conservative,candidate,jair,bolsonaro,social,liberal,party,elected,president,winning,second,round,fernando,haddad,workers,party,support,valid,votes,early,brazil,hardest,hit,countries,covid,pandemic,receiving,second,highest,death,toll,worldwide,united,states,experts,largely,blamed,situation,leadership,president,bolsonaro,pandemic,repeatedly,downplayed,threat,covid,dissuaded,states,cities,enforcing,quarantine,measures,prioritizing,nations,economy",0.00,brazil
"brazil occupies a large area along the eastern coast of south america and includes much of the continents interior sharing land borders with uruguay to the south argentina and paraguay to the southwest bolivia and peru to the west colombia to the northwest and venezuela guyana suriname and france  to the north it shares a border with every south american country except ecuador and chile
",brazil occupies large area eastern coast south america includes continents interior sharing land borders uruguay south argentina paraguay southwest bolivia peru west colombia northwest venezuela guyana suriname france north shares border south american country ecuador chile,7.44,"brazil,occupies,large,area,eastern,coast,south,america,includes,continents,interior,sharing,land,borders,uruguay,south,argentina,paraguay,southwest,bolivia,peru,west,colombia,northwest,venezuela,guyana,suriname,france,north,shares,border,south,american,country,ecuador,chile",0.00,brazil
"it also encompasses a number of oceanic archipelagos such as fernando de noronha rocas atoll saint peter and paul rocks and trindade and martim vaz its size relief climate and natural resources make brazil geographically diverse including its atlantic islands brazil lies between latitudes n and s and longitudes  and w
",encompasses number oceanic archipelagos fernando de noronha rocas atoll saint peter paul rocks trindade martim vaz size relief climate natural resources brazil geographically diverse including atlantic islands brazil lies latitudes n longitudes w,5.62,"encompasses,number,oceanic,archipelagos,fernando,de,noronha,rocas,atoll,saint,peter,paul,rocks,trindade,martim,vaz,size,relief,climate,natural,resources,brazil,geographically,diverse,including,atlantic,islands,brazil,lies,latitudes,n,longitudes,w",0.00,brazil
"brazil is the fifth largest country in the world and third largest in the americas with a total area of  km  including  km  of water north to south brazil is also the longest country in the world spanning  km  from north to south and the only country in the world that has the equator and the tropic of capricorn running through it
",brazil fifth largest country world largest americas total area km including km water north south brazil longest country world spanning km north south country world equator tropic capricorn running,9.94,"brazil,fifth,largest,country,world,largest,americas,total,area,km,including,km,water,north,south,brazil,longest,country,world,spanning,km,north,south,country,world,equator,tropic,capricorn,running",0.00,brazil
"the southeastern section is more rugged with a complex mass of ridges and mountain ranges reaching elevations of up to  meters  these ranges include the mantiqueira and espinhao mountains and the serra do march in the north the guiana highlands form a major drainage divide separating rivers that flow south into the amazon basin from rivers that empty into the orinoco river system in venezuela to the north the highest point in brazil is the pico da neblina at  meters  and the lowest is the atlantic ocean
",southeastern section rugged complex mass ridges mountain ranges reaching elevations meters ranges include mantiqueira espinhao mountains serra march north guiana highlands form major drainage divide separating rivers flow south amazon basin rivers orinoco river system venezuela north highest point brazil pico da neblina meters lowest atlantic ocean,7.86,"southeastern,section,rugged,complex,mass,ridges,mountain,ranges,reaching,elevations,meters,ranges,include,mantiqueira,espinhao,mountains,serra,march,north,guiana,highlands,form,major,drainage,divide,separating,rivers,flow,south,amazon,basin,rivers,orinoco,river,system,venezuela,north,highest,point,brazil,pico,da,neblina,meters,lowest,atlantic,ocean",0.00,brazil
"brazil has a dense and complex system of rivers one of the worlds most extensive with eight major drainage basins all of which drain into the atlantic major rivers include the amazon  the paran and its major tributary the iguayou  the negro so francisco xingu madeira and tapajs rivers
",brazil dense complex system rivers worlds extensive major drainage basins drain atlantic major rivers include amazon paran major tributary iguayou negro francisco xingu madeira tapajs rivers,8.04,"brazil,dense,complex,system,rivers,worlds,extensive,major,drainage,basins,drain,atlantic,major,rivers,include,amazon,paran,major,tributary,iguayou,negro,francisco,xingu,madeira,tapajs,rivers",0.00,brazil
"the climate of brazil comprises a wide range of weather conditions across a large area and varied topography but most of the country is tropical according to the kppen system brazil hosts six major climatic subtypes desert equatorial tropical semiarid oceanic and subtropical the different climatic conditions produce environments ranging from equatorial rainforests in the north and semiarid deserts in the northeast to temperate coniferous forests in the south and tropical savannas in central brazil many regions have starkly different microclimates
",climate brazil comprises wide range weather conditions large area varied topography country tropical according kppen system brazil hosts major climatic subtypes desert equatorial tropical semiarid oceanic subtropical different climatic conditions produce environments ranging equatorial rainforests north semiarid deserts northeast temperate coniferous forests south tropical savannas central brazil regions starkly different microclimates,5.42,"climate,brazil,comprises,wide,range,weather,conditions,large,area,varied,topography,country,tropical,according,kppen,system,brazil,hosts,major,climatic,subtypes,desert,equatorial,tropical,semiarid,oceanic,subtropical,different,climatic,conditions,produce,environments,ranging,equatorial,rainforests,north,semiarid,deserts,northeast,temperate,coniferous,forests,south,tropical,savannas,central,brazil,regions,starkly,different,microclimates",0.00,brazil
"an equatorial climate characterizes much of northern brazil there is no real dry season but there are some variations in the period of the year when most rain falls temperatures average  c  with more significant temperature variation between night and day than between seasons
",equatorial climate characterizes northern brazil real dry season variations period year rain falls temperatures average c significant temperature variation night day seasons,7.94,"equatorial,climate,characterizes,northern,brazil,real,dry,season,variations,period,year,rain,falls,temperatures,average,c,significant,temperature,variation,night,day,seasons",0.00,brazil
"over central brazil rainfall is more seasonal characteristic of a savanna climate this region is as extensive as the amazon basin but has a very different climate as it lies farther south at a higher altitude in the interior northeast seasonal rainfall is even more extreme
",central brazil rainfall seasonal characteristic savanna climate region extensive amazon basin different climate lies farther south higher altitude interior northeast seasonal rainfall extreme,8.39,"central,brazil,rainfall,seasonal,characteristic,savanna,climate,region,extensive,amazon,basin,different,climate,lies,farther,south,higher,altitude,interior,northeast,seasonal,rainfall,extreme",0.00,brazil
"in  the government of brazil pledged to reduce its annual greenhouse gases emissions by  by  it also set as indicative target of reaching carbon neutrality by  if the country gets  billion dollars per year
",government brazil pledged reduce annual greenhouse gases emissions set indicative target reaching carbon neutrality country gets billion dollars year,7.28,"government,brazil,pledged,reduce,annual,greenhouse,gases,emissions,set,indicative,target,reaching,carbon,neutrality,country,gets,billion,dollars,year",0.00,brazil
"the wildlife of brazil comprises all naturally occurring animals plants and fungi in the south american country home to  of the amazon rainforest which accounts for approximately one tenth of all                                                      
species in the world brazil is considered to have the greatest biodiversity of any country on the planet containing over  of all animal and plant species catalogued it has the most known species of plants  freshwater fish  and mammals  it also ranks third on the list of countries with the most bird species  and second with the most reptile species  the number of fungal species is unknown but is large brazil is second only to indonesia as the country with the most endemic species
",wildlife brazil comprises naturally occurring animals plants fungi south american country home amazon rainforest accounts approximately tenth species world brazil considered greatest biodiversity country planet containing animal plant species catalogued known species plants freshwater fish mammals ranks list countries bird species second reptile species number fungal species unknown large brazil second indonesia country endemic species,8.17,"wildlife,brazil,comprises,naturally,occurring,animals,plants,fungi,south,american,country,home,amazon,rainforest,accounts,approximately,tenth,species,world,brazil,considered,greatest,biodiversity,country,planet,containing,animal,plant,species,catalogued,known,species,plants,freshwater,fish,mammals,ranks,list,countries,bird,species,second,reptile,species,number,fungal,species,unknown,large,brazil,second,indonesia,country,endemic,species",0.00,brazil
"brazils large territory comprises different ecosystems such as the amazon rainforest recognized as having the greatest biological diversity in the world with the atlantic forest and the cerrado sustaining the greatest biodiversity in the south the araucaria moist forests grow under temperate conditions the rich wildlife of brazil reflects the variety of natural habitats scientists estimate that the total number of plant and animal species in brazil could approach four million mostly invertebrates larger mammals include carnivores pumas jaguars ocelots rare bush dogs and foxes and herbivores peccaries tapirs anteaters sloths opossums and armadillos deer are plentiful in the south and many species of new world monkeys are found in the northern rain forests
",brazils large territory comprises different ecosystems amazon rainforest recognized greatest biological diversity world atlantic forest cerrado sustaining greatest biodiversity south araucaria moist forests grow temperate conditions rich wildlife brazil reflects variety natural habitats scientists estimate total number plant animal species brazil approach million invertebrates larger mammals include carnivores pumas jaguars ocelots rare bush dogs foxes herbivores peccaries tapirs anteaters sloths opossums armadillos deer plentiful south species new world monkeys found northern rain forests,5.36,"brazils,large,territory,comprises,different,ecosystems,amazon,rainforest,recognized,greatest,biological,diversity,world,atlantic,forest,cerrado,sustaining,greatest,biodiversity,south,araucaria,moist,forests,grow,temperate,conditions,rich,wildlife,brazil,reflects,variety,natural,habitats,scientists,estimate,total,number,plant,animal,species,brazil,approach,million,invertebrates,larger,mammals,include,carnivores,pumas,jaguars,ocelots,rare,bush,dogs,foxes,herbivores,peccaries,tapirs,anteaters,sloths,opossums,armadillos,deer,plentiful,south,species,new,world,monkeys,found,northern,rain,forests",0.00,brazil
"more than one fifth of the amazon rainforest in brazil has been completely destroyed and more than  mammals are endangered the threat of extinction comes from several sources including deforestation and poaching extinction is even more problematic in the atlantic forest where nearly  of the forest has been cleared of the  endangered animals in brazil  are in the atlantic forest the amazon rainforest has been under direct threat of deforestation since the s because of rapid economic and demographic expansion extensive legal and illegal logging destroy forests the size of a small country per year and with it a diverse series of species through habitat destruction and habitat fragmentation since  over  square kilometers  of the amazon rainforest have been cleared by logging
",fifth amazon rainforest brazil completely destroyed mammals endangered threat extinction comes sources including deforestation poaching extinction problematic atlantic forest nearly forest cleared endangered animals brazil atlantic forest amazon rainforest direct threat deforestation rapid economic demographic expansion extensive legal illegal logging destroy forests size small country year diverse series species habitat destruction habitat fragmentation square kilometers amazon rainforest cleared logging,8.06,"fifth,amazon,rainforest,brazil,completely,destroyed,mammals,endangered,threat,extinction,comes,sources,including,deforestation,poaching,extinction,problematic,atlantic,forest,nearly,forest,cleared,endangered,animals,brazil,atlantic,forest,amazon,rainforest,direct,threat,deforestation,rapid,economic,demographic,expansion,extensive,legal,illegal,logging,destroy,forests,size,small,country,year,diverse,series,species,habitat,destruction,habitat,fragmentation,square,kilometers,amazon,rainforest,cleared,logging",0.00,brazil
"by  however brazils dramatic policy driven reduction in amazon basin deforestation was a global exception in terms of forest change according to scientific journal science   from  to  compared to all other countries in the world brazil had the largest decline in annual forest loss as indicated in the study using high resolution satellite maps showing global forest cover changes   reversing widespread deforestation from the s to    in  preserved native vegetation occupies  of the brazilian territory agriculture occupied only  of the national territory and pastures  in terms of comparison in  although  of the entire european continent has forests only  of the total forest area in europe is of native forest brazil has a strong interest in conservation as its agriculture sector directly depends on its forests
",brazils dramatic policy driven reduction amazon basin deforestation global exception terms forest change according scientific journal science compared countries world brazil largest decline annual forest loss indicated study high resolution satellite maps showing global forest cover changes reversing widespread deforestation preserved native vegetation occupies brazilian territory agriculture occupied national territory pastures terms comparison entire european continent forests total forest area europe native forest brazil strong interest conservation agriculture sector directly depends forests,6.49,"brazils,dramatic,policy,driven,reduction,amazon,basin,deforestation,global,exception,terms,forest,change,according,scientific,journal,science,compared,countries,world,brazil,largest,decline,annual,forest,loss,indicated,study,high,resolution,satellite,maps,showing,global,forest,cover,changes,reversing,widespread,deforestation,preserved,native,vegetation,occupies,brazilian,territory,agriculture,occupied,national,territory,pastures,terms,comparison,entire,european,continent,forests,total,forest,area,europe,native,forest,brazil,strong,interest,conservation,agriculture,sector,directly,depends,forests",0.00,brazil
"legislative houses in each political entity are the main source of law in brazil the national congress is the federations bicameral legislature consisting of the chamber of deputies and the federal senate judiciary authorities exercise jurisdictional duties almost exclusively in  the economist intelligence units democracy index categorized brazil as a flawed democracy ranking th in the report and freedom house classified it as a free country at freedom in the world report
",legislative houses political entity main source law brazil national congress federations bicameral legislature consisting chamber deputies federal senate judiciary authorities exercise jurisdictional duties exclusively economist intelligence units democracy index categorized brazil flawed democracy ranking th report freedom house classified free country freedom world report,5.87,"legislative,houses,political,entity,main,source,law,brazil,national,congress,federations,bicameral,legislature,consisting,chamber,deputies,federal,senate,judiciary,authorities,exercise,jurisdictional,duties,exclusively,economist,intelligence,units,democracy,index,categorized,brazil,flawed,democracy,ranking,th,report,freedom,house,classified,free,country,freedom,world,report",0.00,brazil
"the political administrative organization of the federative republic of brazil comprises the union the states the federal district and the municipalities the union the states the federal district and the municipalities are the spheres of government the federation is set on five fundamental principles sovereignty citizenship dignity of human beings the social values of labor and freedom of enterprise and political pluralism
",political administrative organization federative republic brazil comprises union states federal district municipalities union states federal district municipalities spheres government federation set fundamental principles sovereignty citizenship dignity human beings social values labor freedom enterprise political pluralism,6.32,"political,administrative,organization,federative,republic,brazil,comprises,union,states,federal,district,municipalities,union,states,federal,district,municipalities,spheres,government,federation,set,fundamental,principles,sovereignty,citizenship,dignity,human,beings,social,values,labor,freedom,enterprise,political,pluralism",0.00,brazil
